ffff88007d8c2500 4121701388 S Ci:1:004:0 s c0 08 0000 0000 0001 1 <
ffff88007d8c2500 4121701934 C Ci:1:004:0 0 1 = ff
ffff88007d8c2500 4121702086 S Ci:1:004:0 s c0 11 0000 0000 0001 1 <
ffff88007d8c2500 4121702582 C Ci:1:004:0 0 1 = 02
ffff88007d8c2500 4121702719 S Ci:1:004:0 s 80 08 0000 0000 0001 1 <
ffff88007d8c2500 4121703097 C Ci:1:004:0 0 1 = 01
ffff88007d17e980 4122219931 C Ii:1:001:1 0:2048 1 = 04
ffff88007d17e980 4122219948 S Ii:1:001:1 -115:2048 4 <
ffff88007d8c2a40 4122219980 S Ci:1:001:0 s a3 00 0000 0002 0004 4 <
ffff88007d8c2a40 4122220016 C Ci:1:001:0 0 4 = 01050100
ffff88007d8c2a40 4122220018 S Co:1:001:0 s 23 01 0010 0002 0000 0
ffff88007d8c2a40 4122220061 C Co:1:001:0 0 0
ffff88007d8c2a40 4122220067 S Ci:1:001:0 s a3 00 0000 0002 0004 4 <
ffff88007d8c2a40 4122220078 C Ci:1:001:0 0 4 = 01050000
ffff88007d8c2a40 4122245247 S Ci:1:001:0 s a3 00 0000 0002 0004 4 <
ffff88007d8c2a40 4122245280 C Ci:1:001:0 0 4 = 01050000
ffff88007d8c2a40 4122271244 S Ci:1:001:0 s a3 00 0000 0002 0004 4 <
ffff88007d8c2a40 4122271279 C Ci:1:001:0 0 4 = 01050000
ffff88007d8c2a40 4122297249 S Ci:1:001:0 s a3 00 0000 0002 0004 4 <
ffff88007d8c2a40 4122297290 C Ci:1:001:0 0 4 = 01050000
ffff88007d8c2a40 4122323280 S Ci:1:001:0 s a3 00 0000 0002 0004 4 <
ffff88007d8c2a40 4122323324 C Ci:1:001:0 0 4 = 01050000
ffff88007d8c2a40 4122323353 S Co:1:001:0 s 23 03 0004 0002 0000 0
ffff88007d8c2a40 4122323386 C Co:1:001:0 0 0
ffff88007d8c2a40 4122374402 S Ci:1:001:0 s a3 00 0000 0002 0004 4 <
ffff88007d8c2a40 4122374517 C Ci:1:001:0 0 4 = 03051000
ffff88007d8c2a40 4122425347 S Co:1:001:0 s 23 01 0014 0002 0000 0
ffff88007d8c2a40 4122425406 C Co:1:001:0 0 0
ffff88007d8c2a40 4122425448 S Ci:1:000:0 s 80 06 0100 0000 0040 64 <
ffff88007d8c2a40 4122425977 C Ci:1:000:0 0 18 = 12010002 00000040 38171152 01001020 0001
ffff88007d8c2a40 4122425998 S Co:1:001:0 s 23 03 0004 0002 0000 0
ffff88007d8c2a40 4122426066 C Co:1:001:0 0 0
ffff88007d8c2a40 4122476333 S Ci:1:001:0 s a3 00 0000 0002 0004 4 <
ffff88007d8c2a40 4122476578 C Ci:1:001:0 0 4 = 03051000
ffff88007d8c2a40 4122527245 S Co:1:001:0 s 23 01 0014 0002 0000 0
ffff88007d8c2a40 4122527288 C Co:1:001:0 0 0
ffff88007d8c2a40 4122527291 S Co:1:000:0 s 00 05 0005 0000 0000 0
ffff88007d8c2a40 4122527542 C Co:1:000:0 0 0
ffff88007d8c2a40 4122539211 S Ci:1:005:0 s 80 06 0100 0000 0012 18 <
ffff88007d8c2a40 4122542715 C Ci:1:005:0 0 18 = 12010002 00000040 38171152 01001020 0001
ffff88007d8c2a40 4122542828 S Ci:1:005:0 s 80 06 0200 0000 0009 9 <
ffff88007d8c2a40 4122545503 C Ci:1:005:0 0 9 = 09021900 01013080 f9
ffff88007d8c2a40 4122545560 S Ci:1:005:0 s 80 06 0200 0000 0019 25 <
ffff88007d8c2a40 4122546267 C Ci:1:005:0 0 25 = 09021900 01013080 f9090400 0001ffff ff400705 01020002 00
ffff88007d8c2a40 4122546360 S Ci:1:005:0 s 80 06 0300 0000 00ff 255 <
ffff88007d8c2a40 4122546927 C Ci:1:005:0 0 4 = 04030904
ffff88007d8c2a40 4122546947 S Ci:1:005:0 s 80 06 0320 0409 00ff 255 <
ffff88007d8c2a40 4122552222 C Ci:1:005:0 0 16 = 10034100 55005300 42004400 54005600
ffff88007d8c2a40 4122552338 S Ci:1:005:0 s 80 06 0310 0409 00ff 255 <
ffff88007d8c2a40 4122553703 C Ci:1:005:0 0 14 = 0e034100 53004900 43004500 4e00
ffff88007d8c2680 4122556555 S Co:1:005:0 s 00 09 0001 0000 0000 0
ffff88007d8c2680 4122559373 C Co:1:005:0 0 0
ffff88007d8c2680 4122559475 S Ci:1:005:0 s 80 06 0330 0409 00ff 255 <
ffff88007d8c2680 4122561904 C Ci:1:005:0 0 20 = 14034c00 6f006100 64006500 72002000 43003100
ffff88007d955b40 4122562017 S Ci:1:005:0 s 80 06 0340 0409 00ff 255 <
ffff88007d955b40 4122567218 C Ci:1:005:0 0 20 = 14034c00 6f006100 64006500 72002000 49003000
ffff88007d955b40 4122567307 S Co:1:005:0 s 40 ab 0000 5399 0200 512 [firmware payload omitted]
ffff88007d955b40 4122573072 C Co:1:005:0 0 512 >
ffff88007d955b40 4122573125 S Co:1:005:0 s 40 ab 0200 5399 0200 512 [firmware payload omitted]
ffff88007d955b40 4122578271 C Co:1:005:0 0 512 >
ffff88007d955b40 4122578346 S Co:1:005:0 s 40 ab 0400 5399 0200 512 [firmware payload omitted]
ffff88007d955b40 4122583286 C Co:1:005:0 0 512 >
ffff88007d955b40 4122583342 S Co:1:005:0 s 40 ab 0600 5399 0200 512 [firmware payload omitted]
ffff88007d955b40 4122588671 C Co:1:005:0 0 512 >
ffff88007d955b40 4122588731 S Co:1:005:0 s 40 ab 0800 5399 0200 512 [firmware payload omitted]
ffff88007d955b40 4122593894 C Co:1:005:0 0 512 >
ffff88007d955b40 4122593957 S Co:1:005:0 s 40 ab 0a00 5399 0200 512 [firmware payload omitted]
ffff88007d955b40 4122598952 C Co:1:005:0 0 512 >
ffff88007d955b40 4122599019 S Co:1:005:0 s 40 ab 2000 5399 0200 512 [firmware payload omitted]
ffff88007d955b40 4122604142 C Co:1:005:0 0 512 >
ffff88007d955b40 4122604196 S Co:1:005:0 s 40 ab 2200 5399 0200 512 [firmware payload omitted]
ffff88007d955b40 4122609413 C Co:1:005:0 0 512 >
ffff88007d955b40 4122609522 S Co:1:005:0 s 40 ab 2800 5399 0200 512 [firmware payload omitted]
ffff88007d955b40 4122614802 C Co:1:005:0 0 512 >
ffff88007d955b40 4122614866 S Co:1:005:0 s 40 ab 2a00 5399 0200 512 [firmware payload omitted]
ffff88007d955b40 4122620002 C Co:1:005:0 0 512 >
ffff88007d955b40 4122620053 S Co:1:005:0 s 40 ab 2c00 5399 0200 512 [firmware payload omitted]
ffff88007d955b40 4122625280 C Co:1:005:0 0 512 >
ffff88007d955b40 4122625370 S Co:1:005:0 s 40 ab 2e00 5399 0200 512 [firmware payload omitted]
ffff88007d955b40 4122630765 C Co:1:005:0 0 512 >
ffff88007d955b40 4122630802 S Co:1:005:0 s 40 ab 3000 5399 0200 512 [firmware payload omitted]
ffff88007d955b40 4122635747 C Co:1:005:0 0 512 >
ffff88007d955b40 4122635770 S Co:1:005:0 s 40 ab 3200 5399 0200 512 [firmware payload omitted]
ffff88007d955b40 4122641327 C Co:1:005:0 0 512 >
ffff88007d955b40 4122641373 S Co:1:005:0 s 40 ab 3400 5399 0200 512 [firmware payload omitted]
ffff88007d955b40 4122646301 C Co:1:005:0 0 512 >
ffff88007d955b40 4122646331 S Co:1:005:0 s 40 ab 3600 5399 0200 512 [firmware payload omitted]
ffff88007d955b40 4122651363 C Co:1:005:0 0 512 >
ffff88007d955b40 4122651387 S Co:1:005:0 s 40 ab 3800 5399 0200 512 [firmware payload omitted]
ffff88007d955b40 4122656558 C Co:1:005:0 0 512 >
ffff88007d955b40 4122656582 S Co:1:005:0 s 40 ab 3a00 5399 0200 512 [firmware payload omitted]
ffff88007d955b40 4122661832 C Co:1:005:0 0 512 >
ffff88007d955b40 4122661866 S Co:1:005:0 s 40 ab 3c00 5399 0200 512 [firmware payload omitted]
ffff88007d955b40 4122667111 C Co:1:005:0 0 512 >
ffff88007d955b40 4122667158 S Co:1:005:0 s 40 ac 3e00 5399 0200 512 [firmware payload omitted]
ffff88007d955b40 4122672214 C Co:1:005:0 0 512 >
ffff88007d17e980 4124219462 C Ii:1:001:1 0:2048 1 = 04
ffff88007d17e980 4124219472 S Ii:1:001:1 -115:2048 4 <
ffff88007d955240 4124219528 S Ci:1:001:0 s a3 00 0000 0002 0004 4 <
ffff88007d955240 4124219544 C Ci:1:001:0 0 4 = 00010100
ffff88007d955240 4124219548 S Co:1:001:0 s 23 01 0010 0002 0000 0
ffff88007d955240 4124219571 C Co:1:001:0 0 0
ffff88007d8c2a40 4124219857 S Ci:1:001:0 s a3 00 0000 0002 0004 4 <
ffff88007d8c2a40 4124219870 C Ci:1:001:0 0 4 = 00010000
ffff88007d8c2a40 4124245279 S Ci:1:001:0 s a3 00 0000 0002 0004 4 <
ffff88007d8c2a40 4124245313 C Ci:1:001:0 0 4 = 00010000
ffff88007d8c2a40 4124271313 S Ci:1:001:0 s a3 00 0000 0002 0004 4 <
ffff88007d8c2a40 4124271343 C Ci:1:001:0 0 4 = 00010000
ffff88007d8c2a40 4124297330 S Ci:1:001:0 s a3 00 0000 0002 0004 4 <
ffff88007d8c2a40 4124297413 C Ci:1:001:0 0 4 = 00010000
ffff88007d8c2a40 4124323245 S Ci:1:001:0 s a3 00 0000 0002 0004 4 <
ffff88007d8c2a40 4124323282 C Ci:1:001:0 0 4 = 00010000
ffff88007d17e980 4126220374 C Ii:1:001:1 0:2048 1 = 04
ffff88007d17e980 4126220385 S Ii:1:001:1 -115:2048 4 <
ffff88007d8c2a40 4126220407 S Ci:1:001:0 s a3 00 0000 0002 0004 4 <
ffff88007d8c2a40 4126220441 C Ci:1:001:0 0 4 = 01050100
ffff88007d8c2a40 4126220444 S Co:1:001:0 s 23 01 0010 0002 0000 0
ffff88007d8c2a40 4126220472 C Co:1:001:0 0 0
ffff88007d8c2a40 4126220477 S Ci:1:001:0 s a3 00 0000 0002 0004 4 <
ffff88007d8c2a40 4126220487 C Ci:1:001:0 0 4 = 01050000
ffff88007d8c2a40 4126246234 S Ci:1:001:0 s a3 00 0000 0002 0004 4 <
ffff88007d8c2a40 4126246267 C Ci:1:001:0 0 4 = 01050000
ffff88007d8c2a40 4126272227 S Ci:1:001:0 s a3 00 0000 0002 0004 4 <
ffff88007d8c2a40 4126272260 C Ci:1:001:0 0 4 = 01050000
ffff88007d8c2a40 4126298261 S Ci:1:001:0 s a3 00 0000 0002 0004 4 <
ffff88007d8c2a40 4126298300 C Ci:1:001:0 0 4 = 01050000
ffff88007d8c2a40 4126324258 S Ci:1:001:0 s a3 00 0000 0002 0004 4 <
ffff88007d8c2a40 4126324301 C Ci:1:001:0 0 4 = 01050000
ffff88007d8c2a40 4126324311 S Co:1:001:0 s 23 03 0004 0002 0000 0
ffff88007d8c2a40 4126324339 C Co:1:001:0 0 0
ffff88007d8c2a40 4126375410 S Ci:1:001:0 s a3 00 0000 0002 0004 4 <
ffff88007d8c2a40 4126517957 C Ci:1:001:0 0 4 = 03051000
ffff88007d8c2a40 4126568251 S Co:1:001:0 s 23 01 0014 0002 0000 0
ffff88007d8c2a40 4126568290 C Co:1:001:0 0 0
ffff88007d8c2a40 4126568300 S Ci:1:000:0 s 80 06 0100 0000 0040 64 <
ffff88007d8c2a40 4126568875 C Ci:1:000:0 0 18 = 12010002 00000040 060b0500 01001020 0001
ffff88007d8c2a40 4126568923 S Co:1:001:0 s 23 03 0004 0002 0000 0
ffff88007d8c2a40 4126568967 C Co:1:001:0 0 0
ffff88007d8c2a40 4126619247 S Ci:1:001:0 s a3 00 0000 0002 0004 4 <
ffff88007d8c2a40 4126619308 C Ci:1:001:0 0 4 = 03051000
ffff88007d8c2a40 4126670288 S Co:1:001:0 s 23 01 0014 0002 0000 0
ffff88007d8c2a40 4126670344 C Co:1:001:0 0 0
ffff88007d8c2a40 4126670347 S Co:1:000:0 s 00 05 0006 0000 0000 0
ffff88007d8c2a40 4126670572 C Co:1:000:0 0 0
ffff88007d8c2a40 4126682222 S Ci:1:006:0 s 80 06 0100 0000 0012 18 <
ffff88007d8c2a40 4126685905 C Ci:1:006:0 0 18 = 12010002 00000040 060b0500 01001020 0001
ffff88007d8c2a40 4126685954 S Ci:1:006:0 s 80 06 0200 0000 0009 9 <
ffff88007d8c2a40 4126686646 C Ci:1:006:0 0 9 = 09023000 02013080 fa
ffff88007d8c2a40 4126686713 S Ci:1:006:0 s 80 06 0200 0000 0030 48 <
ffff88007d8c2a40 4126687480 C Ci:1:006:0 0 48 = 09023000 02013080 fa090400 0002ffff ff200705 81020002 00070582 02000200
ffff88007d9556c0 4126687533 S Ci:1:006:0 s 80 06 0300 0000 00ff 255 <
ffff88007d9556c0 4126688331 C Ci:1:006:0 0 4 = 04030904
ffff88007d9556c0 4126688384 S Ci:1:006:0 s 80 06 0320 0409 00ff 255 <
ffff88007d9556c0 4126689403 C Ci:1:006:0 0 34 = 22034800 44005400 56002000 50005800 2d005700 33005500 33000000 00000000
ffff88007d9556c0 4126689463 S Ci:1:006:0 s 80 06 0310 0409 00ff 255 <
ffff88007d9556c0 4126690301 C Ci:1:006:0 0 22 = 16034900 53004400 42000000 00000000 00000000 0000
ffff88007d8c2680 4126690467 S Co:1:006:0 s 00 09 0001 0000 0000 0
ffff88007d8c2680 4126696372 C Co:1:006:0 0 0
ffff88007d8c2680 4126696443 S Ci:1:006:0 s 80 06 0330 0409 00ff 255 <
ffff88007d8c2680 4126700795 C Ci:1:006:0 0 22 = 16034400 54005600 20004300 4f004e00 46004900 4700
ffff88007d955b40 4126700875 S Ci:1:006:0 s 80 06 0320 0409 00ff 255 <
ffff88007d955b40 4126701617 C Ci:1:006:0 0 34 = 22034800 44005400 56002000 50005800 2d005700 33005500 33000000 00000000
ffff88007d955600 4126701792 S Ci:1:006:0 s 80 06 0340 0409 00ff 255 <
ffff88007d955600 4126702421 C Ci:1:006:0 0 32 = 20034800 44005400 56002000 49005200 32004800 49004400 00000000 00000000
ffff88007d8c2740 4166537646 S Ci:1:004:0 s c0 08 0000 0000 0001 1 <
ffff88007d8c2740 4166538270 C Ci:1:004:0 0 1 = ff
ffff88007d8c2740 4166538380 S Ci:1:004:0 s c0 11 0000 0000 0001 1 <
ffff88007d8c2740 4166539031 C Ci:1:004:0 0 1 = 02
ffff88007d8c2740 4166539165 S Ci:1:004:0 s 80 08 0000 0000 0001 1 <
ffff88007d8c2740 4166544348 C Ci:1:004:0 0 1 = 01
ffff88007d125a80 4226788610 S Ci:1:004:0 s c0 08 0000 0000 0001 1 <
ffff88007d125a80 4226789225 C Ci:1:004:0 0 1 = ff
ffff88007d125a80 4226789317 S Ci:1:004:0 s c0 11 0000 0000 0001 1 <
ffff88007d125a80 4226789941 C Ci:1:004:0 0 1 = 02
ffff88007d125a80 4226790021 S Ci:1:004:0 s 82 00 0000 0082 0002 2 <
ffff88007d125a80 4226795250 C Ci:1:004:0 0 2 = 0000
ffff88007d125a80 4226795403 S Ci:1:004:0 s 82 00 0000 0081 0002 2 <
ffff88007d125a80 4226797077 C Ci:1:004:0 0 2 = 0000
ffff88007d125a80 4226797669 S Ci:1:004:0 s 80 08 0000 0000 0001 1 <
ffff88007d125a80 4226799905 C Ci:1:004:0 0 1 = 01
ffff88007d125a80 4226800050 S Ci:1:004:0 s 81 0a 0000 0000 0001 1 <
ffff88007d125a80 4226802565 C Ci:1:004:0 0 1 = 00
ffff88007d8c2800 4227135411 S Ci:1:006:0 s c0 08 0000 0000 0001 1 <
ffff88007d8c2800 4227136022 C Ci:1:006:0 0 1 = ff
ffff88007d8c2800 4227136118 S Ci:1:006:0 s c0 11 0000 0000 0001 1 <
ffff88007d8c2800 4227136630 C Ci:1:006:0 0 1 = 02
ffff88007d8c2800 4227136710 S Ci:1:006:0 s 82 00 0000 0082 0002 2 <
ffff88007d8c2800 4227137476 C Ci:1:006:0 0 2 = 0000
ffff88007d8c2800 4227137543 S Ci:1:006:0 s 82 00 0000 0081 0002 2 <
ffff88007d8c2800 4227143327 C Ci:1:006:0 0 2 = 0000
ffff88007d8c2800 4227143470 S Ci:1:006:0 s 80 08 0000 0000 0001 1 <
ffff88007d8c2800 4227143914 C Ci:1:006:0 0 1 = 01
ffff88007d8c2800 4227143990 S Ci:1:006:0 s 81 0a 0000 0000 0001 1 <
ffff88007d8c2800 4227144558 C Ci:1:006:0 0 1 = 00
