ffff88007d17e8c0 3179250208 S Ci:1:004:0 s c0 08 0000 0000 0001 1 <
ffff88007d17e8c0 3179250779 C Ci:1:004:0 0 1 = ff
ffff88007d17e8c0 3179250904 S Ci:1:004:0 s c0 11 0000 0000 0001 1 <
ffff88007d17e8c0 3179255978 C Ci:1:004:0 0 1 = 02
ffff88007b08ac00 3192917753 S Ci:1:004:0 s c0 17 0002 0000 0003 3 <
ffff88007b08ac00 3192918424 C Ci:1:004:0 0 3 = 011152
ffff88007b08ac00 3192918481 S Ci:1:004:0 s c0 08 4000 0000 0001 1 <
ffff88007b08ac00 3192924040 C Ci:1:004:0 0 1 = bf
ffff88007b08ac00 3192974383 S Ci:1:004:0 s c0 08 0800 0000 0001 1 <
ffff88007b08ac00 3192975587 C Ci:1:004:0 0 1 = b7
ffff88007b08ac00 3193025956 S Ci:1:004:0 s c0 08 1010 0000 0001 1 <
ffff88007b08ac00 3193032483 C Ci:1:004:0 0 1 = b7
ffff88007b08ac00 3193042774 S Ci:1:004:0 s c0 08 1000 0000 0001 1 <
ffff88007b08ac00 3193043732 C Ci:1:004:0 0 1 = a7
ffff88007b08ac00 3193053866 S Ci:1:004:0 s c0 08 1010 0000 0001 1 <
ffff88007b08ac00 3193058925 C Ci:1:004:0 0 1 = b7
ffff88007b08ac00 3193058987 S Ci:1:004:0 s c0 08 0404 0000 0001 1 <
ffff88007b08ac00 3193059420 C Ci:1:004:0 0 1 = b7
ffff88007b08ac00 3193069728 S Ci:1:004:0 s c0 08 0400 0000 0001 1 <
ffff88007b08ac00 3193070833 C Ci:1:004:0 0 1 = b3
ffff88007b08ac00 3193081054 S Ci:1:004:0 s c0 08 0404 0000 0001 1 <
ffff88007b08ac00 3193086187 C Ci:1:004:0 0 1 = b7
ffff88007b08ac00 3193096353 S Ci:1:004:0 s c0 02 00a8 0000 0002 2 <
ffff88007b08ac00 3193098635 C Ci:1:004:0 0 2 [payload omitted]
ffff88007b08ac00 3193108848 S Ci:1:004:0 s c0 02 b0a8 0000 0011 17 <
ffff88007b08ac00 3193118163 C Ci:1:004:0 0 17 [payload omitted]
ffff88007b08ac00 3193118225 S Ci:1:004:0 s c0 08 db07 0000 0001 1 <
ffff88007b08ac00 3193118755 C Ci:1:004:0 0 1 = 27
ffff88007b08ac00 3193118780 S Ci:1:004:0 s c0 08 4040 0000 0001 1 <
ffff88007b08ac00 3193119619 C Ci:1:004:0 0 1 = 67
ffff88007b08ac00 3193119649 S Ci:1:004:0 s c0 08 0400 0000 0001 1 <
ffff88007b08ac00 3193120458 C Ci:1:004:0 0 1 = 63
ffff88007b08ac00 3193130609 S Ci:1:004:0 s c0 0c 0000 0000 003a 58 <
ffff88007b08ac00 3193132054 C Ci:1:004:0 0 58 [payload omitted]
ffff88007d17e980 3193280040 C Ii:1:001:1 0:2048 1 = 04
ffff88007d17e980 3193280073 S Ii:1:001:1 -115:2048 4 <
ffff88007b08aa80 3193280147 S Ci:1:001:0 s a3 00 0000 0002 0004 4 <
ffff88007b08aa80 3193280165 C Ci:1:001:0 0 4 = 00010100
ffff88007b08aa80 3193280167 S Co:1:001:0 s 23 01 0010 0002 0000 0
ffff88007b08aa80 3193280189 C Co:1:001:0 0 0
ffff88007d8c2980 3193281539 S Ci:1:001:0 s a3 00 0000 0002 0004 4 <
ffff88007d8c2980 3193281590 C Ci:1:001:0 0 4 = 00010000
ffff88007d8c2980 3193307040 S Ci:1:001:0 s a3 00 0000 0002 0004 4 <
ffff88007d8c2980 3193307097 C Ci:1:001:0 0 4 = 00010000
ffff88007d8c2980 3193332975 S Ci:1:001:0 s a3 00 0000 0002 0004 4 <
ffff88007d8c2980 3193333054 C Ci:1:001:0 0 4 = 00010000
ffff88007d8c2980 3193358978 S Ci:1:001:0 s a3 00 0000 0002 0004 4 <
ffff88007d8c2980 3193359027 C Ci:1:001:0 0 4 = 00010000
ffff88007d8c2980 3193384965 S Ci:1:001:0 s a3 00 0000 0002 0004 4 <
ffff88007d8c2980 3193385016 C Ci:1:001:0 0 4 = 00010000
ffff88007d17e980 3195280649 C Ii:1:001:1 0:2048 1 = 04
ffff88007d17e980 3195280675 S Ii:1:001:1 -115:2048 4 <
ffff88007d8c2980 3195280727 S Ci:1:001:0 s a3 00 0000 0002 0004 4 <
ffff88007d8c2980 3195280758 C Ci:1:001:0 0 4 = 01050100
ffff88007d8c2980 3195280761 S Co:1:001:0 s 23 01 0010 0002 0000 0
ffff88007d8c2980 3195280796 C Co:1:001:0 0 0
ffff88007d8c2980 3195280812 S Ci:1:001:0 s a3 00 0000 0002 0004 4 <
ffff88007d8c2980 3195280829 C Ci:1:001:0 0 4 = 01050000
ffff88007d8c2980 3195305988 S Ci:1:001:0 s a3 00 0000 0002 0004 4 <
ffff88007d8c2980 3195306041 C Ci:1:001:0 0 4 = 01050000
ffff88007d8c2980 3195332033 S Ci:1:001:0 s a3 00 0000 0002 0004 4 <
ffff88007d8c2980 3195332081 C Ci:1:001:0 0 4 = 01050000
ffff88007d8c2980 3195358043 S Ci:1:001:0 s a3 00 0000 0002 0004 4 <
ffff88007d8c2980 3195358073 C Ci:1:001:0 0 4 = 01050000
ffff88007d8c2980 3195384058 S Ci:1:001:0 s a3 00 0000 0002 0004 4 <
ffff88007d8c2980 3195384088 C Ci:1:001:0 0 4 = 01050000
ffff88007d8c2980 3195384095 S Co:1:001:0 s 23 03 0004 0002 0000 0
ffff88007d8c2980 3195384118 C Co:1:001:0 0 0
ffff88007d8c2980 3195435148 S Ci:1:001:0 s a3 00 0000 0002 0004 4 <
ffff88007d8c2980 3195587295 C Ci:1:001:0 0 4 = 03051000
ffff88007d8c2980 3195638062 S Co:1:001:0 s 23 01 0014 0002 0000 0
ffff88007d8c2980 3195638109 C Co:1:001:0 0 0
ffff88007d8c2980 3195638120 S Ci:1:000:0 s 80 06 0100 0000 0040 64 <
ffff88007d8c2980 3195638774 C Ci:1:000:0 0 18 = 12010002 00000040 38171152 01001020 0001
ffff88007d8c2980 3195638832 S Co:1:001:0 s 23 03 0004 0002 0000 0
ffff88007d8c2980 3195638884 C Co:1:001:0 0 0
ffff88007d8c2980 3195689115 S Ci:1:001:0 s a3 00 0000 0002 0004 4 <
ffff88007d8c2980 3195689216 C Ci:1:001:0 0 4 = 03051000
ffff88007d8c2980 3195740145 S Co:1:001:0 s 23 01 0014 0002 0000 0
ffff88007d8c2980 3195740293 C Co:1:001:0 0 0
ffff88007d8c2980 3195740298 S Co:1:000:0 s 00 05 0009 0000 0000 0
ffff88007d8c2980 3195740616 C Co:1:000:0 0 0
ffff88007d8c2980 3195752077 S Ci:1:009:0 s 80 06 0100 0000 0012 18 <
ffff88007d8c2980 3195755884 C Ci:1:009:0 0 18 = 12010002 00000040 38171152 01001020 0001
ffff88007d8c2980 3195755941 S Ci:1:009:0 s 80 06 0200 0000 0009 9 <
ffff88007d8c2980 3195756469 C Ci:1:009:0 0 9 = 09021900 01013080 f9
ffff88007d8c2980 3195756551 S Ci:1:009:0 s 80 06 0200 0000 0019 25 <
ffff88007d8c2980 3195757453 C Ci:1:009:0 0 25 = 09021900 01013080 f9090400 0001ffff ff400705 01020002 00
ffff88007d8c2980 3195757492 S Ci:1:009:0 s 80 06 0300 0000 00ff 255 <
ffff88007d8c2980 3195762929 C Ci:1:009:0 0 4 = 04030904
ffff88007d8c2980 3195762988 S Ci:1:009:0 s 80 06 0320 0409 00ff 255 <
ffff88007d8c2980 3195764105 C Ci:1:009:0 0 16 = 10034100 55005300 42004400 54005600
ffff88007d8c2980 3195764176 S Ci:1:009:0 s 80 06 0310 0409 00ff 255 <
ffff88007d8c2980 3195764608 C Ci:1:009:0 0 14 = 0e034100 53004900 43004500 4e00
ffff88007d17e800 3195768574 S Co:1:009:0 s 00 09 0001 0000 0000 0
ffff88007d17e800 3195770419 C Co:1:009:0 0 0
ffff88007d17e800 3195770459 S Ci:1:009:0 s 80 06 0330 0409 00ff 255 <
ffff88007d17e800 3195771084 C Ci:1:009:0 0 20 = 14034c00 6f006100 64006500 72002000 43003100
ffff88007d8c25c0 3195771113 S Ci:1:009:0 s 80 06 0340 0409 00ff 255 <
ffff88007d8c25c0 3195771775 C Ci:1:009:0 0 20 = 14034c00 6f006100 64006500 72002000 49003000
ffff88007d8c25c0 3195771862 S Co:1:009:0 s 40 ab 0000 5399 0200 512 = d21ae490 c63ff090 c638e50d f0a3e50e f090c63a e50ff0a3 e510f0e5 08648060
ffff88007d8c25c0 3195776805 C Co:1:009:0 0 512 >
ffff88007d8c25c0 3195776902 S Co:1:009:0 s 40 ab 0200 5399 0200 512 = bb7b017a c4791212 28dc90c6 3ae0ff7b 017ac479 1290c65e 124cc07d 01124961
ffff88007d8c25c0 3195781834 C Co:1:009:0 0 512 >
ffff88007d8c25c0 3195781915 S Co:1:009:0 s 40 ab 0400 5399 0200 512 = 28bc5018 7ac4798e 122ada24 fe90c67b f0e51134 ff1228e8 40078000 e490c48c
ffff88007d8c25c0 3195786809 C Co:1:009:0 0 512 >
ffff88007d8c25c0 3195786863 S Co:1:009:0 s 40 ab 0600 5399 0200 512 = e0ffa3e0 6fff7b01 7ac4798e 90c65d74 01f01256 801229e1 12295612 2ab2124a
ffff88007d8c25c0 3195791903 C Co:1:009:0 0 512 >
ffff88007d8c25c0 3195791967 S Co:1:009:0 s 40 ab 0800 5399 0200 512 = e4f0a374 02f07f02 125d8890 c63ee090 8c0af044 80f07f02 125d8890 c639e070
ffff88007d8c25c0 3195796944 C Co:1:009:0 0 512 >
ffff88007d8c25c0 3195797016 S Co:1:009:0 s 40 ab 0a00 5399 0200 512 = f090c636 e02225e0 2441f582 e4348022 25e02461 f582e434 802290c6 38e090c4
ffff88007d8c25c0 3195802160 C Co:1:009:0 0 512 >
ffff88007d8c25c0 3195802223 S Co:1:009:0 s 40 ab 2000 5399 0200 512 = 43900230 19030241 d2d21990 8000e030 e63fe4f5 149054a9 122934b4 12f7122a
ffff88007d8c25c0 3195807371 C Co:1:009:0 0 512 >
ffff88007d8c25c0 3195807431 S Co:1:009:0 s 40 ab 2200 5399 0200 512 = 0b00f50c 78271229 f8f50da3 e0f50e78 291229f8 f50fa3e0 f510782b 1229f8f5
ffff88007d8c25c0 3195812506 C Co:1:009:0 0 512 >
ffff88007d8c25c0 3195812548 S Co:1:009:0 s 40 ab 2800 5399 0200 512 = 125b44a3 f090c409 124c8600 000000e4 90c48af0 90c40d12 4c860000 0000e490
ffff88007d8c25c0 3195817687 C Co:1:009:0 0 512 >
ffff88007d8c25c0 3195817745 S Co:1:009:0 s 40 ab 2a00 5399 0200 512 = 01ff90c6 62ef1229 4a122ab2 124a9140 0122e490 c66af07a c6796c12 29837d37
ffff88007d8c25c0 3195822851 C Co:1:009:0 0 512 >
ffff88007d8c25c0 3195822902 S Co:1:009:0 s 40 ab 2c00 5399 0200 512 = 833af583 e49322bb 01068982 8a83f022 5002f722 bbfe01f3 22f8bb01 0de58229
ffff88007d8c25c0 3195827934 C Co:1:009:0 0 512 >
ffff88007d8c25c0 3195827966 S Co:1:009:0 s 40 ab 2e00 5399 0200 512 = 1256ed90 c67c1256 ed024d4e d32290c4 00e030e0 5d908021 e0f52290 8011122b
ffff88007d8c25c0 3195833298 C Co:1:009:0 0 512 >
ffff88007d8c25c0 3195833416 S Co:1:009:0 s 40 ab 3000 5399 0200 512 = 50701e12 2b658025 122b7080 20122b7b 801b122b 86801612 2b918011 122b9c80
ffff88007d8c25c0 3195840718 C Co:1:009:0 0 512 >
ffff88007d8c25c0 3195840750 S Co:1:009:0 s 40 ab 3200 5399 0200 512 = 02c2b0ef 30e104d2 b18007c2 b1800343 900290c4 09124c62 ec4d4e4f 601a90c5
ffff88007d8c25c0 3195845813 C Co:1:009:0 0 512 >
ffff88007d8c25c0 3195845858 S Co:1:009:0 s 40 ab 3400 5399 0200 512 = 40b8e493 a3fae493 a3f8e493 a3c8c582 c8cac583 caf0a3c8 c582c8ca c583cadf
ffff88007d8c25c0 3195850927 C Co:1:009:0 0 512 >
ffff88007d8c25c0 3195850982 S Co:1:009:0 s 40 ab 3600 5399 0200 512 = e04480f0 125a24af 0ebf0104 122be1f0 1229b1d3 22e50b70 65e50c12 4cc95643
ffff88007d8c25c0 3195855996 C Co:1:009:0 0 512 >
ffff88007d8c25c0 3195856039 S Co:1:009:0 s 40 ab 3800 5399 0200 512 = 088002c3 13d8fc30 e003d380 01c3122a 3fb408e4 7fc87e00 125d1e53 90df2290
ffff88007d8c25c0 3195861256 C Co:1:009:0 0 512 >
ffff88007d8c25c0 3195861312 S Co:1:009:0 s 40 ab 3a00 5399 0200 512 = 781ae6fc 08e6f582 8c83eff0 06e61870 01060513 80df90c4 cee07002 a3e07003
ffff88007d8c25c0 3195866572 C Co:1:009:0 0 512 >
ffff88007d8c25c0 3195866737 S Co:1:009:0 s 40 ab 3c00 5399 0200 512 = bf90c684 e0b40107 ef30e603 09800eef 30e404e4 f98006ef 30e502e4 f9af0122
ffff88007d8c25c0 3195873907 C Co:1:009:0 0 512 >
ffff88007d8c25c0 3195873983 S Co:1:009:0 s 40 ac 3e00 5399 0200 512 = 00000000 00000000 00000000 00000000 00000000 00000000 00000000 00000000
ffff88007d8c25c0 3195879012 C Co:1:009:0 0 512 >
ffff88007d17e980 3197280033 C Ii:1:001:1 0:2048 1 = 04
ffff88007d17e980 3197280048 S Ii:1:001:1 -115:2048 4 <
ffff88007d17e200 3197280114 S Ci:1:001:0 s a3 00 0000 0002 0004 4 <
ffff88007d17e200 3197280168 C Ci:1:001:0 0 4 = 00010100
ffff88007d17e200 3197280190 S Co:1:001:0 s 23 01 0010 0002 0000 0
ffff88007d17e200 3197280257 C Co:1:001:0 0 0
ffff88007d8c2980 3197280416 S Ci:1:001:0 s a3 00 0000 0002 0004 4 <
ffff88007d8c2980 3197280429 C Ci:1:001:0 0 4 = 00010000
ffff88007d8c2980 3197305940 S Ci:1:001:0 s a3 00 0000 0002 0004 4 <
ffff88007d8c2980 3197305970 C Ci:1:001:0 0 4 = 00010000
ffff88007d8c2980 3197332089 S Ci:1:001:0 s a3 00 0000 0002 0004 4 <
ffff88007d8c2980 3197332227 C Ci:1:001:0 0 4 = 00010000
ffff88007d8c2980 3197358169 S Ci:1:001:0 s a3 00 0000 0002 0004 4 <
ffff88007d8c2980 3197358206 C Ci:1:001:0 0 4 = 00010000
ffff88007d8c2980 3197384089 S Ci:1:001:0 s a3 00 0000 0002 0004 4 <
ffff88007d8c2980 3197384122 C Ci:1:001:0 0 4 = 00010000
ffff88007d8c2440 3199143648 S Ci:1:004:0 s c0 07 0000 0000 0001 1 <
ffff88007d8c2440 3199144232 C Ci:1:004:0 0 1 = 01
ffff88007d8c2440 3199144339 S Ci:1:004:0 s c0 07 0001 0000 0001 1 <
ffff88007d8c2440 3199149922 C Ci:1:004:0 0 1 = 01
ffff88007d8c2440 3199150053 S Ci:1:004:0 s c0 08 dfdf 0000 0001 1 <
ffff88007d8c2440 3199150736 C Ci:1:004:0 0 1 = ff
ffff88007d8c2440 3199150817 S Ci:1:004:0 s c0 08 0000 0000 0001 1 <
ffff88007d8c2440 3199151298 C Ci:1:004:0 0 1 = ff
ffff88007d8c2440 3199151386 S Ci:1:004:0 s c0 11 0000 0000 0001 1 <
ffff88007d8c2440 3199151982 C Ci:1:004:0 0 1 = 02
ffff88007d17e980 3199281279 C Ii:1:001:1 0:2048 1 = 04
ffff88007d17e980 3199281309 S Ii:1:001:1 -115:2048 4 <
ffff88007d8c25c0 3199281379 S Ci:1:001:0 s a3 00 0000 0002 0004 4 <
ffff88007d8c25c0 3199281396 C Ci:1:001:0 0 4 = 01050100
ffff88007d8c25c0 3199281400 S Co:1:001:0 s 23 01 0010 0002 0000 0
ffff88007d8c25c0 3199281422 C Co:1:001:0 0 0
ffff88007d8c25c0 3199281425 S Ci:1:001:0 s a3 00 0000 0002 0004 4 <
ffff88007d8c25c0 3199281433 C Ci:1:001:0 0 4 = 01050000
ffff88007d8c25c0 3199306990 S Ci:1:001:0 s a3 00 0000 0002 0004 4 <
ffff88007d8c25c0 3199307061 C Ci:1:001:0 0 4 = 01050000
ffff88007d8c25c0 3199333034 S Ci:1:001:0 s a3 00 0000 0002 0004 4 <
ffff88007d8c25c0 3199333186 C Ci:1:001:0 0 4 = 01050000
ffff88007d8c25c0 3199359041 S Ci:1:001:0 s a3 00 0000 0002 0004 4 <
ffff88007d8c25c0 3199359072 C Ci:1:001:0 0 4 = 01050000
ffff88007d8c25c0 3199384941 S Ci:1:001:0 s a3 00 0000 0002 0004 4 <
ffff88007d8c25c0 3199384971 C Ci:1:001:0 0 4 = 01050000
ffff88007d8c25c0 3199384977 S Co:1:001:0 s 23 03 0004 0002 0000 0
ffff88007d8c25c0 3199385000 C Co:1:001:0 0 0
ffff88007d8c25c0 3199436090 S Ci:1:001:0 s a3 00 0000 0002 0004 4 <
ffff88007d8c25c0 3199592762 C Ci:1:001:0 0 4 = 03051000
ffff88007d8c25c0 3199643055 S Co:1:001:0 s 23 01 0014 0002 0000 0
ffff88007d8c25c0 3199643093 C Co:1:001:0 0 0
ffff88007d8c25c0 3199643105 S Ci:1:000:0 s 80 06 0100 0000 0040 64 <
ffff88007d8c25c0 3199643668 C Ci:1:000:0 0 18 = 12010002 00000040 060b0500 01001020 0001
ffff88007d8c25c0 3199644190 S Co:1:001:0 s 23 03 0004 0002 0000 0
ffff88007d8c25c0 3199644238 C Co:1:001:0 0 0
ffff88007d8c25c0 3199695024 S Ci:1:001:0 s a3 00 0000 0002 0004 4 <
ffff88007d8c25c0 3199695265 C Ci:1:001:0 0 4 = 03051000
ffff88007d8c25c0 3199745993 S Co:1:001:0 s 23 01 0014 0002 0000 0
ffff88007d8c25c0 3199746046 C Co:1:001:0 0 0
ffff88007d8c25c0 3199746050 S Co:1:000:0 s 00 05 000a 0000 0000 0
ffff88007d8c25c0 3199746283 C Co:1:000:0 0 0
ffff88007d8c25c0 3199758135 S Ci:1:010:0 s 80 06 0100 0000 0012 18 <
ffff88007d8c25c0 3199761502 C Ci:1:010:0 0 18 = 12010002 00000040 060b0500 01001020 0001
ffff88007d8c25c0 3199761539 S Ci:1:010:0 s 80 06 0200 0000 0009 9 <
ffff88007d8c25c0 3199766978 C Ci:1:010:0 0 9 = 09023000 02013080 fa
ffff88007d8c25c0 3199767023 S Ci:1:010:0 s 80 06 0200 0000 0030 48 <
ffff88007d8c25c0 3199768546 C Ci:1:010:0 0 48 = 09023000 02013080 fa090400 0002ffff ff200705 81020002 00070582 02000200
ffff88007d125780 3199768603 S Ci:1:010:0 s 80 06 0300 0000 00ff 255 <
ffff88007d125780 3199773926 C Ci:1:010:0 0 4 = 04030904
ffff88007d125780 3199773961 S Ci:1:010:0 s 80 06 0320 0409 00ff 255 <
ffff88007d125780 3199775499 C Ci:1:010:0 0 34 = 22034800 44005400 56002000 50005800 2d005700 33005500 33000000 00000000
ffff88007d125780 3199775545 S Ci:1:010:0 s 80 06 0310 0409 00ff 255 <
ffff88007d125780 3199781070 C Ci:1:010:0 0 22 = 16034900 53004400 42000000 00000000 00000000 0000
ffff88007b08a840 3199784397 S Co:1:010:0 s 00 09 0001 0000 0000 0
ffff88007b08a840 3199786190 C Co:1:010:0 0 0
ffff88007b08a840 3199786227 S Ci:1:010:0 s 80 06 0330 0409 00ff 255 <
ffff88007b08a840 3199786822 C Ci:1:010:0 0 22 = 16034400 54005600 20004300 4f004e00 46004900 4700
ffff88007d17e440 3199786853 S Ci:1:010:0 s 80 06 0320 0409 00ff 255 <
ffff88007d17e440 3199787687 C Ci:1:010:0 0 34 = 22034800 44005400 56002000 50005800 2d005700 33005500 33000000 00000000
ffff88007d955780 3199787864 S Ci:1:010:0 s 80 06 0340 0409 00ff 255 <
ffff88007d955780 3199788462 C Ci:1:010:0 0 32 = 20034800 44005400 56002000 49005200 32004800 49004400 00000000 00000000
ffff88007d8c2a40 3209536286 S Ci:1:004:0 s c0 17 0002 0000 0003 3 <
ffff88007d8c2a40 3209536915 C Ci:1:004:0 0 3 = 011152
ffff88007d8c2a40 3209536974 S Ci:1:004:0 s c0 08 4000 0000 0001 1 <
ffff88007d8c2a40 3209541907 C Ci:1:004:0 0 1 = bf
ffff88007d8c2a40 3209592182 S Ci:1:004:0 s c0 08 0800 0000 0001 1 <
ffff88007d8c2a40 3209594363 C Ci:1:004:0 0 1 = b7
ffff88007d8c2a40 3209644608 S Ci:1:004:0 s c0 08 1010 0000 0001 1 <
ffff88007d8c2a40 3209645733 C Ci:1:004:0 0 1 = b7
ffff88007d8c2a40 3209655939 S Ci:1:004:0 s c0 08 1000 0000 0001 1 <
ffff88007d8c2a40 3209661255 C Ci:1:004:0 0 1 = a7
ffff88007d8c2a40 3209671558 S Ci:1:004:0 s c0 08 1010 0000 0001 1 <
ffff88007d8c2a40 3209672942 C Ci:1:004:0 0 1 = b7
ffff88007d8c2a40 3209672973 S Ci:1:004:0 s c0 08 0404 0000 0001 1 <
ffff88007d8c2a40 3209673710 C Ci:1:004:0 0 1 = b7
ffff88007d8c2a40 3209683859 S Ci:1:004:0 s c0 08 0400 0000 0001 1 <
ffff88007d8c2a40 3209688970 C Ci:1:004:0 0 1 = b3
ffff88007d8c2a40 3209699278 S Ci:1:004:0 s c0 08 0404 0000 0001 1 <
ffff88007d8c2a40 3209700772 C Ci:1:004:0 0 1 = b7
ffff88007d8c2a40 3209710941 S Ci:1:004:0 s c0 02 00a8 0000 0002 2 <
ffff88007d8c2a40 3209716995 C Ci:1:004:0 0 2 [payload omitted]
ffff88007d8c2a40 3209727265 S Ci:1:004:0 s c0 02 b0a8 0000 0011 17 <
ffff88007d8c2a40 3209732926 C Ci:1:004:0 0 17 [payload omitted]
ffff88007d8c2a40 3209733010 S Ci:1:004:0 s c0 08 db07 0000 0001 1 <
ffff88007d8c2a40 3209737911 C Ci:1:004:0 0 1 = 27
ffff88007d8c2a40 3209737951 S Ci:1:004:0 s c0 08 4040 0000 0001 1 <
ffff88007d8c2a40 3209739519 C Ci:1:004:0 0 1 = 67
ffff88007d8c2a40 3209739554 S Ci:1:004:0 s c0 08 0400 0000 0001 1 <
ffff88007d8c2a40 3209740141 C Ci:1:004:0 0 1 = 63
ffff88007d8c2a40 3209750433 S Ci:1:004:0 s c0 0c 0000 0000 003a 58 <
ffff88007d8c2a40 3209752034 C Ci:1:004:0 0 58 [payload omitted]
ffff88007d8c2a40 3209752116 S Ci:1:004:0 s c0 17 0002 0000 0003 3 <
ffff88007d8c2a40 3209752738 C Ci:1:004:0 0 3 = 011152
ffff88007d8c2a40 3209752767 S Ci:1:004:0 s c0 08 0800 0000 0001 1 <
ffff88007d8c2a40 3209757912 C Ci:1:004:0 0 1 = 63
ffff88007d8c2a40 3209808124 S Ci:1:004:0 s c0 08 0505 0000 0001 1 <
ffff88007d8c2a40 3209809414 C Ci:1:004:0 0 1 = 67
ffff88007d8c2a40 3209819568 S Ci:1:004:0 s c0 08 0400 0000 0001 1 <
ffff88007d8c2a40 3209820790 C Ci:1:004:0 0 1 = 63
ffff88007d8c2a40 3209831000 S Ci:1:004:0 s c0 08 0505 0000 0001 1 <
ffff88007d8c2a40 3209835958 C Ci:1:004:0 0 1 = 67
ffff88007d8c2a40 3209846184 S Ci:1:004:0 s c0 08 1010 0000 0001 1 <
ffff88007d8c2a40 3209847803 C Ci:1:004:0 0 1 = 77
ffff88007d8c2a40 3209858150 S Ci:1:004:0 s c0 08 1000 0000 0001 1 <
ffff88007d8c2a40 3209862658 C Ci:1:004:0 0 1 = 67
ffff88007d8c2a40 3209872895 S Ci:1:004:0 s c0 08 1010 0000 0001 1 <
ffff88007d8c2a40 3209873957 C Ci:1:004:0 0 1 = 77
ffff88007d8c2a40 3209894330 S Ci:1:004:0 s c0 02 00a8 0000 0002 2 <
ffff88007d8c2a40 3209895826 C Ci:1:004:0 0 2 [payload omitted]
ffff88007d8c2a40 3209996031 S Ci:1:004:0 s c0 02 1c30 0000 0002 2 <
ffff88007d8c2a40 3209997443 C Ci:1:004:0 0 2 = 0100
ffff88007d8c2a40 3209997495 S Ci:1:004:0 s c0 03 1c30 0030 0002 2 <
ffff88007d8c2a40 3209999009 C Ci:1:004:0 0 2 = 011c
ffff88007d8c2a40 3210009194 S Ci:1:004:0 s c0 02 1c30 0000 0002 2 <
ffff88007d8c2a40 3210011472 C Ci:1:004:0 0 2 = 0130
ffff88007d8c2a40 3210011524 S Ci:1:004:0 s c0 03 1c30 0020 0002 2 <
ffff88007d8c2a40 3210012649 C Ci:1:004:0 0 2 = 011c
ffff88007d8c2a40 3210012735 S Ci:1:004:0 s c0 03 0430 0000 0002 2 <
ffff88007d8c2a40 3210014114 C Ci:1:004:0 0 2 = 0104
ffff88007d8c2a40 3210014266 S Ci:1:004:0 s c0 03 1130 001a 0002 2 <
ffff88007d8c2a40 3210017243 C Ci:1:004:0 0 2 = 0111
ffff88007d8c2a40 3210017273 S Ci:1:004:0 s c0 03 1230 0004 0002 2 <
ffff88007d8c2a40 3210018472 C Ci:1:004:0 0 2 = 0112
ffff88007d8c2a40 3210018498 S Ci:1:004:0 s c0 03 1330 0033 0002 2 <
ffff88007d8c2a40 3210019677 C Ci:1:004:0 0 2 = 0113
ffff88007d8c2a40 3210019703 S Ci:1:004:0 s c0 03 1430 0020 0002 2 <
ffff88007d8c2a40 3210020896 C Ci:1:004:0 0 2 = 0114
ffff88007d8c2a40 3210020922 S Ci:1:004:0 s c0 03 3130 0000 0002 2 <
ffff88007d8c2a40 3210022118 C Ci:1:004:0 0 2 = 0131
ffff88007d8c2a40 3210022142 S Ci:1:004:0 s c0 03 3230 0000 0002 2 <
ffff88007d8c2a40 3210023350 C Ci:1:004:0 0 2 = 0132
ffff88007d8c2a40 3210023375 S Ci:1:004:0 s c0 03 3830 0000 0002 2 <
ffff88007d8c2a40 3210024594 C Ci:1:004:0 0 2 = 0138
ffff88007d8c2a40 3210024620 S Ci:1:004:0 s c0 03 3930 00aa 0002 2 <
ffff88007d8c2a40 3210025852 C Ci:1:004:0 0 2 = 0139
ffff88007d8c2a40 3210025949 S Ci:1:004:0 s c0 03 4730 0000 0002 2 <
ffff88007d8c2a40 3210027514 C Ci:1:004:0 0 2 = 0147
ffff88007d8c2a40 3210027756 S Ci:1:004:0 s c0 03 7530 0002 0002 2 <
ffff88007d8c2a40 3210030781 C Ci:1:004:0 0 2 = 0175
ffff88007d8c2a40 3210030820 S Ci:1:004:0 s c0 03 b030 00a0 0002 2 <
ffff88007d8c2a40 3210032138 C Ci:1:004:0 0 2 = 01b0
ffff88007d8c2a40 3210032197 S Ci:1:004:0 s c0 03 b230 003d 0002 2 <
ffff88007d8c2a40 3210033362 C Ci:1:004:0 0 2 = 01b2
ffff88007d8c2a40 3210033405 S Ci:1:004:0 s c0 03 b330 0025 0002 2 <
ffff88007d8c2a40 3210034689 C Ci:1:004:0 0 2 = 01b3
ffff88007d8c2a40 3210034737 S Ci:1:004:0 s c0 03 b430 008b 0002 2 <
ffff88007d8c2a40 3210035820 C Ci:1:004:0 0 2 = 01b4
ffff88007d8c2a40 3210035861 S Ci:1:004:0 s c0 03 b530 004b 0002 2 <
ffff88007d8c2a40 3210037083 C Ci:1:004:0 0 2 = 01b5
ffff88007d8c2a40 3210037110 S Ci:1:004:0 s c0 03 b630 003f 0002 2 <
ffff88007d8c2a40 3210038423 C Ci:1:004:0 0 2 = 01b6
ffff88007d8c2a40 3210038456 S Ci:1:004:0 s c0 03 b730 00ff 0002 2 <
ffff88007d8c2a40 3210039634 C Ci:1:004:0 0 2 = 01b7
ffff88007d8c2a40 3210039666 S Ci:1:004:0 s c0 03 b830 00ff 0002 2 <
ffff88007d8c2a40 3210040958 C Ci:1:004:0 0 2 = 01b8
ffff88007d8c2a40 3210040983 S Ci:1:004:0 s c0 03 2230 008f 0002 2 <
ffff88007d8c2a40 3210042230 C Ci:1:004:0 0 2 = 0122
ffff88007d8c2a40 3210042254 S Ci:1:004:0 s c0 03 5f30 0080 0002 2 <
ffff88007d8c2a40 3210043863 C Ci:1:004:0 0 2 = 015f
ffff88007d8c2a40 3210043927 S Ci:1:004:0 s c0 03 ef30 0001 0002 2 <
ffff88007d8c2a40 3210047228 C Ci:1:004:0 0 2 = 01ef
ffff88007d8c2a40 3210047443 S Ci:1:004:0 s c0 0d fe00 01c6 0004 4 <
ffff88007d8c2a40 3210049922 C Ci:1:004:0 0 4 = 01fec601
ffff88007d8c2a40 3210049983 S Ci:1:004:0 s c0 0d 0503 0000 0002 2 <
ffff88007d8c2a40 3210054954 C Ci:1:004:0 0 2 = 0105
ffff88007d8c2a40 3210055012 S Ci:1:004:0 s c0 0e 0030 0000 0005 5 <
ffff88007d8c2a40 3210057836 C Ci:1:004:0 0 5 = 01fec601 05
ffff88007d8c2a40 3210057905 S Ci:1:004:0 s c0 0d fe00 02c6 0004 4 <
ffff88007d8c2a40 3210060597 C Ci:1:004:0 0 4 = 01fec602
ffff88007d8c2a40 3210060665 S Ci:1:004:0 s c0 0d 1003 0000 0002 2 <
ffff88007d8c2a40 3210061201 C Ci:1:004:0 0 2 = 0110
ffff88007d8c2a40 3210061226 S Ci:1:004:0 s c0 0e 0030 0000 0005 5 <
ffff88007d8c2a40 3210063014 C Ci:1:004:0 0 5 = 01fec602 10
ffff88007d8c2a40 3210063077 S Ci:1:004:0 s c0 0d fe00 03c6 0004 4 <
ffff88007d8c2a40 3210063618 C Ci:1:004:0 0 4 = 01fec603
ffff88007d8c2a40 3210063676 S Ci:1:004:0 s c0 0d 0003 0000 0002 2 <
ffff88007d8c2a40 3210068954 C Ci:1:004:0 0 2 = 0100
ffff88007d8c2a40 3210069029 S Ci:1:004:0 s c0 0e 0030 0000 0005 5 <
ffff88007d8c2a40 3210071310 C Ci:1:004:0 0 5 = 01fec603 00
ffff88007d8c2a40 3210071376 S Ci:1:004:0 s c0 0d fe00 04c6 0004 4 <
ffff88007d8c2a40 3210072049 C Ci:1:004:0 0 4 = 01fec604
ffff88007d8c2a40 3210072084 S Ci:1:004:0 s c0 0d 0003 0000 0002 2 <
ffff88007d8c2a40 3210072726 C Ci:1:004:0 0 2 = 0100
ffff88007d8c2a40 3210072749 S Ci:1:004:0 s c0 0e 0030 0000 0005 5 <
ffff88007d8c2a40 3210074593 C Ci:1:004:0 0 5 = 01fec604 00
ffff88007d8c2a40 3210074620 S Ci:1:004:0 s c0 0d fe00 05c6 0004 4 <
ffff88007d8c2a40 3210080009 C Ci:1:004:0 0 4 = 01fec605
ffff88007d8c2a40 3210080083 S Ci:1:004:0 s c0 0d 0f03 0000 0002 2 <
ffff88007d8c2a40 3210081453 C Ci:1:004:0 0 2 = 010f
ffff88007d8c2a40 3210081513 S Ci:1:004:0 s c0 0e 0030 0000 0005 5 <
ffff88007d8c2a40 3210083309 C Ci:1:004:0 0 5 = 01fec605 0f
ffff88007d8c2a40 3210083334 S Ci:1:004:0 s c0 0d fe00 06c6 0004 4 <
ffff88007d8c2a40 3210084029 C Ci:1:004:0 0 4 = 01fec606
ffff88007d8c2a40 3210084055 S Ci:1:004:0 s c0 0d 0003 0000 0002 2 <
ffff88007d8c2a40 3210084893 C Ci:1:004:0 0 2 = 0100
ffff88007d8c2a40 3210084918 S Ci:1:004:0 s c0 0e 0030 0000 0005 5 <
ffff88007d8c2a40 3210086704 C Ci:1:004:0 0 5 = 01fec606 00
ffff88007d8c2a40 3210086729 S Ci:1:004:0 s c0 0d fe00 07c6 0004 4 <
ffff88007d8c2a40 3210087773 C Ci:1:004:0 0 4 = 01fec607
ffff88007d8c2a40 3210087797 S Ci:1:004:0 s c0 0d 0003 0000 0002 2 <
ffff88007d8c2a40 3210088771 C Ci:1:004:0 0 2 = 0100
ffff88007d8c2a40 3210088795 S Ci:1:004:0 s c0 0e 0030 0000 0005 5 <
ffff88007d8c2a40 3210090810 C Ci:1:004:0 0 5 = 01fec607 00
ffff88007d8c2a40 3210090836 S Ci:1:004:0 s c0 0d fe00 08c6 0004 4 <
ffff88007d8c2a40 3210091832 C Ci:1:004:0 0 4 = 01fec608
ffff88007d8c2a40 3210091856 S Ci:1:004:0 s c0 0d ff03 0000 0002 2 <
ffff88007d8c2a40 3210092601 C Ci:1:004:0 0 2 = 01ff
ffff88007d8c2a40 3210092628 S Ci:1:004:0 s c0 0e 0030 0000 0005 5 <
ffff88007d8c2a40 3210094588 C Ci:1:004:0 0 5 = 01fec608 ff
ffff88007d8c2a40 3210094647 S Ci:1:004:0 s c0 0d fe00 09c6 0004 4 <
ffff88007d8c2a40 3210095304 C Ci:1:004:0 0 4 = 01fec609
ffff88007d8c2a40 3210095328 S Ci:1:004:0 s c0 0d 6e03 0000 0002 2 <
ffff88007d8c2a40 3210096187 C Ci:1:004:0 0 2 = 016e
ffff88007d8c2a40 3210096231 S Ci:1:004:0 s c0 0e 0030 0000 0005 5 <
ffff88007d8c2a40 3210098175 C Ci:1:004:0 0 5 = 01fec609 6e
ffff88007d8c2a40 3210098207 S Ci:1:004:0 s c0 0d fe00 0ac6 0004 4 <
ffff88007d8c2a40 3210098821 C Ci:1:004:0 0 4 = 01fec60a
ffff88007d8c2a40 3210098849 S Ci:1:004:0 s c0 0d b803 0000 0002 2 <
ffff88007d8c2a40 3210103941 C Ci:1:004:0 0 2 = 01b8
ffff88007d8c2a40 3210103988 S Ci:1:004:0 s c0 0e 0030 0000 0005 5 <
ffff88007d8c2a40 3210106617 C Ci:1:004:0 0 5 = 01fec60a b8
ffff88007d8c2a40 3210106665 S Ci:1:004:0 s c0 0d fe00 0bc6 0004 4 <
ffff88007d8c2a40 3210112005 C Ci:1:004:0 0 4 = 01fec60b
ffff88007d8c2a40 3210112052 S Ci:1:004:0 s c0 0d 8203 0000 0002 2 <
ffff88007d8c2a40 3210113617 C Ci:1:004:0 0 2 = 0182
ffff88007d8c2a40 3210113789 S Ci:1:004:0 s c0 0e 0030 0000 0005 5 <
ffff88007d8c2a40 3210117533 C Ci:1:004:0 0 5 = 01fec60b 82
ffff88007d8c2a40 3210117563 S Ci:1:004:0 s c0 0d fe00 0cc6 0004 4 <
ffff88007d8c2a40 3210118390 C Ci:1:004:0 0 4 = 01fec60c
ffff88007d8c2a40 3210118417 S Ci:1:004:0 s c0 0d f803 0000 0002 2 <
ffff88007d8c2a40 3210119149 C Ci:1:004:0 0 2 = 01f8
ffff88007d8c2a40 3210119173 S Ci:1:004:0 s c0 0e 0030 0000 0005 5 <
ffff88007d8c2a40 3210121261 C Ci:1:004:0 0 5 = 01fec60c f8
ffff88007d8c2a40 3210121284 S Ci:1:004:0 s c0 0d fe00 0dc6 0004 4 <
ffff88007d8c2a40 3210122400 C Ci:1:004:0 0 4 = 01fec60d
ffff88007d8c2a40 3210122423 S Ci:1:004:0 s c0 0d 0203 0000 0002 2 <
ffff88007d8c2a40 3210123378 C Ci:1:004:0 0 2 = 0102
ffff88007d8c2a40 3210123401 S Ci:1:004:0 s c0 0e 0030 0000 0005 5 <
ffff88007d8c2a40 3210125371 C Ci:1:004:0 0 5 = 01fec60d 02
ffff88007d8c2a40 3210125395 S Ci:1:004:0 s c0 0d fe00 0ec6 0004 4 <
ffff88007d8c2a40 3210126116 C Ci:1:004:0 0 4 = 01fec60e
ffff88007d8c2a40 3210126153 S Ci:1:004:0 s c0 0d 0003 0000 0002 2 <
ffff88007d8c2a40 3210127417 C Ci:1:004:0 0 2 = 0100
ffff88007d8c2a40 3210127617 S Ci:1:004:0 s c0 0e 0030 0000 0005 5 <
ffff88007d8c2a40 3210130995 C Ci:1:004:0 0 5 = 01fec60e 00
ffff88007d8c2a40 3210131032 S Ci:1:004:0 s c0 0d fe00 0fc6 0004 4 <
ffff88007d8c2a40 3210131794 C Ci:1:004:0 0 4 = 01fec60f
ffff88007d8c2a40 3210131816 S Ci:1:004:0 s c0 0d 0003 0000 0002 2 <
ffff88007d8c2a40 3210136931 C Ci:1:004:0 0 2 = 0100
ffff88007d8c2a40 3210136978 S Ci:1:004:0 s c0 0e 0030 0000 0005 5 <
ffff88007d8c2a40 3210139508 C Ci:1:004:0 0 5 = 01fec60f 00
ffff88007d8c2a40 3210139534 S Ci:1:004:0 s c0 0d fe00 10c6 0004 4 <
ffff88007d8c2a40 3210140290 C Ci:1:004:0 0 4 = 01fec610
ffff88007d8c2a40 3210140315 S Ci:1:004:0 s c0 0d 0003 0000 0002 2 <
ffff88007d8c2a40 3210141081 C Ci:1:004:0 0 2 = 0100
ffff88007d8c2a40 3210141105 S Ci:1:004:0 s c0 0e 0030 0000 0005 5 <
ffff88007d8c2a40 3210143296 C Ci:1:004:0 0 5 = 01fec610 00
ffff88007d8c2a40 3210143415 S Ci:1:004:0 s c0 0d fe00 11c6 0004 4 <
ffff88007d8c2a40 3210144021 C Ci:1:004:0 0 4 = 01fec611
ffff88007d8c2a40 3210144047 S Ci:1:004:0 s c0 0d 0003 0000 0002 2 <
ffff88007d8c2a40 3210144715 C Ci:1:004:0 0 2 = 0100
ffff88007d8c2a40 3210144736 S Ci:1:004:0 s c0 0e 0030 0000 0005 5 <
ffff88007d8c2a40 3210146647 C Ci:1:004:0 0 5 = 01fec611 00
ffff88007d8c2a40 3210146791 S Ci:1:004:0 s c0 0d fe00 12c6 0004 4 <
ffff88007d8c2a40 3210151945 C Ci:1:004:0 0 4 = 01fec612
ffff88007d8c2a40 3210151983 S Ci:1:004:0 s c0 0d 1b03 0000 0002 2 <
ffff88007d8c2a40 3210153471 C Ci:1:004:0 0 2 = 011b
ffff88007d8c2a40 3210153495 S Ci:1:004:0 s c0 0e 0030 0000 0005 5 <
ffff88007d8c2a40 3210155575 C Ci:1:004:0 0 5 = 01fec612 1b
ffff88007d8c2a40 3210155599 S Ci:1:004:0 s c0 0d fe00 13c6 0004 4 <
ffff88007d8c2a40 3210160949 C Ci:1:004:0 0 4 = 01fec613
ffff88007d8c2a40 3210161049 S Ci:1:004:0 s c0 0d 1003 0000 0002 2 <
ffff88007d8c2a40 3210162572 C Ci:1:004:0 0 2 = 0110
ffff88007d8c2a40 3210162610 S Ci:1:004:0 s c0 0e 0030 0000 0005 5 <
ffff88007d8c2a40 3210166548 C Ci:1:004:0 0 5 = 01fec613 10
ffff88007d8c2a40 3210166640 S Ci:1:004:0 s c0 0d fe00 14c6 0004 4 <
ffff88007d8c2a40 3210167214 C Ci:1:004:0 0 4 = 01fec614
ffff88007d8c2a40 3210167238 S Ci:1:004:0 s c0 0d 0003 0000 0002 2 <
ffff88007d8c2a40 3210168031 C Ci:1:004:0 0 2 = 0100
ffff88007d8c2a40 3210168054 S Ci:1:004:0 s c0 0e 0030 0000 0005 5 <
ffff88007d8c2a40 3210169906 C Ci:1:004:0 0 5 = 01fec614 00
ffff88007d8c2a40 3210169931 S Ci:1:004:0 s c0 0d fe00 15c6 0004 4 <
ffff88007d8c2a40 3210170868 C Ci:1:004:0 0 4 = 01fec615
ffff88007d8c2a40 3210170897 S Ci:1:004:0 s c0 0d 0403 0000 0002 2 <
ffff88007d8c2a40 3210171794 C Ci:1:004:0 0 2 = 0104
ffff88007d8c2a40 3210171852 S Ci:1:004:0 s c0 0e 0030 0000 0005 5 <
ffff88007d8c2a40 3210173706 C Ci:1:004:0 0 5 = 01fec615 04
ffff88007d8c2a40 3210173733 S Ci:1:004:0 s c0 03 0132 0090 0002 2 <
ffff88007d8c2a40 3210175069 C Ci:1:004:0 0 2 = 0101
ffff88007d8c2a40 3210175092 S Ci:1:004:0 s c0 03 0332 0000 0002 2 <
ffff88007d8c2a40 3210177076 C Ci:1:004:0 0 2 = 0103
ffff88007d8c2a40 3210177383 S Ci:1:004:0 s c0 03 0432 0002 0002 2 <
ffff88007d8c2a40 3210180513 C Ci:1:004:0 0 2 = 0104
ffff88007d8c2a40 3210180602 S Ci:1:004:0 s c0 03 0632 0000 0002 2 <
ffff88007d8c2a40 3210181816 C Ci:1:004:0 0 2 = 0106
ffff88007d8c2a40 3210181847 S Ci:1:004:0 s c0 03 0732 0041 0002 2 <
ffff88007d8c2a40 3210183175 C Ci:1:004:0 0 2 = 0107
ffff88007d8c2a40 3210183202 S Ci:1:004:0 s c0 03 0832 0000 0002 2 <
ffff88007d8c2a40 3210184526 C Ci:1:004:0 0 2 = 0108
ffff88007d8c2a40 3210184551 S Ci:1:004:0 s c0 03 0932 0000 0002 2 <
ffff88007d8c2a40 3210185852 C Ci:1:004:0 0 2 = 0109
ffff88007d8c2a40 3210185888 S Ci:1:004:0 s c0 03 0a32 00ff 0002 2 <
ffff88007d8c2a40 3210187396 C Ci:1:004:0 0 2 = 010a
ffff88007d8c2a40 3210187420 S Ci:1:004:0 s c0 03 0c32 0059 0002 2 <
ffff88007d8c2a40 3210188757 C Ci:1:004:0 0 2 = 010c
ffff88007d8c2a40 3210188782 S Ci:1:004:0 s c0 03 0d32 00f2 0002 2 <
ffff88007d8c2a40 3210189990 C Ci:1:004:0 0 2 = 010d
ffff88007d8c2a40 3210190015 S Ci:1:004:0 s c0 03 0e32 00f0 0002 2 <
ffff88007d8c2a40 3210191563 C Ci:1:004:0 0 2 = 010e
ffff88007d8c2a40 3210191586 S Ci:1:004:0 s c0 03 0f32 0050 0002 2 <
ffff88007d8c2a40 3210193367 C Ci:1:004:0 0 2 = 010f
ffff88007d8c2a40 3210194161 S Ci:1:004:0 s c0 03 1032 00b2 0002 2 <
ffff88007d8c2a40 3210196456 C Ci:1:004:0 0 2 = 0110
ffff88007d8c2a40 3210196489 S Ci:1:004:0 s c0 03 1132 0000 0002 2 <
ffff88007d8c2a40 3210197775 C Ci:1:004:0 0 2 = 0111
ffff88007d8c2a40 3210197804 S Ci:1:004:0 s c0 03 1232 0030 0002 2 <
ffff88007d8c2a40 3210199176 C Ci:1:004:0 0 2 = 0112
ffff88007d8c2a40 3210199267 S Ci:1:004:0 s c0 03 1332 0080 0002 2 <
ffff88007d8c2a40 3210200503 C Ci:1:004:0 0 2 = 0113
ffff88007d8c2a40 3210200585 S Ci:1:004:0 s c0 03 1432 0000 0002 2 <
ffff88007d8c2a40 3210201706 C Ci:1:004:0 0 2 = 0114
ffff88007d8c2a40 3210201731 S Ci:1:004:0 s c0 03 1532 0000 0002 2 <
ffff88007d8c2a40 3210202958 C Ci:1:004:0 0 2 = 0115
ffff88007d8c2a40 3210202983 S Ci:1:004:0 s c0 03 1732 0000 0002 2 <
ffff88007d8c2a40 3210204278 C Ci:1:004:0 0 2 = 0117
ffff88007d8c2a40 3210204303 S Ci:1:004:0 s c0 03 1a32 0000 0002 2 <
ffff88007d8c2a40 3210205619 C Ci:1:004:0 0 2 = 011a
ffff88007d8c2a40 3210205645 S Ci:1:004:0 s c0 03 1b32 0000 0002 2 <
ffff88007d8c2a40 3210206957 C Ci:1:004:0 0 2 = 011b
ffff88007d8c2a40 3210206980 S Ci:1:004:0 s c0 03 1c32 0000 0002 2 <
ffff88007d8c2a40 3210208331 C Ci:1:004:0 0 2 = 011c
ffff88007d8c2a40 3210208355 S Ci:1:004:0 s c0 03 1d32 0000 0002 2 <
ffff88007d8c2a40 3210209594 C Ci:1:004:0 0 2 = 011d
ffff88007d8c2a40 3210209631 S Ci:1:004:0 s c0 03 1e32 0000 0002 2 <
ffff88007d8c2a40 3210210950 C Ci:1:004:0 0 2 = 011e
ffff88007d8c2a40 3210210990 S Ci:1:004:0 s c0 03 1f32 0000 0002 2 <
ffff88007d8c2a40 3210212378 C Ci:1:004:0 0 2 = 011f
ffff88007d8c2a40 3210212409 S Ci:1:004:0 s c0 03 2032 0000 0002 2 <
ffff88007d8c2a40 3210213727 C Ci:1:004:0 0 2 = 0120
ffff88007d8c2a40 3210213784 S Ci:1:004:0 s c0 03 3832 0040 0002 2 <
ffff88007d8c2a40 3210215093 C Ci:1:004:0 0 2 = 0138
ffff88007d8c2a40 3210215141 S Ci:1:004:0 s c0 03 3932 0010 0002 2 <
ffff88007d8c2a40 3210216369 C Ci:1:004:0 0 2 = 0139
ffff88007d8c2a40 3210216392 S Ci:1:004:0 s c0 03 3b32 0090 0002 2 <
ffff88007d8c2a40 3210217689 C Ci:1:004:0 0 2 = 013b
ffff88007d8c2a40 3210217731 S Ci:1:004:0 s c0 03 5132 00b0 0002 2 <
ffff88007d8c2a40 3210218991 C Ci:1:004:0 0 2 = 0151
ffff88007d8c2a40 3210219015 S Ci:1:004:0 s c0 03 5232 0089 0002 2 <
ffff88007d8c2a40 3210220236 C Ci:1:004:0 0 2 = 0152
ffff88007d8c2a40 3210220259 S Ci:1:004:0 s c0 03 5332 00b3 0002 2 <
ffff88007d8c2a40 3210221590 C Ci:1:004:0 0 2 = 0153
ffff88007d8c2a40 3210221614 S Ci:1:004:0 s c0 03 5a32 002d 0002 2 <
ffff88007d8c2a40 3210222969 C Ci:1:004:0 0 2 = 015a
ffff88007d8c2a40 3210222992 S Ci:1:004:0 s c0 03 5b32 00d3 0002 2 <
ffff88007d8c2a40 3210224455 C Ci:1:004:0 0 2 = 015b
ffff88007d8c2a40 3210224479 S Ci:1:004:0 s c0 03 8532 0069 0002 2 <
ffff88007d8c2a40 3210225728 C Ci:1:004:0 0 2 = 0185
ffff88007d8c2a40 3210225755 S Ci:1:004:0 s c0 03 8732 0004 0002 2 <
ffff88007d8c2a40 3210227574 C Ci:1:004:0 0 2 = 0187
ffff88007d8c2a40 3210227638 S Ci:1:004:0 s c0 03 8d32 0000 0002 2 <
ffff88007d8c2a40 3210230853 C Ci:1:004:0 0 2 = 018d
ffff88007d8c2a40 3210230905 S Ci:1:004:0 s c0 03 8e32 0000 0002 2 <
ffff88007d8c2a40 3210232106 C Ci:1:004:0 0 2 = 018e
ffff88007d8c2a40 3210232183 S Ci:1:004:0 s c0 03 a332 0011 0002 2 <
ffff88007d8c2a40 3210233481 C Ci:1:004:0 0 2 = 01a3
ffff88007d8c2a40 3210233531 S Ci:1:004:0 s c0 03 a432 0000 0002 2 <
ffff88007d8c2a40 3210234924 C Ci:1:004:0 0 2 = 01a4
ffff88007d8c2a40 3210234961 S Ci:1:004:0 s c0 03 a532 0040 0002 2 <
ffff88007d8c2a40 3210236236 C Ci:1:004:0 0 2 = 01a5
ffff88007d8c2a40 3210236297 S Ci:1:004:0 s c0 03 a632 0004 0002 2 <
ffff88007d8c2a40 3210237726 C Ci:1:004:0 0 2 = 01a6
ffff88007d8c2a40 3210237750 S Ci:1:004:0 s c0 03 0f30 0034 0002 2 <
ffff88007d8c2a40 3210238942 C Ci:1:004:0 0 2 = 010f
ffff88007d8c2a40 3210238980 S Ci:1:004:0 s c0 03 2530 0000 0002 2 <
ffff88007d8c2a40 3210240326 C Ci:1:004:0 0 2 = 0125
ffff88007d8c2a40 3210240351 S Ci:1:004:0 s c0 03 2330 004d 0002 2 <
ffff88007d8c2a40 3210241586 C Ci:1:004:0 0 2 = 0123
ffff88007d8c2a40 3210241609 S Ci:1:004:0 s c0 0d fe00 13c6 0004 4 <
ffff88007d8c2a40 3210247010 C Ci:1:004:0 0 4 = 01fec613
ffff88007d8c2a40 3210247067 S Ci:1:004:0 s c0 0d 0203 0000 0002 2 <
ffff88007d8c2a40 3210248483 C Ci:1:004:0 0 2 = 0102
ffff88007d8c2a40 3210248533 S Ci:1:004:0 s c0 0e 0030 0000 0005 5 <
ffff88007d8c2a40 3210250284 C Ci:1:004:0 0 5 = 01fec613 02
ffff88007d8c2a40 3210250315 S Ci:1:004:0 s c0 08 0100 0000 0001 1 <
ffff88007d8c2a40 3210251033 C Ci:1:004:0 0 1 = 76
ffff88007d8c2a40 3210251056 S Ci:1:004:0 s c0 03 fe30 09c6 0003 3 <
ffff88007d8c2a40 3210252666 C Ci:1:004:0 0 3 = 01fec6
ffff88007d8c2a40 3210252733 S Ci:1:004:0 s c0 14 fe30 00c7 0002 2 <
ffff88007d8c2a40 3210254052 C Ci:1:004:0 0 2 = 01fe
ffff88007d8c2a40 3210254077 S Ci:1:004:0 s c0 19 0030 0000 0002 2 <
ffff88007d8c2a40 3210255163 C Ci:1:004:0 0 2 = 016e
ffff88007d8c2a40 3210255182 S Ci:1:004:0 s c0 0d fe00 09c6 0004 4 <
ffff88007d8c2a40 3210255931 C Ci:1:004:0 0 4 = 01fec609
ffff88007d8c2a40 3210255954 S Ci:1:004:0 s c0 0d 7e03 0000 0002 2 <
ffff88007d8c2a40 3210256908 C Ci:1:004:0 0 2 = 017e
ffff88007d8c2a40 3210256931 S Ci:1:004:0 s c0 0e 0030 0000 0005 5 <
ffff88007d8c2a40 3210258849 C Ci:1:004:0 0 5 = 01fec609 7e
ffff88007d8c2a40 3210258885 S Ci:1:004:0 s c0 03 fe30 06c6 0003 3 <
ffff88007d8c2a40 3210260987 C Ci:1:004:0 0 3 = 01fec6
ffff88007d8c2a40 3210261124 S Ci:1:004:0 s c0 14 fe30 00c7 0002 2 <
ffff88007d8c2a40 3210264099 C Ci:1:004:0 0 2 = 01fe
ffff88007d8c2a40 3210264168 S Ci:1:004:0 s c0 19 0030 0000 0002 2 <
ffff88007d8c2a40 3210265371 C Ci:1:004:0 0 2 = 0100
ffff88007d8c2a40 3210265417 S Ci:1:004:0 s c0 0d fe00 06c6 0004 4 <
ffff88007d8c2a40 3210266109 C Ci:1:004:0 0 4 = 01fec606
ffff88007d8c2a40 3210266163 S Ci:1:004:0 s c0 0d 0103 0000 0002 2 <
ffff88007d8c2a40 3210266986 C Ci:1:004:0 0 2 = 0101
ffff88007d8c2a40 3210267015 S Ci:1:004:0 s c0 0e 0030 0000 0005 5 <
ffff88007d8c2a40 3210268799 C Ci:1:004:0 0 5 = 01fec606 01
ffff88007d8c2a40 3210269970 S Ci:1:004:0 s c0 03 fe30 09c6 0003 3 <
ffff88007d8c2a40 3210272595 C Ci:1:004:0 0 3 = 01fec6
ffff88007d8c2a40 3210272621 S Ci:1:004:0 s c0 14 fe30 00c7 0002 2 <
ffff88007d8c2a40 3210273901 C Ci:1:004:0 0 2 = 01fe
ffff88007d8c2a40 3210273923 S Ci:1:004:0 s c0 19 0030 0000 0002 2 <
ffff88007d8c2a40 3210274980 C Ci:1:004:0 0 2 = 017e
ffff88007d8c2a40 3210275003 S Ci:1:004:0 s c0 0d fe00 09c6 0004 4 <
ffff88007d8c2a40 3210275850 C Ci:1:004:0 0 4 = 01fec609
ffff88007d8c2a40 3210275871 S Ci:1:004:0 s c0 0d 6e03 0000 0002 2 <
ffff88007d8c2a40 3210281063 C Ci:1:004:0 0 2 = 016e
ffff88007d8c2a40 3210281204 S Ci:1:004:0 s c0 0e 0030 0000 0005 5 <
ffff88007d8c2a40 3210283662 C Ci:1:004:0 0 5 = 01fec609 6e
ffff88007d8c2a40 3210283694 S Ci:1:004:0 s c0 03 fe30 06c6 0003 3 <
ffff88007d8c2a40 3210285136 C Ci:1:004:0 0 3 = 01fec6
ffff88007d8c2a40 3210285178 S Ci:1:004:0 s c0 14 fe30 00c7 0002 2 <
ffff88007d8c2a40 3210286409 C Ci:1:004:0 0 2 = 01fe
ffff88007d8c2a40 3210286429 S Ci:1:004:0 s c0 19 0030 0000 0002 2 <
ffff88007d8c2a40 3210287584 C Ci:1:004:0 0 2 = 0101
ffff88007d8c2a40 3210287605 S Ci:1:004:0 s c0 0d fe00 06c6 0004 4 <
ffff88007d8c2a40 3210292933 C Ci:1:004:0 0 4 = 01fec606
ffff88007d8c2a40 3210292965 S Ci:1:004:0 s c0 0d 0103 0000 0002 2 <
ffff88007d8c2a40 3210294690 C Ci:1:004:0 0 2 = 0101
ffff88007d8c2a40 3210294762 S Ci:1:004:0 s c0 0e 0030 0000 0005 5 <
ffff88007d8c2a40 3210296603 C Ci:1:004:0 0 5 = 01fec606 01
ffff88007d8c2a40 3210296627 S Ci:1:004:0 s c0 0d fe00 01c6 0004 4 <
ffff88007d8c2a40 3210301949 C Ci:1:004:0 0 4 = 01fec601
ffff88007d8c2a40 3210302003 S Ci:1:004:0 s c0 0d 0403 0000 0002 2 <
ffff88007d8c2a40 3210303389 C Ci:1:004:0 0 2 = 0104
ffff88007d8c2a40 3210303429 S Ci:1:004:0 s c0 0e 0030 0000 0005 5 <
ffff88007d8c2a40 3210305242 C Ci:1:004:0 0 5 = 01fec601 04
ffff88007d8c2a40 3210305284 S Ci:1:004:0 s c0 0d fe00 02c6 0004 4 <
ffff88007d8c2a40 3210306000 C Ci:1:004:0 0 4 = 01fec602
ffff88007d8c2a40 3210306020 S Ci:1:004:0 s c0 0d 1503 0000 0002 2 <
ffff88007d8c2a40 3210306738 C Ci:1:004:0 0 2 = 0115
ffff88007d8c2a40 3210306758 S Ci:1:004:0 s c0 0e 0030 0000 0005 5 <
ffff88007d8c2a40 3210308650 C Ci:1:004:0 0 5 = 01fec602 15
ffff88007d8c2a40 3210308678 S Ci:1:004:0 s c0 0d fe00 03c6 0004 4 <
ffff88007d8c2a40 3210314082 C Ci:1:004:0 0 4 = 01fec603
ffff88007d8c2a40 3210314222 S Ci:1:004:0 s c0 0d e703 0000 0002 2 <
ffff88007d8c2a40 3210315376 C Ci:1:004:0 0 2 = 01e7
ffff88007d8c2a40 3210315402 S Ci:1:004:0 s c0 0e 0030 0000 0005 5 <
ffff88007d8c2a40 3210317145 C Ci:1:004:0 0 5 = 01fec603 e7
ffff88007d8c2a40 3210317172 S Ci:1:004:0 s c0 0d fe00 04c6 0004 4 <
ffff88007d8c2a40 3210317911 C Ci:1:004:0 0 4 = 01fec604
ffff88007d8c2a40 3210317959 S Ci:1:004:0 s c0 0d 9f03 0000 0002 2 <
ffff88007d8c2a40 3210322909 C Ci:1:004:0 0 2 = 019f
ffff88007d8c2a40 3210322934 S Ci:1:004:0 s c0 0e 0030 0000 0005 5 <
ffff88007d8c2a40 3210325795 C Ci:1:004:0 0 5 = 01fec604 9f
ffff88007d8c2a40 3210325823 S Ci:1:004:0 s c0 0d fe00 05c6 0004 4 <
ffff88007d8c2a40 3210326937 C Ci:1:004:0 0 4 = 01fec605
ffff88007d8c2a40 3210327216 S Ci:1:004:0 s c0 0d 0f03 0000 0002 2 <
ffff88007d8c2a40 3210329391 C Ci:1:004:0 0 2 = 010f
ffff88007d8c2a40 3210329428 S Ci:1:004:0 s c0 0e 0030 0000 0005 5 <
ffff88007d8c2a40 3210331170 C Ci:1:004:0 0 5 = 01fec605 0f
ffff88007d8c2a40 3210331208 S Ci:1:004:0 s c0 0d fe00 06c6 0004 4 <
ffff88007d8c2a40 3210332098 C Ci:1:004:0 0 4 = 01fec606
ffff88007d8c2a40 3210332162 S Ci:1:004:0 s c0 0d 8a03 0000 0002 2 <
ffff88007d8c2a40 3210332840 C Ci:1:004:0 0 2 = 018a
ffff88007d8c2a40 3210332867 S Ci:1:004:0 s c0 0e 0030 0000 0005 5 <
ffff88007d8c2a40 3210334691 C Ci:1:004:0 0 5 = 01fec606 8a
ffff88007d8c2a40 3210334725 S Ci:1:004:0 s c0 0d fe00 0ec6 0004 4 <
ffff88007d8c2a40 3210335609 C Ci:1:004:0 0 4 = 01fec60e
ffff88007d8c2a40 3210335632 S Ci:1:004:0 s c0 0d 8003 0000 0002 2 <
ffff88007d8c2a40 3210340906 C Ci:1:004:0 0 2 = 0180
ffff88007d8c2a40 3210340926 S Ci:1:004:0 s c0 0e 0030 0000 0005 5 <
ffff88007d8c2a40 3210343788 C Ci:1:004:0 0 5 = 01fec60e 80
ffff88007d8c2a40 3210343940 S Ci:1:004:0 s c0 0d fe00 0ec6 0004 4 <
ffff88007d8c2a40 3210346623 C Ci:1:004:0 0 4 = 01fec60e
ffff88007d8c2a40 3210346759 S Ci:1:004:0 s c0 0d 0003 0000 0002 2 <
ffff88007d8c2a40 3210347379 C Ci:1:004:0 0 2 = 0100
ffff88007d8c2a40 3210347442 S Ci:1:004:0 s c0 0e 0030 0000 0005 5 <
ffff88007d8c2a40 3210349450 C Ci:1:004:0 0 5 = 01fec60e 00
ffff88007d8c2a40 3210350776 S Ci:1:004:0 s c0 0d fe00 0ec6 0004 4 <
ffff88007d8c2a40 3210352430 C Ci:1:004:0 0 4 = 01fec60e
ffff88007d8c2a40 3210352453 S Ci:1:004:0 s c0 0d 0003 0000 0002 2 <
ffff88007d8c2a40 3210353248 C Ci:1:004:0 0 2 = 0100
ffff88007d8c2a40 3210353310 S Ci:1:004:0 s c0 0e 0030 0000 0005 5 <
ffff88007d8c2a40 3210355084 C Ci:1:004:0 0 5 = 01fec60e 00
ffff88007d8c2a40 3210355111 S Ci:1:004:0 s c0 03 fe30 0ec6 0003 3 <
ffff88007d8c2a40 3210356612 C Ci:1:004:0 0 3 = 01fec6
ffff88007d8c2a40 3210356637 S Ci:1:004:0 s c0 14 fe30 00c7 0002 2 <
ffff88007d8c2a40 3210358177 C Ci:1:004:0 0 2 = 01fe
ffff88007d8c2a40 3210358200 S Ci:1:004:0 s c0 19 0030 0000 0002 2 <
ffff88007d8c2a40 3210359342 C Ci:1:004:0 0 2 = 0168
ffff88007d8c2a40 3210359373 S Ci:1:004:0 s c0 02 1e30 0001 0002 2 <
ffff88007d8c2a40 3210361062 C Ci:1:004:0 0 2 = 0100
ffff88007d8c2a40 3210361117 S Ci:1:004:0 s c0 03 1e30 0030 0002 2 <
ffff88007d8c2a40 3210362328 C Ci:1:004:0 0 2 = 011e
ffff88007d8c2a40 3210362373 S Ci:1:004:0 s c0 03 fe30 0ec6 0003 3 <
ffff88007d8c2a40 3210363659 C Ci:1:004:0 0 3 = 01fec6
ffff88007d8c2a40 3210363728 S Ci:1:004:0 s c0 14 fe30 00c7 0002 2 <
ffff88007d8c2a40 3210365053 C Ci:1:004:0 0 2 = 01fe
ffff88007d8c2a40 3210365078 S Ci:1:004:0 s c0 19 0030 0000 0002 2 <
ffff88007d8c2a40 3210366284 C Ci:1:004:0 0 2 = 0168
ffff88007d8c2a40 3210366328 S Ci:1:004:0 s c0 03 0f30 0034 0002 2 <
ffff88007d8c2a40 3210367608 C Ci:1:004:0 0 2 = 010f
ffff88007d8c2a40 3210367730 S Ci:1:004:0 s c0 03 0130 0040 0002 2 <
ffff88007d8c2a40 3210370918 C Ci:1:004:0 0 2 = 0101
ffff88007d8c2a40 3210370944 S Ci:1:004:0 s c0 03 2330 004c 0002 2 <
ffff88007d8c2a40 3210372238 C Ci:1:004:0 0 2 = 0123
ffff88007d8c2a40 3210372266 S Ci:1:004:0 s c0 08 11df 0000 0001 1 <
ffff88007d8c2a40 3210372792 C Ci:1:004:0 0 1 = 77
ffff88007d8c2a40 3210398071 S Ci:1:004:0 s c0 08 1100 0000 0001 1 <
ffff88007d8c2a40 3210399444 C Ci:1:004:0 0 1 = 66
ffff88007d8c2a40 3210424892 S Ci:1:004:0 s c0 08 11df 0000 0001 1 <
ffff88007d8c2a40 3210426263 C Ci:1:004:0 0 1 = 77
ffff88007d8c2a40 3210476534 S Ci:1:004:0 s c0 02 095a 0000 0002 2 <
ffff88007d8c2a40 3210497913 C Ci:1:004:0 0 2 = 0023
ffff88007d8c2a40 3210508265 S Ci:1:004:0 s c0 02 094a 0000 0002 2 <
ffff88007d8c2a40 3210514025 C Ci:1:004:0 0 2 = 011e
ffff88007d8c2a40 3210514174 S Ci:1:004:0 s c0 02 094a 0000 0002 2 <
ffff88007d8c2a40 3210517643 C Ci:1:004:0 0 2 = 011e
ffff88007d8c2a40 3210517979 S Ci:1:004:0 s c0 0a 0000 0000 0001 1 <
ffff88007d8c2a40 3210520461 C Ci:1:004:0 0 1 = 01
ffff88007d8c2a40 3210520487 S Ci:1:004:0 s c0 04 0040 0000 0002 2 <
ffff88007d8c2a40 3210521219 C Ci:1:004:0 0 2 = 010c
ffff88007d8c2a40 3210521242 S Ci:1:004:0 s c0 05 0c40 0000 0002 2 <
ffff88007d8c2a40 3210521870 C Ci:1:004:0 0 2 = 010c
ffff88007d8c2a40 3210521894 S Ci:1:004:0 s c0 02 094a 0000 0002 2 <
ffff88007d8c2a40 3210523462 C Ci:1:004:0 0 2 = 011e
ffff88007d8c2a40 3210523527 S Ci:1:004:0 s c0 03 054a 0020 0002 2 <
ffff88007d8c2a40 3210524848 C Ci:1:004:0 0 2 = 0105
ffff88007d8c2a40 3210524871 S Ci:1:004:0 s c0 02 00d2 0000 0002 2 <
ffff88007d8c2a40 3210550209 C Ci:1:004:0 0 2 = 0005
ffff88007d8c2a40 3210550352 S Ci:1:004:0 s c0 05 1f41 00ff 0003 3 <
ffff88007d8c2a40 3210550855 C Ci:1:004:0 0 3 = 011fff
ffff88007d8c2a40 3210550869 S Ci:1:004:0 s c0 05 1f43 00ff 0003 3 <
ffff88007d8c2a40 3210551741 C Ci:1:004:0 0 3 = 011fff
ffff88007d8c2a40 3210552316 S Bi:1:004:1 -115 65536 <
ffff88007d955d80 3210552324 S Bi:1:004:1 -115 65536 <
ffff88007d955a80 3210552328 S Bi:1:004:1 -115 65536 <
ffff88007d955c00 3210552332 S Bi:1:004:1 -115 65536 <
ffff88007d955840 3210552334 S Ci:1:004:0 s c0 06 0000 0000 0001 1 <
ffff88007d955840 3210554811 C Ci:1:004:0 0 1 = 01
ffff88007d955840 3210554826 S Ci:1:004:0 s c0 04 0040 0000 0002 2 <
ffff88007d955840 3210560124 C Ci:1:004:0 0 2 = 010c
ffff88007d955840 3210560189 S Ci:1:004:0 s c0 05 0c40 0000 0002 2 <
ffff88007d955840 3210561645 C Ci:1:004:0 0 2 = 010c
ffff88007d955840 3210561784 S Ci:1:004:0 s c0 17 0002 0000 0003 3 <
ffff88007d955840 3210566998 C Ci:1:004:0 0 3 = 011152
ffff88007d955840 3210567126 S Ci:1:004:0 s c0 08 0800 0000 0001 1 <
ffff88007d955840 3210568260 C Ci:1:004:0 0 1 = 77
ffff88007d955840 3210569914 S Ci:1:004:0 s c0 03 004a 0080 0002 2 <
ffff88007d955840 3210571836 C Ci:1:004:0 0 2 = 0100
ffff88007d955840 3210582077 S Ci:1:004:0 s c0 03 004a 0000 0002 2 <
ffff88007d955840 3210588068 C Ci:1:004:0 0 2 = 0100
ffff88007d955840 3210588087 S Ci:1:004:0 s c0 03 044a 0000 0002 2 <
ffff88007d955840 3210589323 C Ci:1:004:0 0 2 = 0104
ffff88007d955840 3210589338 S Ci:1:004:0 s c0 03 004a 0000 0002 2 <
ffff88007d955840 3210590623 C Ci:1:004:0 0 2 = 0100
ffff88007d955840 3210618559 S Ci:1:004:0 s c0 02 094a 0000 0002 2 <
ffff88007d955840 3210625411 C Ci:1:004:0 0 2 = 011e
ffff88007d955840 3210625431 S Ci:1:004:0 s c0 02 095a 0000 0002 2 <
ffff88007d955840 3210628936 C Ci:1:004:0 0 2 = 001e
ffff88007d955840 3210639144 S Ci:1:004:0 s c0 02 094a 0000 0002 2 <
ffff88007d955840 3210645278 C Ci:1:004:0 0 2 = 011e
ffff88007d955840 3210645309 S Ci:1:004:0 s c0 02 094a 0000 0002 2 <
ffff88007d955840 3210646816 C Ci:1:004:0 0 2 = 011e
ffff88007d955840 3210647232 S Ci:1:004:0 s c0 04 00c0 0000 0002 2 <
ffff88007d955840 3210649646 C Ci:1:004:0 0 2 = 0104
ffff88007d955840 3210649671 S Ci:1:004:0 s c0 05 07c0 0000 0002 2 <
ffff88007d955840 3210654909 C Ci:1:004:0 0 2 = 0107
ffff88007d955840 3210654921 S Ci:1:004:0 s c0 05 1fc1 00ff 0003 3 <
ffff88007d955840 3210656586 C Ci:1:004:0 0 3 = 011fff
ffff88007d955840 3210656601 S Ci:1:004:0 s c0 05 1fc3 00ff 0003 3 <
ffff88007d955840 3210661960 C Ci:1:004:0 0 3 = 011fff
ffff88007d955840 3210661989 S Ci:1:004:0 s c0 0a 0000 0000 0001 1 <
ffff88007d955840 3210663173 C Ci:1:004:0 0 1 = 01
ffff88007d955840 3210663196 S Ci:1:004:0 s c0 02 094a 0000 0002 2 <
ffff88007d955840 3210664569 C Ci:1:004:0 0 2 = 011e
ffff88007d955840 3210664596 S Ci:1:004:0 s c0 03 054a 0020 0002 2 <
ffff88007d955840 3210666025 C Ci:1:004:0 0 2 = 0105
ffff88007d955840 3210666052 S Ci:1:004:0 s c0 02 00d2 0000 0002 2 <
ffff88007d955840 3210681643 C Ci:1:004:0 0 2 = 0005
ffff88007d955840 3210681811 S Ci:1:004:0 s c0 05 1fc1 7fff 0003 3 <
ffff88007d955840 3210684205 C Ci:1:004:0 0 3 = 011fff
ffff88007d955840 3210684229 S Ci:1:004:0 s c0 05 1fc3 7fff 0003 3 <
ffff88007d955840 3210684849 C Ci:1:004:0 0 3 = 011fff
ffff88007d955840 3210685388 S Bi:1:004:2 -115 65536 <
ffff88007d9553c0 3210685418 S Bi:1:004:2 -115 65536 <
ffff88007d955180 3210685422 S Bi:1:004:2 -115 65536 <
ffff88007d9550c0 3210685436 S Bi:1:004:2 -115 65536 <
ffff88007d9556c0 3210685439 S Ci:1:004:0 s c0 06 0001 0000 0001 1 <
ffff88007d9556c0 3210687642 C Ci:1:004:0 0 1 = 01
ffff88007d9556c0 3210687671 S Ci:1:004:0 s c0 04 00c0 0000 0002 2 <
ffff88007d9556c0 3210692926 C Ci:1:004:0 0 2 = 0107
ffff88007d9556c0 3210692939 S Ci:1:004:0 s c0 05 0fc0 0000 0002 2 <
ffff88007d9556c0 3210694840 C Ci:1:004:0 0 2 = 010f
ffff88007d9556c0 3210698003 S Ci:1:004:0 s c0 02 044a 0000 0002 2 <
ffff88007d9556c0 3210701440 C Ci:1:004:0 0 2 = 0101
ffff88007d9556c0 3210751777 S Ci:1:004:0 s c0 03 004a 0008 0002 2 <
ffff88007d9556c0 3210753222 C Ci:1:004:0 0 2 = 0100
ffff88007d9556c0 3210753259 S Ci:1:004:0 s c0 03 044a 0080 0002 2 <
ffff88007d9556c0 3210754581 C Ci:1:004:0 0 2 = 0104
ffff88007d9556c0 3210954896 S Ci:1:004:0 s c0 03 004a 0009 0002 2 <
ffff88007d9556c0 3210960297 C Ci:1:004:0 0 2 = 0100
ffff88007d9556c0 3211010618 S Ci:1:004:0 s c0 02 394a 0000 0002 2 <
ffff88007d9556c0 3211012803 C Ci:1:004:0 0 2 = 0100
ffff88007d9556c0 3211012846 S Ci:1:004:0 s c0 02 034a 0000 0002 2 <
ffff88007d9556c0 3211014636 C Ci:1:004:0 0 2 = 0102
ffff88007d9556c0 3211014764 S Ci:1:004:0 s c0 02 044a 0000 0002 2 <
ffff88007d9556c0 3211018154 C Ci:1:004:0 0 2 = 0181
ffff88007d9556c0 3211068393 S Ci:1:004:0 s c0 02 394a 0000 0002 2 <
ffff88007d9556c0 3211070588 C Ci:1:004:0 0 2 = 0100
ffff88007d9556c0 3211070606 S Ci:1:004:0 s c0 02 034a 0000 0002 2 <
ffff88007d9556c0 3211072094 C Ci:1:004:0 0 2 = 0105
ffff88007d9556c0 3211072108 S Ci:1:004:0 s c0 02 044a 0000 0002 2 <
ffff88007d9556c0 3211073704 C Ci:1:004:0 0 2 = 0181
ffff88007d9556c0 3211095060 S Ci:1:004:0 s c0 05 1fc1 00ff 0003 3 <
ffff88007d9556c0 3211100273 C Ci:1:004:0 0 3 = 011fff
ffff88007d9556c0 3211100300 S Ci:1:004:0 s c0 05 1fc3 00ff 0003 3 <
ffff88007d9556c0 3211100955 C Ci:1:004:0 0 3 = 011fff
ffff88007d9556c0 3211123842 S Ci:1:004:0 s c0 02 394a 0000 0002 2 <
ffff88007d9556c0 3211129240 C Ci:1:004:0 0 2 = 0100
ffff88007d9556c0 3211129289 S Ci:1:004:0 s c0 02 034a 0000 0002 2 <
ffff88007d9556c0 3211130583 C Ci:1:004:0 0 2 = 010d
ffff88007d9556c0 3211130600 S Ci:1:004:0 s c0 02 044a 0000 0002 2 <
ffff88007d9556c0 3211132202 C Ci:1:004:0 0 2 = 0181
ffff88007d9556c0 3211132236 S Ci:1:004:0 s c0 03 3a4a 0000 0002 2 <
ffff88007d9556c0 3211133621 C Ci:1:004:0 0 2 = 013a
ffff88007d9556c0 3211133730 S Ci:1:004:0 s c0 02 404a 0000 0009 9 <
ffff88007d9556c0 3211138800 C Ci:1:004:0 0 9 = 01dc0f48 00ff8981 8d
ffff88007d9556c0 3211138832 S Ci:1:004:0 s c0 02 484a 0000 0006 6 <
ffff88007d9556c0 3211141402 C Ci:1:004:0 0 6 = 013ea2f8 c099
ffff88007d9556c0 3211141417 S Ci:1:004:0 s c0 03 004a 000c 0002 2 <
ffff88007d9556c0 3211142796 C Ci:1:004:0 0 2 = 0100
ffff88007d9556c0 3211142812 S Ci:1:004:0 s c0 03 014a 0001 0002 2 <
ffff88007d9556c0 3211144231 C Ci:1:004:0 0 2 = 0101
ffff88007d9556c0 3211144267 S Ci:1:004:0 s c0 03 024a 0005 0002 2 <
ffff88007d9556c0 3211145618 C Ci:1:004:0 0 2 = 0102
ffff88007d9556c0 3211145634 S Ci:1:004:0 s c0 03 384a 0000 0002 2 <
ffff88007d9556c0 3211147104 C Ci:1:004:0 0 2 = 0138
ffff88007d9556c0 3211147145 S Ci:1:004:0 s c0 03 3a4a 0000 0002 2 <
ffff88007d9556c0 3211148322 C Ci:1:004:0 0 2 = 013a
ffff88007d9556c0 3211148375 S Ci:1:004:0 s c0 0d 4000 8300 0004 4 <
ffff88007d9556c0 3211149119 C Ci:1:004:0 0 4 = 01400083
ffff88007d9556c0 3211149134 S Ci:1:004:0 s c0 0d 8003 7c7f 0004 4 <
ffff88007d9556c0 3211149921 C Ci:1:004:0 0 4 = 01807f7c
ffff88007d9556c0 3211149935 S Ci:1:004:0 s c0 0e 004a 0000 0007 7 <
ffff88007d9556c0 3211152343 C Ci:1:004:0 0 7 = 01400083 807f7c
ffff88007d9556c0 3211152358 S Ci:1:004:0 s c0 03 004a 000a 0002 2 <
ffff88007d9556c0 3211153788 C Ci:1:004:0 0 2 = 0100
ffff88007d9556c0 3211254114 S Ci:1:004:0 s c0 03 004a 000c 0002 2 <
ffff88007d9556c0 3211258000 C Ci:1:004:0 0 2 = 0100
ffff88007d9556c0 3211258017 S Ci:1:004:0 s c0 03 024a 0009 0002 2 <
ffff88007d9556c0 3211259450 C Ci:1:004:0 0 2 = 0102
ffff88007d9556c0 3211259465 S Ci:1:004:0 s c0 03 384a 0000 0002 2 <
ffff88007d9556c0 3211261448 C Ci:1:004:0 0 2 = 0138
ffff88007d9556c0 3211261492 S Ci:1:004:0 s c0 03 3a4a 0000 0002 2 <
ffff88007d9556c0 3211264545 C Ci:1:004:0 0 2 = 013a
ffff88007d9556c0 3211264564 S Ci:1:004:0 s c0 0d 4000 0000 0004 4 <
ffff88007d9556c0 3211265246 C Ci:1:004:0 0 4 = 01400000
ffff88007d9556c0 3211265266 S Ci:1:004:0 s c0 0d a003 4c09 0004 4 <
ffff88007d9556c0 3211266061 C Ci:1:004:0 0 4 = 01a0094c
ffff88007d9556c0 3211266102 S Ci:1:004:0 s c0 0d 0006 0000 0004 4 <
ffff88007d9556c0 3211266717 C Ci:1:004:0 0 4 = 01000000
ffff88007d9556c0 3211266747 S Ci:1:004:0 s c0 0e 004a 0000 000a 10 <
ffff88007d9556c0 3211270000 C Ci:1:004:0 0 10 = 01400000 a0094c00 0000
ffff88007d9556c0 3211270026 S Ci:1:004:0 s c0 03 484a 00e5 0002 2 <
ffff88007d9556c0 3211271383 C Ci:1:004:0 0 2 = 0148
ffff88007d9556c0 3211271399 S Ci:1:004:0 s c0 03 004a 000a 0002 2 <
ffff88007d9556c0 3211272948 C Ci:1:004:0 0 2 = 0100
ffff88007d9556c0 3211423461 S Ci:1:004:0 s c0 02 394a 0000 0002 2 <
ffff88007d9556c0 3211434485 C Ci:1:004:0 0 2 = 0100
ffff88007d9556c0 3211434524 S Ci:1:004:0 s c0 02 034a 0000 0002 2 <
ffff88007d9556c0 3211436184 C Ci:1:004:0 0 2 = 0117
ffff88007d9556c0 3211436249 S Ci:1:004:0 s c0 02 044a 0000 0002 2 <
ffff88007d9556c0 3211439743 C Ci:1:004:0 0 2 = 0181
ffff88007d9556c0 3211439767 S Ci:1:004:0 s c0 03 3a4a 0000 0002 2 <
ffff88007d9556c0 3211441229 C Ci:1:004:0 0 2 = 013a
ffff88007d9556c0 3211441244 S Ci:1:004:0 s c0 02 404a 0000 0009 9 <
ffff88007d9556c0 3211444229 C Ci:1:004:0 0 9 = 010000c8 00f00000 84
ffff88007d9556c0 3211444260 S Ci:1:004:0 s c0 02 484a 0000 0009 9 <
ffff88007d9556c0 3211447633 C Ci:1:004:0 0 9 = 0100802a 4000e001 17
ffff88007d9556c0 3211447765 S Ci:1:004:0 s c0 02 504a 0000 0008 8 <
ffff88007d9556c0 3211452552 C Ci:1:004:0 0 8 = 01a206a3 f109005f
ffff88007d9556c0 3211502776 S Ci:1:004:0 s c0 02 394a 0000 0002 2 <
ffff88007d9556c0 3211510848 C Ci:1:004:0 0 2 = 0100
ffff88007d9556c0 3211510891 S Ci:1:004:0 s c0 02 034a 0000 0002 2 <
ffff88007d9556c0 3211512362 C Ci:1:004:0 0 2 = 0117
ffff88007d9556c0 3211512395 S Ci:1:004:0 s c0 02 044a 0000 0002 2 <
ffff88007d9556c0 3211514124 C Ci:1:004:0 0 2 = 0181
ffff88007d9556c0 3211514174 S Ci:1:004:0 s c0 03 004a 000c 0002 2 <
ffff88007d9556c0 3211515446 C Ci:1:004:0 0 2 = 0100
ffff88007d9556c0 3211515461 S Ci:1:004:0 s c0 02 044a 0000 0002 2 <
ffff88007d9556c0 3211517061 C Ci:1:004:0 0 2 = 0181
ffff88007d9556c0 3211818261 S Ci:1:004:0 s c0 02 b030 0001 0002 2 <
ffff88007d9556c0 3211826078 C Ci:1:004:0 0 2 = 0131
ffff88007d9556c0 3211826101 S Ci:1:004:0 s c0 02 b030 0001 0002 2 <
ffff88007d9556c0 3211828183 C Ci:1:004:0 0 2 = 0100
ffff88007d9556c0 3211828280 S Ci:1:004:0 s c0 0d fe00 12c6 0004 4 <
ffff88007d9556c0 3211830615 C Ci:1:004:0 0 4 = 01fec612
ffff88007d9556c0 3211830649 S Ci:1:004:0 s c0 0d 0003 0000 0002 2 <
ffff88007d9556c0 3211836004 C Ci:1:004:0 0 2 = 0100
ffff88007d9556c0 3211836070 S Ci:1:004:0 s c0 0e 0030 0000 0005 5 <
ffff88007d9556c0 3211838494 C Ci:1:004:0 0 5 = 01fec612 00
ffff88007d9556c0 3211838519 S Ci:1:004:0 s c0 03 fe30 12c6 0003 3 <
ffff88007d9556c0 3211839935 C Ci:1:004:0 0 3 = 01fec6
ffff88007d9556c0 3211839957 S Ci:1:004:0 s c0 14 fe30 00c7 0002 2 <
ffff88007d9556c0 3211841229 C Ci:1:004:0 0 2 = 01fe
ffff88007d9556c0 3211841250 S Ci:1:004:0 s c0 19 0030 0000 0002 2 <
ffff88007d9556c0 3211842753 C Ci:1:004:0 0 2 = 011c
ffff88007d9556c0 3211842785 S Ci:1:004:0 s c0 03 fe30 13c6 0003 3 <
ffff88007d9556c0 3211844267 C Ci:1:004:0 0 3 = 01fec6
ffff88007d9556c0 3211844319 S Ci:1:004:0 s c0 14 fe30 00c7 0002 2 <
ffff88007d9556c0 3211845768 C Ci:1:004:0 0 2 = 01fe
ffff88007d9556c0 3211845846 S Ci:1:004:0 s c0 19 0030 0000 0002 2 <
ffff88007d9556c0 3211846938 C Ci:1:004:0 0 2 = 0102
ffff88007d9556c0 3211847033 S Ci:1:004:0 s c0 03 fe30 0dc6 0003 3 <
ffff88007d9556c0 3211848380 C Ci:1:004:0 0 3 = 01fec6
ffff88007d9556c0 3211848406 S Ci:1:004:0 s c0 14 fe30 00c7 0002 2 <
ffff88007d9556c0 3211849803 C Ci:1:004:0 0 2 = 01fe
ffff88007d9556c0 3211849831 S Ci:1:004:0 s c0 19 0030 0000 0002 2 <
ffff88007d9556c0 3211850943 C Ci:1:004:0 0 2 = 0102
ffff88007d9556c0 3211850967 S Ci:1:004:0 s c0 0d fe00 10c6 0004 4 <
ffff88007d9556c0 3211851985 C Ci:1:004:0 0 4 = 01fec610
ffff88007d9556c0 3211852009 S Ci:1:004:0 s c0 0d 0003 7f9a 0002 2 <
ffff88007d9556c0 3211852708 C Ci:1:004:0 0 2 = 0100
ffff88007d9556c0 3211852749 S Ci:1:004:0 s c0 0e 0030 0000 0005 5 <
ffff88007d9556c0 3211854785 C Ci:1:004:0 0 5 = 01fec610 00
ffff88007d9556c0 3211854809 S Ci:1:004:0 s c0 03 fe30 10c6 0003 3 <
ffff88007d9556c0 3211856287 C Ci:1:004:0 0 3 = 01fec6
ffff88007d9556c0 3211856308 S Ci:1:004:0 s c0 14 fe30 00c7 0002 2 <
ffff88007d9556c0 3211857782 C Ci:1:004:0 0 2 = 01fe
ffff88007d9556c0 3211857822 S Ci:1:004:0 s c0 19 0030 0000 0002 2 <
ffff88007d9556c0 3211858889 C Ci:1:004:0 0 2 = 0109
ffff88007d9556c0 3211858921 S Ci:1:004:0 s c0 03 fe30 0dc6 0003 3 <
ffff88007d9556c0 3211861125 C Ci:1:004:0 0 3 = 01fec6
ffff88007d9556c0 3211861316 S Ci:1:004:0 s c0 14 fe30 00c7 0002 2 <
ffff88007d9556c0 3211864337 C Ci:1:004:0 0 2 = 01fe
ffff88007d9556c0 3211864490 S Ci:1:004:0 s c0 19 0030 0000 0002 2 <
ffff88007d9556c0 3211867525 C Ci:1:004:0 0 2 = 0102
ffff88007d9556c0 3211867570 S Ci:1:004:0 s c0 0d fe00 0dc6 0004 4 <
ffff88007d9556c0 3211868277 C Ci:1:004:0 0 4 = 01fec60d
ffff88007d9556c0 3211868302 S Ci:1:004:0 s c0 0d 0203 7f9a 0002 2 <
ffff88007d9556c0 3211868929 C Ci:1:004:0 0 2 = 0102
ffff88007d9556c0 3211868953 S Ci:1:004:0 s c0 0e 0030 0000 0005 5 <
ffff88007d9556c0 3211870891 C Ci:1:004:0 0 5 = 01fec60d 02
ffff88007d9556c0 3211870915 S Ci:1:004:0 s c0 0d fe00 10c6 0004 4 <
ffff88007d9556c0 3211871881 C Ci:1:004:0 0 4 = 01fec610
ffff88007d9556c0 3211871905 S Ci:1:004:0 s c0 0d 0003 7f9a 0002 2 <
ffff88007d9556c0 3211872810 C Ci:1:004:0 0 2 = 0100
ffff88007d9556c0 3211872833 S Ci:1:004:0 s c0 0e 0030 0000 0005 5 <
ffff88007d9556c0 3211874810 C Ci:1:004:0 0 5 = 01fec610 00
ffff88007d9556c0 3211874841 S Ci:1:004:0 s c0 03 fe30 10c6 0003 3 <
ffff88007d9556c0 3211876259 C Ci:1:004:0 0 3 = 01fec6
ffff88007d9556c0 3211876299 S Ci:1:004:0 s c0 14 fe30 00c7 0002 2 <
ffff88007d9556c0 3211877924 C Ci:1:004:0 0 2 = 01fe
ffff88007d9556c0 3211877967 S Ci:1:004:0 s c0 19 0030 0000 0002 2 <
ffff88007d9556c0 3211879394 C Ci:1:004:0 0 2 = 0109
ffff88007d9556c0 3211879428 S Ci:1:004:0 s c0 03 fe30 0dc6 0003 3 <
ffff88007d9556c0 3211880919 C Ci:1:004:0 0 3 = 01fec6
ffff88007d9556c0 3211880975 S Ci:1:004:0 s c0 14 fe30 00c7 0002 2 <
ffff88007d9556c0 3211882279 C Ci:1:004:0 0 2 = 01fe
ffff88007d9556c0 3211882304 S Ci:1:004:0 s c0 19 0030 0000 0002 2 <
ffff88007d9556c0 3211883640 C Ci:1:004:0 0 2 = 0102
ffff88007d9556c0 3211883674 S Ci:1:004:0 s c0 0d fe00 0dc6 0004 4 <
ffff88007d9556c0 3211888909 C Ci:1:004:0 0 4 = 01fec60d
ffff88007d9556c0 3211888933 S Ci:1:004:0 s c0 0d 1203 7f9a 0002 2 <
ffff88007d9556c0 3211890410 C Ci:1:004:0 0 2 = 0112
ffff88007d9556c0 3211890434 S Ci:1:004:0 s c0 0e 0030 0000 0005 5 <
ffff88007d9556c0 3211892439 C Ci:1:004:0 0 5 = 01fec60d 12
ffff88007d9556c0 3211892462 S Ci:1:004:0 s c0 0d fe00 10c6 0004 4 <
ffff88007d9556c0 3211893198 C Ci:1:004:0 0 4 = 01fec610
ffff88007d9556c0 3211893234 S Ci:1:004:0 s c0 0d 0603 7f9a 0002 2 <
ffff88007d9556c0 3211894315 C Ci:1:004:0 0 2 = 0106
ffff88007d9556c0 3211894551 S Ci:1:004:0 s c0 0e 0030 0000 0005 5 <
ffff88007d9556c0 3211897998 C Ci:1:004:0 0 5 = 01fec610 06
ffff88007d9556c0 3211898053 S Ci:1:004:0 s c0 0d fe00 13c6 0004 4 <
ffff88007d9556c0 3211898691 C Ci:1:004:0 0 4 = 01fec613
ffff88007d9556c0 3211898715 S Ci:1:004:0 s c0 0d 0a03 7f9a 0002 2 <
ffff88007d9556c0 3211903983 C Ci:1:004:0 0 2 = 010a
ffff88007d9556c0 3211904101 S Ci:1:004:0 s c0 0e 0030 0000 0005 5 <
ffff88007d9556c0 3211906560 C Ci:1:004:0 0 5 = 01fec613 0a
ffff88007d9556c0 3211906587 S Ci:1:004:0 s c0 02 b030 0001 0002 2 <
ffff88007d9556c0 3211907960 C Ci:1:004:0 0 2 = 0180
ffff88007d9556c0 3211907984 S Ci:1:004:0 s c0 02 b030 0001 0002 2 <
ffff88007d9556c0 3211909513 C Ci:1:004:0 0 2 = 0180
ffff88007d9556c0 3211959792 S Ci:1:004:0 s c0 02 044a 0000 0002 2 <
ffff88007d9556c0 3211961823 C Ci:1:004:0 0 2 = 0181
ffff88007d9556c0 3212213050 S Ci:1:004:0 s c0 02 b030 0001 0002 2 <
ffff88007d9556c0 3212230081 C Ci:1:004:0 0 2 = 0130
ffff88007d9556c0 3212230193 S Ci:1:004:0 s c0 02 b030 0001 0002 2 <
ffff88007d9556c0 3212231526 C Ci:1:004:0 0 2 = 0140
ffff88007d9556c0 3212231555 S Ci:1:004:0 s c0 0d fe00 12c6 0004 4 <
ffff88007d9556c0 3212232367 C Ci:1:004:0 0 4 = 01fec612
ffff88007d9556c0 3212232391 S Ci:1:004:0 s c0 0d 0003 0000 0002 2 <
ffff88007d9556c0 3212233075 C Ci:1:004:0 0 2 = 0100
ffff88007d9556c0 3212233098 S Ci:1:004:0 s c0 0e 0030 0000 0005 5 <
ffff88007d9556c0 3212234939 C Ci:1:004:0 0 5 = 01fec612 00
ffff88007d9556c0 3212234990 S Ci:1:004:0 s c0 03 fe30 12c6 0003 3 <
ffff88007d9556c0 3212236551 C Ci:1:004:0 0 3 = 01fec6
ffff88007d9556c0 3212236587 S Ci:1:004:0 s c0 14 fe30 00c7 0002 2 <
ffff88007d9556c0 3212237963 C Ci:1:004:0 0 2 = 01fe
ffff88007d9556c0 3212237987 S Ci:1:004:0 s c0 19 0030 0000 0002 2 <
ffff88007d9556c0 3212239335 C Ci:1:004:0 0 2 = 0112
ffff88007d9556c0 3212239359 S Ci:1:004:0 s c0 03 fe30 13c6 0003 3 <
ffff88007d9556c0 3212241057 C Ci:1:004:0 0 3 = 01fec6
ffff88007d9556c0 3212241083 S Ci:1:004:0 s c0 14 fe30 00c7 0002 2 <
ffff88007d9556c0 3212242581 C Ci:1:004:0 0 2 = 01fe
ffff88007d9556c0 3212242605 S Ci:1:004:0 s c0 19 0030 0000 0002 2 <
ffff88007d9556c0 3212244171 C Ci:1:004:0 0 2 = 010a
ffff88007d9556c0 3212244223 S Ci:1:004:0 s c0 03 fe30 0dc6 0003 3 <
ffff88007d9556c0 3212247767 C Ci:1:004:0 0 3 = 01fec6
ffff88007d9556c0 3212247965 S Ci:1:004:0 s c0 14 fe30 00c7 0002 2 <
ffff88007d9556c0 3212251000 C Ci:1:004:0 0 2 = 01fe
ffff88007d9556c0 3212251025 S Ci:1:004:0 s c0 19 0030 0000 0002 2 <
ffff88007d9556c0 3212252234 C Ci:1:004:0 0 2 = 0112
ffff88007d9556c0 3212252268 S Ci:1:004:0 s c0 03 fe30 10c6 0003 3 <
ffff88007d9556c0 3212253791 C Ci:1:004:0 0 3 = 01fec6
ffff88007d9556c0 3212253815 S Ci:1:004:0 s c0 14 fe30 00c7 0002 2 <
ffff88007d9556c0 3212255036 C Ci:1:004:0 0 2 = 01fe
ffff88007d9556c0 3212255076 S Ci:1:004:0 s c0 19 0030 0000 0002 2 <
ffff88007d9556c0 3212256287 C Ci:1:004:0 0 2 = 0106
ffff88007d9556c0 3212256311 S Ci:1:004:0 s c0 02 b030 0001 0002 2 <
ffff88007d9556c0 3212257959 C Ci:1:004:0 0 2 = 0180
ffff88007d9556c0 3212257980 S Ci:1:004:0 s c0 02 b030 0001 0002 2 <
ffff88007d9556c0 3212259591 C Ci:1:004:0 0 2 = 0180
ffff88007d9556c0 3212359911 S Ci:1:004:0 s c0 02 044a 0000 0002 2 <
ffff88007d9556c0 3212364386 C Ci:1:004:0 0 2 = 0181
ffff88007d9556c0 3212565398 S Ci:1:004:0 s c0 02 b030 0001 0002 2 <
ffff88007d9556c0 3212583690 C Ci:1:004:0 0 2 = 01b0
ffff88007d9556c0 3212583789 S Ci:1:004:0 s c0 02 b030 0001 0002 2 <
ffff88007d9556c0 3212585071 C Ci:1:004:0 0 2 = 01b0
ffff88007d9556c0 3212585095 S Ci:1:004:0 s c0 0d fe00 12c6 0004 4 <
ffff88007d9556c0 3212585891 C Ci:1:004:0 0 4 = 01fec612
ffff88007d9556c0 3212585915 S Ci:1:004:0 s c0 0d 0003 0000 0002 2 <
ffff88007d9556c0 3212586862 C Ci:1:004:0 0 2 = 0100
ffff88007d9556c0 3212586897 S Ci:1:004:0 s c0 0e 0030 0000 0005 5 <
ffff88007d9556c0 3212588843 C Ci:1:004:0 0 5 = 01fec612 00
ffff88007d9556c0 3212588867 S Ci:1:004:0 s c0 03 fe30 12c6 0003 3 <
ffff88007d9556c0 3212590568 C Ci:1:004:0 0 3 = 01fec6
ffff88007d9556c0 3212590592 S Ci:1:004:0 s c0 14 fe30 00c7 0002 2 <
ffff88007d9556c0 3212591866 C Ci:1:004:0 0 2 = 01fe
ffff88007d9556c0 3212591897 S Ci:1:004:0 s c0 19 0030 0000 0002 2 <
ffff88007d9556c0 3212593191 C Ci:1:004:0 0 2 = 0114
ffff88007d9556c0 3212593225 S Ci:1:004:0 s c0 03 fe30 13c6 0003 3 <
ffff88007d9556c0 3212595053 C Ci:1:004:0 0 3 = 01fec6
ffff88007d9556c0 3212595108 S Ci:1:004:0 s c0 14 fe30 00c7 0002 2 <
ffff88007d9556c0 3212596345 C Ci:1:004:0 0 2 = 01fe
ffff88007d9556c0 3212596411 S Ci:1:004:0 s c0 19 0030 0000 0002 2 <
ffff88007d9556c0 3212597556 C Ci:1:004:0 0 2 = 010a
ffff88007d9556c0 3212597583 S Ci:1:004:0 s c0 03 fe30 0dc6 0003 3 <
ffff88007d9556c0 3212598986 C Ci:1:004:0 0 3 = 01fec6
ffff88007d9556c0 3212599037 S Ci:1:004:0 s c0 14 fe30 00c7 0002 2 <
ffff88007d9556c0 3212600537 C Ci:1:004:0 0 2 = 01fe
ffff88007d9556c0 3212600574 S Ci:1:004:0 s c0 19 0030 0000 0002 2 <
ffff88007d9556c0 3212601660 C Ci:1:004:0 0 2 = 0112
ffff88007d9556c0 3212601690 S Ci:1:004:0 s c0 03 fe30 10c6 0003 3 <
ffff88007d9556c0 3212603182 C Ci:1:004:0 0 3 = 01fec6
ffff88007d9556c0 3212603205 S Ci:1:004:0 s c0 14 fe30 00c7 0002 2 <
ffff88007d9556c0 3212604740 C Ci:1:004:0 0 2 = 01fe
ffff88007d9556c0 3212604778 S Ci:1:004:0 s c0 19 0030 0000 0002 2 <
ffff88007d9556c0 3212606001 C Ci:1:004:0 0 2 = 0106
ffff88007d9556c0 3212606025 S Ci:1:004:0 s c0 02 b030 0001 0002 2 <
ffff88007d9556c0 3212607739 C Ci:1:004:0 0 2 = 01b1
ffff88007d9556c0 3212607762 S Ci:1:004:0 s c0 02 b030 0001 0002 2 <
ffff88007d9556c0 3212609460 C Ci:1:004:0 0 2 = 01b1
ffff88007d9556c0 3212759900 S Ci:1:004:0 s c0 02 044a 0000 0002 2 <
ffff88007d9556c0 3212770952 C Ci:1:004:0 0 2 = 0181
ffff88007d9556c0 3212921892 S Ci:1:004:0 s c0 02 b030 0001 0002 2 <
ffff88007d9556c0 3212933186 C Ci:1:004:0 0 2 = 0120
ffff88007d9556c0 3212933415 S Ci:1:004:0 s c0 02 b030 0001 0002 2 <
ffff88007d9556c0 3212936871 C Ci:1:004:0 0 2 = 0130
ffff88007d9556c0 3212936900 S Ci:1:004:0 s c0 0d fe00 12c6 0004 4 <
ffff88007d9556c0 3212937616 C Ci:1:004:0 0 4 = 01fec612
ffff88007d9556c0 3212937640 S Ci:1:004:0 s c0 0d 0003 0000 0002 2 <
ffff88007d9556c0 3212942908 C Ci:1:004:0 0 2 = 0100
ffff88007d9556c0 3212942931 S Ci:1:004:0 s c0 0e 0030 0000 0005 5 <
ffff88007d9556c0 3212945617 C Ci:1:004:0 0 5 = 01fec612 00
ffff88007d9556c0 3212945705 S Ci:1:004:0 s c0 03 fe30 12c6 0003 3 <
ffff88007d9556c0 3212947298 C Ci:1:004:0 0 3 = 01fec6
ffff88007d9556c0 3212947527 S Ci:1:004:0 s c0 14 fe30 00c7 0002 2 <
ffff88007d9556c0 3212950641 C Ci:1:004:0 0 2 = 01fe
ffff88007d9556c0 3212950673 S Ci:1:004:0 s c0 19 0030 0000 0002 2 <
ffff88007d9556c0 3212951932 C Ci:1:004:0 0 2 = 0111
ffff88007d9556c0 3212951956 S Ci:1:004:0 s c0 03 fe30 13c6 0003 3 <
ffff88007d9556c0 3212953602 C Ci:1:004:0 0 3 = 01fec6
ffff88007d9556c0 3212953629 S Ci:1:004:0 s c0 14 fe30 00c7 0002 2 <
ffff88007d9556c0 3212955005 C Ci:1:004:0 0 2 = 01fe
ffff88007d9556c0 3212955028 S Ci:1:004:0 s c0 19 0030 0000 0002 2 <
ffff88007d9556c0 3212956345 C Ci:1:004:0 0 2 = 010a
ffff88007d9556c0 3212956368 S Ci:1:004:0 s c0 03 fe30 0dc6 0003 3 <
ffff88007d9556c0 3212958245 C Ci:1:004:0 0 3 = 01fec6
ffff88007d9556c0 3212958269 S Ci:1:004:0 s c0 14 fe30 00c7 0002 2 <
ffff88007d9556c0 3212959615 C Ci:1:004:0 0 2 = 01fe
ffff88007d9556c0 3212959643 S Ci:1:004:0 s c0 19 0030 0000 0002 2 <
ffff88007d9556c0 3212961485 C Ci:1:004:0 0 2 = 0112
ffff88007d9556c0 3212961596 S Ci:1:004:0 s c0 03 fe30 10c6 0003 3 <
ffff88007d9556c0 3212964894 C Ci:1:004:0 0 3 = 01fec6
ffff88007d9556c0 3212964923 S Ci:1:004:0 s c0 14 fe30 00c7 0002 2 <
ffff88007d9556c0 3212966408 C Ci:1:004:0 0 2 = 01fe
ffff88007d9556c0 3212966433 S Ci:1:004:0 s c0 19 0030 0000 0002 2 <
ffff88007d9556c0 3212967600 C Ci:1:004:0 0 2 = 0106
ffff88007d9556c0 3212967665 S Ci:1:004:0 s c0 02 b030 0001 0002 2 <
ffff88007d9556c0 3212969227 C Ci:1:004:0 0 2 = 0180
ffff88007d9556c0 3212969321 S Ci:1:004:0 s c0 02 b030 0001 0002 2 <
ffff88007d9556c0 3212970715 C Ci:1:004:0 0 2 = 0180
ffff88007d9556c0 3213171412 S Ci:1:004:0 s c0 02 044a 0000 0002 2 <
ffff88007d9556c0 3213175618 C Ci:1:004:0 0 2 = 0181
ffff88007d9556c0 3213276156 S Ci:1:004:0 s c0 02 b030 0001 0002 2 <
ffff88007d9556c0 3213288879 C Ci:1:004:0 0 2 = 0171
ffff88007d9556c0 3213288935 S Ci:1:004:0 s c0 02 b030 0001 0002 2 <
ffff88007d9556c0 3213290488 C Ci:1:004:0 0 2 = 0171
ffff88007d9556c0 3213290513 S Ci:1:004:0 s c0 0d fe00 12c6 0004 4 <
ffff88007d9556c0 3213291362 C Ci:1:004:0 0 4 = 01fec612
ffff88007d9556c0 3213291385 S Ci:1:004:0 s c0 0d 0003 0000 0002 2 <
ffff88007d9556c0 3213292300 C Ci:1:004:0 0 2 = 0100
ffff88007d9556c0 3213292324 S Ci:1:004:0 s c0 0e 0030 0000 0005 5 <
ffff88007d9556c0 3213295025 C Ci:1:004:0 0 5 = 01fec612 00
ffff88007d9556c0 3213295096 S Ci:1:004:0 s c0 03 fe30 12c6 0003 3 <
ffff88007d9556c0 3213298351 C Ci:1:004:0 0 3 = 01fec6
ffff88007d9556c0 3213298383 S Ci:1:004:0 s c0 14 fe30 00c7 0002 2 <
ffff88007d9556c0 3213299902 C Ci:1:004:0 0 2 = 01fe
ffff88007d9556c0 3213299928 S Ci:1:004:0 s c0 19 0030 0000 0002 2 <
ffff88007d9556c0 3213301043 C Ci:1:004:0 0 2 = 0113
ffff88007d9556c0 3213301087 S Ci:1:004:0 s c0 03 fe30 13c6 0003 3 <
ffff88007d9556c0 3213302759 C Ci:1:004:0 0 3 = 01fec6
ffff88007d9556c0 3213302944 S Ci:1:004:0 s c0 14 fe30 00c7 0002 2 <
ffff88007d9556c0 3213305975 C Ci:1:004:0 0 2 = 01fe
ffff88007d9556c0 3213305998 S Ci:1:004:0 s c0 19 0030 0000 0002 2 <
ffff88007d9556c0 3213307095 C Ci:1:004:0 0 2 = 010a
ffff88007d9556c0 3213307119 S Ci:1:004:0 s c0 03 fe30 0dc6 0003 3 <
ffff88007d9556c0 3213308625 C Ci:1:004:0 0 3 = 01fec6
ffff88007d9556c0 3213308651 S Ci:1:004:0 s c0 14 fe30 00c7 0002 2 <
ffff88007d9556c0 3213309849 C Ci:1:004:0 0 2 = 01fe
ffff88007d9556c0 3213309905 S Ci:1:004:0 s c0 19 0030 0000 0002 2 <
ffff88007d9556c0 3213311124 C Ci:1:004:0 0 2 = 0112
ffff88007d9556c0 3213311167 S Ci:1:004:0 s c0 03 fe30 10c6 0003 3 <
ffff88007d9556c0 3213312675 C Ci:1:004:0 0 3 = 01fec6
ffff88007d9556c0 3213312749 S Ci:1:004:0 s c0 14 fe30 00c7 0002 2 <
ffff88007d9556c0 3213314132 C Ci:1:004:0 0 2 = 01fe
ffff88007d9556c0 3213314228 S Ci:1:004:0 s c0 19 0030 0000 0002 2 <
ffff88007d9556c0 3213315315 C Ci:1:004:0 0 2 = 0106
ffff88007d9556c0 3213315344 S Ci:1:004:0 s c0 02 b030 0001 0002 2 <
ffff88007d9556c0 3213316912 C Ci:1:004:0 0 2 = 0100
ffff88007d9556c0 3213316936 S Ci:1:004:0 s c0 02 b030 0001 0002 2 <
ffff88007d9556c0 3213318575 C Ci:1:004:0 0 2 = 0100
ffff88007d9556c0 3213569503 S Ci:1:004:0 s c0 02 044a 0000 0002 2 <
ffff88007d9556c0 3213580392 C Ci:1:004:0 0 2 = 0181
ffff88007d9556c0 3213630598 S Ci:1:004:0 s c0 02 b030 0001 0002 2 <
ffff88007d9556c0 3213632430 C Ci:1:004:0 0 2 = 01a0
ffff88007d9556c0 3213632485 S Ci:1:004:0 s c0 02 b030 0001 0002 2 <
ffff88007d9556c0 3213633918 C Ci:1:004:0 0 2 = 01a0
ffff88007d9556c0 3213634005 S Ci:1:004:0 s c0 0d fe00 12c6 0004 4 <
ffff88007d9556c0 3213638911 C Ci:1:004:0 0 4 = 01fec612
ffff88007d9556c0 3213638937 S Ci:1:004:0 s c0 0d 0003 0000 0002 2 <
ffff88007d9556c0 3213640613 C Ci:1:004:0 0 2 = 0100
ffff88007d9556c0 3213640639 S Ci:1:004:0 s c0 0e 0030 0000 0005 5 <
ffff88007d9556c0 3213642651 C Ci:1:004:0 0 5 = 01fec612 00
ffff88007d9556c0 3213642674 S Ci:1:004:0 s c0 03 fe30 12c6 0003 3 <
ffff88007d9556c0 3213644403 C Ci:1:004:0 0 3 = 01fec6
ffff88007d9556c0 3213644456 S Ci:1:004:0 s c0 14 fe30 00c7 0002 2 <
ffff88007d9556c0 3213645550 C Ci:1:004:0 0 2 = 01fe
ffff88007d9556c0 3213645578 S Ci:1:004:0 s c0 19 0030 0000 0002 2 <
ffff88007d9556c0 3213646890 C Ci:1:004:0 0 2 = 0112
ffff88007d9556c0 3213646945 S Ci:1:004:0 s c0 03 fe30 13c6 0003 3 <
ffff88007d9556c0 3213648386 C Ci:1:004:0 0 3 = 01fec6
ffff88007d9556c0 3213648413 S Ci:1:004:0 s c0 14 fe30 00c7 0002 2 <
ffff88007d9556c0 3213649998 C Ci:1:004:0 0 2 = 01fe
ffff88007d9556c0 3213650022 S Ci:1:004:0 s c0 19 0030 0000 0002 2 <
ffff88007d9556c0 3213651392 C Ci:1:004:0 0 2 = 010a
ffff88007d9556c0 3213651419 S Ci:1:004:0 s c0 03 fe30 0dc6 0003 3 <
ffff88007d9556c0 3213652993 C Ci:1:004:0 0 3 = 01fec6
ffff88007d9556c0 3213653016 S Ci:1:004:0 s c0 14 fe30 00c7 0002 2 <
ffff88007d9556c0 3213654604 C Ci:1:004:0 0 2 = 01fe
ffff88007d9556c0 3213654632 S Ci:1:004:0 s c0 19 0030 0000 0002 2 <
ffff88007d9556c0 3213655892 C Ci:1:004:0 0 2 = 0112
ffff88007d9556c0 3213655915 S Ci:1:004:0 s c0 03 fe30 10c6 0003 3 <
ffff88007d9556c0 3213657593 C Ci:1:004:0 0 3 = 01fec6
ffff88007d9556c0 3213657616 S Ci:1:004:0 s c0 14 fe30 00c7 0002 2 <
ffff88007d9556c0 3213659042 C Ci:1:004:0 0 2 = 01fe
ffff88007d9556c0 3213659065 S Ci:1:004:0 s c0 19 0030 0000 0002 2 <
ffff88007d9556c0 3213660527 C Ci:1:004:0 0 2 = 0106
ffff88007d9556c0 3213660836 S Ci:1:004:0 s c0 02 b030 0001 0002 2 <
ffff88007d9556c0 3213664077 C Ci:1:004:0 0 2 = 0120
ffff88007d9556c0 3213664119 S Ci:1:004:0 s c0 02 b030 0001 0002 2 <
ffff88007d9556c0 3213665758 C Ci:1:004:0 0 2 = 0120
ffff88007d9556c0 3213967263 S Ci:1:004:0 s c0 02 b030 0001 0002 2 <
ffff88007d9556c0 3213980423 C Ci:1:004:0 0 2 = 0171
ffff88007d9556c0 3213980505 S Ci:1:004:0 s c0 02 b030 0001 0002 2 <
ffff88007d9556c0 3213981925 C Ci:1:004:0 0 2 = 0171
ffff88007d9556c0 3213981954 S Ci:1:004:0 s c0 0d fe00 12c6 0004 4 <
ffff88007d9556c0 3213982598 C Ci:1:004:0 0 4 = 01fec612
ffff88007d9556c0 3213982621 S Ci:1:004:0 s c0 0d 0003 0000 0002 2 <
ffff88007d9556c0 3213987917 C Ci:1:004:0 0 2 = 0100
ffff88007d9556c0 3213987940 S Ci:1:004:0 s c0 0e 0030 0000 0005 5 <
ffff88007d9556c0 3213990636 C Ci:1:004:0 0 5 = 01fec612 00
ffff88007d9556c0 3213990663 S Ci:1:004:0 s c0 03 fe30 12c6 0003 3 <
ffff88007d9556c0 3213992201 C Ci:1:004:0 0 3 = 01fec6
ffff88007d9556c0 3213992226 S Ci:1:004:0 s c0 14 fe30 00c7 0002 2 <
ffff88007d9556c0 3213994242 C Ci:1:004:0 0 2 = 01fe
ffff88007d9556c0 3213994464 S Ci:1:004:0 s c0 19 0030 0000 0002 2 <
ffff88007d9556c0 3213997085 C Ci:1:004:0 0 2 = 0113
ffff88007d9556c0 3213997122 S Ci:1:004:0 s c0 03 fe30 13c6 0003 3 <
ffff88007d9556c0 3213998560 C Ci:1:004:0 0 3 = 01fec6
ffff88007d9556c0 3213998640 S Ci:1:004:0 s c0 14 fe30 00c7 0002 2 <
ffff88007d9556c0 3214000080 C Ci:1:004:0 0 2 = 01fe
ffff88007d9556c0 3214000170 S Ci:1:004:0 s c0 19 0030 0000 0002 2 <
ffff88007d9556c0 3214001235 C Ci:1:004:0 0 2 = 010a
ffff88007d9556c0 3214001265 S Ci:1:004:0 s c0 03 fe30 0dc6 0003 3 <
ffff88007d9556c0 3214002714 C Ci:1:004:0 0 3 = 01fec6
ffff88007d9556c0 3214002755 S Ci:1:004:0 s c0 14 fe30 00c7 0002 2 <
ffff88007d9556c0 3214004233 C Ci:1:004:0 0 2 = 01fe
ffff88007d9556c0 3214004257 S Ci:1:004:0 s c0 19 0030 0000 0002 2 <
ffff88007d9556c0 3214005669 C Ci:1:004:0 0 2 = 0112
ffff88007d9556c0 3214005699 S Ci:1:004:0 s c0 03 fe30 10c6 0003 3 <
ffff88007d9556c0 3214007443 C Ci:1:004:0 0 3 = 01fec6
ffff88007d9556c0 3214007466 S Ci:1:004:0 s c0 14 fe30 00c7 0002 2 <
ffff88007d9556c0 3214008873 C Ci:1:004:0 0 2 = 01fe
ffff88007d9556c0 3214008898 S Ci:1:004:0 s c0 19 0030 0000 0002 2 <
ffff88007d9556c0 3214010010 C Ci:1:004:0 0 2 = 0106
ffff88007d9556c0 3214010037 S Ci:1:004:0 s c0 02 b030 0001 0002 2 <
ffff88007d9556c0 3214011548 C Ci:1:004:0 0 2 = 0100
ffff88007d9556c0 3214011599 S Ci:1:004:0 s c0 02 b030 0001 0002 2 <
ffff88007d9556c0 3214013063 C Ci:1:004:0 0 2 = 0100
ffff88007d9556c0 3214013129 S Ci:1:004:0 s c0 02 044a 0000 0002 2 <
ffff88007d9556c0 3214014671 C Ci:1:004:0 0 2 = 0181
ffff88007d9556c0 3214316566 S Ci:1:004:0 s c0 02 b030 0001 0002 2 <
ffff88007d9556c0 3214330328 C Ci:1:004:0 0 2 = 0160
ffff88007d9556c0 3214330393 S Ci:1:004:0 s c0 02 b030 0001 0002 2 <
ffff88007d9556c0 3214334172 C Ci:1:004:0 0 2 = 0170
ffff88007d9556c0 3214334365 S Ci:1:004:0 s c0 0d fe00 12c6 0004 4 <
ffff88007d9556c0 3214336952 C Ci:1:004:0 0 4 = 01fec612
ffff88007d9556c0 3214336977 S Ci:1:004:0 s c0 0d 0003 0000 0002 2 <
ffff88007d9556c0 3214337821 C Ci:1:004:0 0 2 = 0100
ffff88007d9556c0 3214337845 S Ci:1:004:0 s c0 0e 0030 0000 0005 5 <
ffff88007d9556c0 3214339853 C Ci:1:004:0 0 5 = 01fec612 00
ffff88007d9556c0 3214339890 S Ci:1:004:0 s c0 03 fe30 12c6 0003 3 <
ffff88007d9556c0 3214341544 C Ci:1:004:0 0 3 = 01fec6
ffff88007d9556c0 3214341568 S Ci:1:004:0 s c0 14 fe30 00c7 0002 2 <
ffff88007d9556c0 3214342792 C Ci:1:004:0 0 2 = 01fe
ffff88007d9556c0 3214342818 S Ci:1:004:0 s c0 19 0030 0000 0002 2 <
ffff88007d9556c0 3214344114 C Ci:1:004:0 0 2 = 0113
ffff88007d9556c0 3214344353 S Ci:1:004:0 s c0 03 fe30 13c6 0003 3 <
ffff88007d9556c0 3214347974 C Ci:1:004:0 0 3 = 01fec6
ffff88007d9556c0 3214348070 S Ci:1:004:0 s c0 14 fe30 00c7 0002 2 <
ffff88007d9556c0 3214349315 C Ci:1:004:0 0 2 = 01fe
ffff88007d9556c0 3214349340 S Ci:1:004:0 s c0 19 0030 0000 0002 2 <
ffff88007d9556c0 3214350615 C Ci:1:004:0 0 2 = 010a
ffff88007d9556c0 3214350640 S Ci:1:004:0 s c0 03 fe30 0dc6 0003 3 <
ffff88007d9556c0 3214352100 C Ci:1:004:0 0 3 = 01fec6
ffff88007d9556c0 3214352124 S Ci:1:004:0 s c0 14 fe30 00c7 0002 2 <
ffff88007d9556c0 3214353501 C Ci:1:004:0 0 2 = 01fe
ffff88007d9556c0 3214353550 S Ci:1:004:0 s c0 19 0030 0000 0002 2 <
ffff88007d9556c0 3214354621 C Ci:1:004:0 0 2 = 0112
ffff88007d9556c0 3214354645 S Ci:1:004:0 s c0 03 fe30 10c6 0003 3 <
ffff88007d9556c0 3214356098 C Ci:1:004:0 0 3 = 01fec6
ffff88007d9556c0 3214356122 S Ci:1:004:0 s c0 14 fe30 00c7 0002 2 <
ffff88007d9556c0 3214357661 C Ci:1:004:0 0 2 = 01fe
ffff88007d9556c0 3214357693 S Ci:1:004:0 s c0 19 0030 0000 0002 2 <
ffff88007d9556c0 3214358800 C Ci:1:004:0 0 2 = 0106
ffff88007d9556c0 3214358825 S Ci:1:004:0 s c0 02 b030 0001 0002 2 <
ffff88007d9556c0 3214360198 C Ci:1:004:0 0 2 = 01a0
ffff88007d9556c0 3214360223 S Ci:1:004:0 s c0 02 b030 0001 0002 2 <
ffff88007d9556c0 3214362003 C Ci:1:004:0 0 2 = 01a0
ffff88007d9556c0 3214412185 S Ci:1:004:0 s c0 02 044a 0000 0002 2 <
ffff88007d9556c0 3214414909 C Ci:1:004:0 0 2 = 0181
ffff88007d9556c0 3214665897 S Ci:1:004:0 s c0 02 b030 0001 0002 2 <
ffff88007d9556c0 3214682574 C Ci:1:004:0 0 2 = 0160
ffff88007d9556c0 3214682668 S Ci:1:004:0 s c0 02 b030 0001 0002 2 <
ffff88007d9556c0 3214686086 C Ci:1:004:0 0 2 = 0170
ffff88007d9556c0 3214686114 S Ci:1:004:0 s c0 0d fe00 12c6 0004 4 <
ffff88007d9556c0 3214687011 C Ci:1:004:0 0 4 = 01fec612
ffff88007d9556c0 3214687034 S Ci:1:004:0 s c0 0d 0003 0000 0002 2 <
ffff88007d9556c0 3214687953 C Ci:1:004:0 0 2 = 0100
ffff88007d9556c0 3214687977 S Ci:1:004:0 s c0 0e 0030 0000 0005 5 <
ffff88007d9556c0 3214690030 C Ci:1:004:0 0 5 = 01fec612 00
ffff88007d9556c0 3214690054 S Ci:1:004:0 s c0 03 fe30 12c6 0003 3 <
ffff88007d9556c0 3214691715 C Ci:1:004:0 0 3 = 01fec6
ffff88007d9556c0 3214691762 S Ci:1:004:0 s c0 14 fe30 00c7 0002 2 <
ffff88007d9556c0 3214693263 C Ci:1:004:0 0 2 = 01fe
ffff88007d9556c0 3214693288 S Ci:1:004:0 s c0 19 0030 0000 0002 2 <
ffff88007d9556c0 3214695107 C Ci:1:004:0 0 2 = 0112
ffff88007d9556c0 3214695216 S Ci:1:004:0 s c0 03 fe30 13c6 0003 3 <
ffff88007d9556c0 3214698177 C Ci:1:004:0 0 3 = 01fec6
ffff88007d9556c0 3214698207 S Ci:1:004:0 s c0 14 fe30 00c7 0002 2 <
ffff88007d9556c0 3214699548 C Ci:1:004:0 0 2 = 01fe
ffff88007d9556c0 3214699576 S Ci:1:004:0 s c0 19 0030 0000 0002 2 <
ffff88007d9556c0 3214700715 C Ci:1:004:0 0 2 = 010a
ffff88007d9556c0 3214700743 S Ci:1:004:0 s c0 03 fe30 0dc6 0003 3 <
ffff88007d9556c0 3214702289 C Ci:1:004:0 0 3 = 01fec6
ffff88007d9556c0 3214702341 S Ci:1:004:0 s c0 14 fe30 00c7 0002 2 <
ffff88007d9556c0 3214703865 C Ci:1:004:0 0 2 = 01fe
ffff88007d9556c0 3214703930 S Ci:1:004:0 s c0 19 0030 0000 0002 2 <
ffff88007d9556c0 3214704944 C Ci:1:004:0 0 2 = 0112
ffff88007d9556c0 3214704970 S Ci:1:004:0 s c0 03 fe30 10c6 0003 3 <
ffff88007d9556c0 3214706461 C Ci:1:004:0 0 3 = 01fec6
ffff88007d9556c0 3214706484 S Ci:1:004:0 s c0 14 fe30 00c7 0002 2 <
ffff88007d9556c0 3214707897 C Ci:1:004:0 0 2 = 01fe
ffff88007d9556c0 3214707920 S Ci:1:004:0 s c0 19 0030 0000 0002 2 <
ffff88007d9556c0 3214709156 C Ci:1:004:0 0 2 = 0106
ffff88007d9556c0 3214709178 S Ci:1:004:0 s c0 02 b030 0001 0002 2 <
ffff88007d9556c0 3214711023 C Ci:1:004:0 0 2 = 01a0
ffff88007d9556c0 3214711076 S Ci:1:004:0 s c0 02 b030 0001 0002 2 <
ffff88007d9556c0 3214712347 C Ci:1:004:0 0 2 = 01a0
ffff88007d9556c0 3214812802 S Ci:1:004:0 s c0 02 044a 0000 0002 2 <
ffff88007d9556c0 3214825357 C Ci:1:004:0 0 2 = 0181
ffff88007d9556c0 3215026417 S Ci:1:004:0 s c0 02 b030 0001 0002 2 <
ffff88007d9556c0 3215044673 C Ci:1:004:0 0 2 = 01b0
ffff88007d9556c0 3215044767 S Ci:1:004:0 s c0 02 b030 0001 0002 2 <
ffff88007d9556c0 3215048277 C Ci:1:004:0 0 2 = 01b0
ffff88007d9556c0 3215048333 S Ci:1:004:0 s c0 0d fe00 12c6 0004 4 <
ffff88007d9556c0 3215049205 C Ci:1:004:0 0 4 = 01fec612
ffff88007d9556c0 3215049234 S Ci:1:004:0 s c0 0d 0003 0000 0002 2 <
ffff88007d9556c0 3215049806 C Ci:1:004:0 0 2 = 0100
ffff88007d9556c0 3215049829 S Ci:1:004:0 s c0 0e 0030 0000 0005 5 <
ffff88007d9556c0 3215051817 C Ci:1:004:0 0 5 = 01fec612 00
ffff88007d9556c0 3215051858 S Ci:1:004:0 s c0 03 fe30 12c6 0003 3 <
ffff88007d9556c0 3215053344 C Ci:1:004:0 0 3 = 01fec6
ffff88007d9556c0 3215053367 S Ci:1:004:0 s c0 14 fe30 00c7 0002 2 <
ffff88007d9556c0 3215054857 C Ci:1:004:0 0 2 = 01fe
ffff88007d9556c0 3215054893 S Ci:1:004:0 s c0 19 0030 0000 0002 2 <
ffff88007d9556c0 3215056290 C Ci:1:004:0 0 2 = 0113
ffff88007d9556c0 3215056314 S Ci:1:004:0 s c0 03 fe30 13c6 0003 3 <
ffff88007d9556c0 3215058026 C Ci:1:004:0 0 3 = 01fec6
ffff88007d9556c0 3215058050 S Ci:1:004:0 s c0 14 fe30 00c7 0002 2 <
ffff88007d9556c0 3215059707 C Ci:1:004:0 0 2 = 01fe
ffff88007d9556c0 3215059732 S Ci:1:004:0 s c0 19 0030 0000 0002 2 <
ffff88007d9556c0 3215061343 C Ci:1:004:0 0 2 = 010a
ffff88007d9556c0 3215061575 S Ci:1:004:0 s c0 03 fe30 0dc6 0003 3 <
ffff88007d9556c0 3215064773 C Ci:1:004:0 0 3 = 01fec6
ffff88007d9556c0 3215064834 S Ci:1:004:0 s c0 14 fe30 00c7 0002 2 <
ffff88007d9556c0 3215066181 C Ci:1:004:0 0 2 = 01fe
ffff88007d9556c0 3215066233 S Ci:1:004:0 s c0 19 0030 0000 0002 2 <
ffff88007d9556c0 3215067350 C Ci:1:004:0 0 2 = 0112
ffff88007d9556c0 3215067374 S Ci:1:004:0 s c0 03 fe30 10c6 0003 3 <
ffff88007d9556c0 3215069047 C Ci:1:004:0 0 3 = 01fec6
ffff88007d9556c0 3215069088 S Ci:1:004:0 s c0 14 fe30 00c7 0002 2 <
ffff88007d9556c0 3215070637 C Ci:1:004:0 0 2 = 01fe
ffff88007d9556c0 3215070663 S Ci:1:004:0 s c0 19 0030 0000 0002 2 <
ffff88007d9556c0 3215072010 C Ci:1:004:0 0 2 = 0106
ffff88007d9556c0 3215072035 S Ci:1:004:0 s c0 02 b030 0001 0002 2 <
ffff88007d9556c0 3215073619 C Ci:1:004:0 0 2 = 0130
ffff88007d9556c0 3215073646 S Ci:1:004:0 s c0 02 b030 0001 0002 2 <
ffff88007d9556c0 3215075093 C Ci:1:004:0 0 2 = 0140
ffff88007d9556c0 3215225978 S Ci:1:004:0 s c0 02 044a 0000 0002 2 <
ffff88007d9556c0 3215237343 C Ci:1:004:0 0 2 = 0181
ffff88007d9556c0 3215388145 S Ci:1:004:0 s c0 02 b030 0001 0002 2 <
ffff88007d9556c0 3215398913 C Ci:1:004:0 0 2 = 01b0
ffff88007d9556c0 3215398973 S Ci:1:004:0 s c0 02 b030 0001 0002 2 <
ffff88007d9556c0 3215400475 C Ci:1:004:0 0 2 = 01b0
ffff88007d9556c0 3215400526 S Ci:1:004:0 s c0 0d fe00 12c6 0004 4 <
ffff88007d9556c0 3215401219 C Ci:1:004:0 0 4 = 01fec612
ffff88007d9556c0 3215401242 S Ci:1:004:0 s c0 0d 0003 0000 0002 2 <
ffff88007d9556c0 3215401914 C Ci:1:004:0 0 2 = 0100
ffff88007d9556c0 3215401937 S Ci:1:004:0 s c0 0e 0030 0000 0005 5 <
ffff88007d9556c0 3215403785 C Ci:1:004:0 0 5 = 01fec612 00
ffff88007d9556c0 3215403850 S Ci:1:004:0 s c0 03 fe30 12c6 0003 3 <
ffff88007d9556c0 3215405337 C Ci:1:004:0 0 3 = 01fec6
ffff88007d9556c0 3215405373 S Ci:1:004:0 s c0 14 fe30 00c7 0002 2 <
ffff88007d9556c0 3215406870 C Ci:1:004:0 0 2 = 01fe
ffff88007d9556c0 3215406893 S Ci:1:004:0 s c0 19 0030 0000 0002 2 <
ffff88007d9556c0 3215408323 C Ci:1:004:0 0 2 = 0113
ffff88007d9556c0 3215408345 S Ci:1:004:0 s c0 03 fe30 13c6 0003 3 <
ffff88007d9556c0 3215410010 C Ci:1:004:0 0 3 = 01fec6
ffff88007d9556c0 3215410050 S Ci:1:004:0 s c0 14 fe30 00c7 0002 2 <
ffff88007d9556c0 3215411968 C Ci:1:004:0 0 2 = 01fe
ffff88007d9556c0 3215412017 S Ci:1:004:0 s c0 19 0030 0000 0002 2 <
ffff88007d9556c0 3215415148 C Ci:1:004:0 0 2 = 010a
ffff88007d9556c0 3215415205 S Ci:1:004:0 s c0 03 fe30 0dc6 0003 3 <
ffff88007d9556c0 3215416571 C Ci:1:004:0 0 3 = 01fec6
ffff88007d9556c0 3215416596 S Ci:1:004:0 s c0 14 fe30 00c7 0002 2 <
ffff88007d9556c0 3215417918 C Ci:1:004:0 0 2 = 01fe
ffff88007d9556c0 3215417942 S Ci:1:004:0 s c0 19 0030 0000 0002 2 <
ffff88007d9556c0 3215419212 C Ci:1:004:0 0 2 = 0112
ffff88007d9556c0 3215419236 S Ci:1:004:0 s c0 03 fe30 10c6 0003 3 <
ffff88007d9556c0 3215420783 C Ci:1:004:0 0 3 = 01fec6
ffff88007d9556c0 3215420807 S Ci:1:004:0 s c0 14 fe30 00c7 0002 2 <
ffff88007d9556c0 3215422463 C Ci:1:004:0 0 2 = 01fe
ffff88007d9556c0 3215422487 S Ci:1:004:0 s c0 19 0030 0000 0002 2 <
ffff88007d9556c0 3215423850 C Ci:1:004:0 0 2 = 0106
ffff88007d9556c0 3215423886 S Ci:1:004:0 s c0 02 b030 0001 0002 2 <
ffff88007d9556c0 3215425492 C Ci:1:004:0 0 2 = 0140
ffff88007d9556c0 3215425516 S Ci:1:004:0 s c0 02 b030 0001 0002 2 <
ffff88007d9556c0 3215426967 C Ci:1:004:0 0 2 = 0140
ffff88007d9556c0 3215628020 S Ci:1:004:0 s c0 02 044a 0000 0002 2 <
ffff88007d9556c0 3215646739 C Ci:1:004:0 0 2 = 0181
ffff88007d9556c0 3215747326 S Ci:1:004:0 s c0 02 b030 0001 0002 2 <
ffff88007d9556c0 3215751255 C Ci:1:004:0 0 2 = 0190
ffff88007d9556c0 3215751287 S Ci:1:004:0 s c0 02 b030 0001 0002 2 <
ffff88007d9556c0 3215752934 C Ci:1:004:0 0 2 = 0190
ffff88007d9556c0 3215752958 S Ci:1:004:0 s c0 0d fe00 12c6 0004 4 <
ffff88007d9556c0 3215753846 C Ci:1:004:0 0 4 = 01fec612
ffff88007d9556c0 3215753870 S Ci:1:004:0 s c0 0d 0003 0000 0002 2 <
ffff88007d9556c0 3215754785 C Ci:1:004:0 0 2 = 0100
ffff88007d9556c0 3215754808 S Ci:1:004:0 s c0 0e 0030 0000 0005 5 <
ffff88007d9556c0 3215756891 C Ci:1:004:0 0 5 = 01fec612 00
ffff88007d9556c0 3215756915 S Ci:1:004:0 s c0 03 fe30 12c6 0003 3 <
ffff88007d9556c0 3215758659 C Ci:1:004:0 0 3 = 01fec6
ffff88007d9556c0 3215758686 S Ci:1:004:0 s c0 14 fe30 00c7 0002 2 <
ffff88007d9556c0 3215760123 C Ci:1:004:0 0 2 = 01fe
ffff88007d9556c0 3215760147 S Ci:1:004:0 s c0 19 0030 0000 0002 2 <
ffff88007d9556c0 3215762197 C Ci:1:004:0 0 2 = 0113
ffff88007d9556c0 3215762345 S Ci:1:004:0 s c0 03 fe30 13c6 0003 3 <
ffff88007d9556c0 3215765147 C Ci:1:004:0 0 3 = 01fec6
ffff88007d9556c0 3215765176 S Ci:1:004:0 s c0 14 fe30 00c7 0002 2 <
ffff88007d9556c0 3215766641 C Ci:1:004:0 0 2 = 01fe
ffff88007d9556c0 3215766728 S Ci:1:004:0 s c0 19 0030 0000 0002 2 <
ffff88007d9556c0 3215769923 C Ci:1:004:0 0 2 = 010a
ffff88007d9556c0 3215769974 S Ci:1:004:0 s c0 03 fe30 0dc6 0003 3 <
ffff88007d9556c0 3215771458 C Ci:1:004:0 0 3 = 01fec6
ffff88007d9556c0 3215771482 S Ci:1:004:0 s c0 14 fe30 00c7 0002 2 <
ffff88007d9556c0 3215772899 C Ci:1:004:0 0 2 = 01fe
ffff88007d9556c0 3215772923 S Ci:1:004:0 s c0 19 0030 0000 0002 2 <
ffff88007d9556c0 3215774135 C Ci:1:004:0 0 2 = 0112
ffff88007d9556c0 3215774161 S Ci:1:004:0 s c0 03 fe30 10c6 0003 3 <
ffff88007d9556c0 3215775643 C Ci:1:004:0 0 3 = 01fec6
ffff88007d9556c0 3215775668 S Ci:1:004:0 s c0 14 fe30 00c7 0002 2 <
ffff88007d9556c0 3215776937 C Ci:1:004:0 0 2 = 01fe
ffff88007d9556c0 3215776963 S Ci:1:004:0 s c0 19 0030 0000 0002 2 <
ffff88007d9556c0 3215778293 C Ci:1:004:0 0 2 = 0106
ffff88007d9556c0 3215778341 S Ci:1:004:0 s c0 02 b030 0001 0002 2 <
ffff88007d9556c0 3215779756 C Ci:1:004:0 0 2 = 0100
ffff88007d9556c0 3215779800 S Ci:1:004:0 s c0 02 b030 0001 0002 2 <
ffff88007d9556c0 3215781428 C Ci:1:004:0 0 2 = 0100
ffff88007d9556c0 3216032644 S Ci:1:004:0 s c0 02 044a 0000 0002 2 <
ffff88007d9556c0 3216044080 C Ci:1:004:0 0 2 = 0181
ffff88007d9556c0 3216094550 S Ci:1:004:0 s c0 02 b030 0001 0002 2 <
ffff88007d9556c0 3216096750 C Ci:1:004:0 0 2 = 0190
ffff88007d9556c0 3216096789 S Ci:1:004:0 s c0 02 b030 0001 0002 2 <
ffff88007d9556c0 3216098186 C Ci:1:004:0 0 2 = 0190
ffff88007d9556c0 3216098237 S Ci:1:004:0 s c0 0d fe00 12c6 0004 4 <
ffff88007d9556c0 3216098903 C Ci:1:004:0 0 4 = 01fec612
ffff88007d9556c0 3216098928 S Ci:1:004:0 s c0 0d 0003 0000 0002 2 <
ffff88007d9556c0 3216099775 C Ci:1:004:0 0 2 = 0100
ffff88007d9556c0 3216099798 S Ci:1:004:0 s c0 0e 0030 0000 0005 5 <
ffff88007d9556c0 3216101721 C Ci:1:004:0 0 5 = 01fec612 00
ffff88007d9556c0 3216101830 S Ci:1:004:0 s c0 03 fe30 12c6 0003 3 <
ffff88007d9556c0 3216103298 C Ci:1:004:0 0 3 = 01fec6
ffff88007d9556c0 3216103442 S Ci:1:004:0 s c0 14 fe30 00c7 0002 2 <
ffff88007d9556c0 3216104664 C Ci:1:004:0 0 2 = 01fe
ffff88007d9556c0 3216104692 S Ci:1:004:0 s c0 19 0030 0000 0002 2 <
ffff88007d9556c0 3216106027 C Ci:1:004:0 0 2 = 0113
ffff88007d9556c0 3216106052 S Ci:1:004:0 s c0 03 fe30 13c6 0003 3 <
ffff88007d9556c0 3216107677 C Ci:1:004:0 0 3 = 01fec6
ffff88007d9556c0 3216107709 S Ci:1:004:0 s c0 14 fe30 00c7 0002 2 <
ffff88007d9556c0 3216109005 C Ci:1:004:0 0 2 = 01fe
ffff88007d9556c0 3216109034 S Ci:1:004:0 s c0 19 0030 0000 0002 2 <
ffff88007d9556c0 3216110257 C Ci:1:004:0 0 2 = 010a
ffff88007d9556c0 3216110285 S Ci:1:004:0 s c0 03 fe30 0dc6 0003 3 <
ffff88007d9556c0 3216111906 C Ci:1:004:0 0 3 = 01fec6
ffff88007d9556c0 3216111950 S Ci:1:004:0 s c0 14 fe30 00c7 0002 2 <
ffff88007d9556c0 3216113374 C Ci:1:004:0 0 2 = 01fe
ffff88007d9556c0 3216113416 S Ci:1:004:0 s c0 19 0030 0000 0002 2 <
ffff88007d9556c0 3216114592 C Ci:1:004:0 0 2 = 0112
ffff88007d9556c0 3216114631 S Ci:1:004:0 s c0 03 fe30 10c6 0003 3 <
ffff88007d9556c0 3216115990 C Ci:1:004:0 0 3 = 01fec6
ffff88007d9556c0 3216116015 S Ci:1:004:0 s c0 14 fe30 00c7 0002 2 <
ffff88007d9556c0 3216117462 C Ci:1:004:0 0 2 = 01fe
ffff88007d9556c0 3216117486 S Ci:1:004:0 s c0 19 0030 0000 0002 2 <
ffff88007d9556c0 3216118685 C Ci:1:004:0 0 2 = 0106
ffff88007d9556c0 3216118723 S Ci:1:004:0 s c0 02 b030 0001 0002 2 <
ffff88007d9556c0 3216120397 C Ci:1:004:0 0 2 = 01b0
ffff88007d9556c0 3216120422 S Ci:1:004:0 s c0 02 b030 0001 0002 2 <
ffff88007d9556c0 3216122013 C Ci:1:004:0 0 2 = 01b0
ffff88007d9556c0 3216124901 S Ci:1:004:0 s c0 07 0001 0000 0001 1 <
ffff88007d9556c0 3216128135 C Ci:1:004:0 0 1 = 01
ffff88007d955840 3216129009 C Bi:1:004:2 -2 0
ffff88007d9553c0 3216129294 C Bi:1:004:2 -2 0
ffff88007d955180 3216129464 C Bi:1:004:2 -2 0
ffff88007d9550c0 3216129664 C Bi:1:004:2 -2 0
ffff88007d9556c0 3216130509 S Ci:1:004:0 s c0 07 0000 0000 0001 1 <
ffff88007d9556c0 3216132115 C Ci:1:004:0 0 1 = 01
ffff88007d8c2a40 3216132411 C Bi:1:004:1 -2 0
ffff88007d955d80 3216132531 C Bi:1:004:1 -2 0
ffff88007d955a80 3216132631 C Bi:1:004:1 -2 0
ffff88007d955c00 3216132738 C Bi:1:004:1 -2 0
ffff88007d9556c0 3216133034 S Ci:1:004:0 s c0 03 044a 0000 0002 2 <
ffff88007d9556c0 3216135934 C Ci:1:004:0 0 2 = 0104
ffff88007d9556c0 3216135958 S Ci:1:004:0 s c0 03 004a 0000 0002 2 <
ffff88007d9556c0 3216137343 C Ci:1:004:0 0 2 = 0100
ffff88007d9556c0 3216187878 S Ci:1:004:0 s c0 08 0400 0000 0001 1 <
ffff88007d9556c0 3216189203 C Ci:1:004:0 0 1 = 73
ffff88007d125a80 3226022403 S Ci:1:004:0 s c0 07 0000 0000 0001 1 <
ffff88007d125a80 3226022894 C Ci:1:004:0 0 1 = 01
ffff88007d125a80 3226022999 S Ci:1:004:0 s c0 07 0001 0000 0001 1 <
ffff88007d125a80 3226027938 C Ci:1:004:0 0 1 = 01
ffff88007d125a80 3226028042 S Ci:1:004:0 s c0 08 dfdf 0000 0001 1 <
ffff88007d125a80 3226030099 C Ci:1:004:0 0 1 = ff
ffff88007d125a80 3226030459 S Ci:1:004:0 s c0 08 0000 0000 0001 1 <
ffff88007d125a80 3226032622 C Ci:1:004:0 0 1 = ff
ffff88007d125a80 3226032822 S Ci:1:004:0 s c0 11 0000 0000 0001 1 <
ffff88007d125a80 3226035240 C Ci:1:004:0 0 1 = 02
