ffff88007d955c00 3370950765 S Co:1:002:0 s 40 ab 0000 5399 0200 512 [firmware payload omitted]
ffff88007d955c00 3370955738 C Co:1:002:0 0 512 >
ffff88007d955c00 3370955828 S Co:1:002:0 s 40 ab 0200 5399 0200 512 [firmware payload omitted]
ffff88007d955c00 3370960862 C Co:1:002:0 0 512 >
ffff88007d955c00 3370960898 S Co:1:002:0 s 40 ab 0400 5399 0200 512 [firmware payload omitted]
ffff88007d955c00 3370966214 C Co:1:002:0 0 512 >
ffff88007d955c00 3370966255 S Co:1:002:0 s 40 ab 0600 5399 0200 512 [firmware payload omitted]
ffff88007d955c00 3370971479 C Co:1:002:0 0 512 >
ffff88007d955c00 3370971527 S Co:1:002:0 s 40 ab 0800 5399 0200 512 [firmware payload omitted]
ffff88007d955c00 3370976436 C Co:1:002:0 0 512 >
ffff88007d955c00 3370976458 S Co:1:002:0 s 40 ab 0a00 5399 0200 512 [firmware payload omitted]
ffff88007d955c00 3370981820 C Co:1:002:0 0 512 >
ffff88007d955c00 3370981846 S Co:1:002:0 s 40 ab 2000 5399 0200 512 [firmware payload omitted]
ffff88007d955c00 3370987280 C Co:1:002:0 0 512 >
ffff88007d955c00 3370987325 S Co:1:002:0 s 40 ab 2200 5399 0200 512 [firmware payload omitted]
ffff88007d955c00 3370992460 C Co:1:002:0 0 512 >
ffff88007d955c00 3370992485 S Co:1:002:0 s 40 ab 2800 5399 0200 512 [firmware payload omitted]
ffff88007d955c00 3370998050 C Co:1:002:0 0 512 >
ffff88007d955c00 3370998105 S Co:1:002:0 s 40 ab 2a00 5399 0200 512 [firmware payload omitted]
ffff88007d955c00 3371003469 C Co:1:002:0 0 512 >
ffff88007d955c00 3371003572 S Co:1:002:0 s 40 ab 2c00 5399 0200 512 [firmware payload omitted]
ffff88007d955c00 3371008853 C Co:1:002:0 0 512 >
ffff88007d955c00 3371008907 S Co:1:002:0 s 40 ab 2e00 5399 0200 512 [firmware payload omitted]
ffff88007d955c00 3371014291 C Co:1:002:0 0 512 >
ffff88007d955c00 3371014338 S Co:1:002:0 s 40 ab 3000 5399 0200 512 [firmware payload omitted]
ffff88007d955c00 3371019764 C Co:1:002:0 0 512 >
ffff88007d955c00 3371019843 S Co:1:002:0 s 40 ab 3200 5399 0200 512 [firmware payload omitted]
ffff88007d955c00 3371025317 C Co:1:002:0 0 512 >
ffff88007d955c00 3371025430 S Co:1:002:0 s 40 ab 3400 5399 0200 512 [firmware payload omitted]
ffff88007d955c00 3371032395 C Co:1:002:0 0 512 >
ffff88007d955c00 3371032438 S Co:1:002:0 s 40 ab 3600 5399 0200 512 [firmware payload omitted]
ffff88007d955c00 3371037704 C Co:1:002:0 0 512 >
ffff88007d955c00 3371037841 S Co:1:002:0 s 40 ab 3800 5399 0200 512 [firmware payload omitted]
ffff88007d955c00 3371045148 C Co:1:002:0 0 512 >
ffff88007d955c00 3371045207 S Co:1:002:0 s 40 ab 3a00 5399 0200 512 [firmware payload omitted]
ffff88007d955c00 3371050192 C Co:1:002:0 0 512 >
ffff88007d955c00 3371050224 S Co:1:002:0 s 40 ab 3c00 5399 0200 512 [firmware payload omitted]
ffff88007d955c00 3371055563 C Co:1:002:0 0 512 >
ffff88007d955c00 3371055727 S Co:1:002:0 s 40 ac 3e00 5399 0200 512 [firmware payload omitted]
ffff88007d955c00 3371060809 C Co:1:002:0 0 512 >
ffff88007d955c00 3371060845 S Co:1:003:0 s 40 ab 0000 5399 0200 512 [firmware payload omitted]
ffff88007d955c00 3371066288 C Co:1:003:0 0 512 >
ffff88007d955c00 3371066419 S Co:1:003:0 s 40 ab 0200 5399 0200 512 [firmware payload omitted]
ffff88007d955c00 3371073403 C Co:1:003:0 0 512 >
ffff88007d955c00 3371073447 S Co:1:003:0 s 40 ab 0400 5399 0200 512 [firmware payload omitted]
ffff88007d955c00 3371078607 C Co:1:003:0 0 512 >
ffff88007d955c00 3371078629 S Co:1:003:0 s 40 ab 0600 5399 0200 512 [firmware payload omitted]
ffff88007d955c00 3371084036 C Co:1:003:0 0 512 >
ffff88007d955c00 3371084065 S Co:1:003:0 s 40 ab 0800 5399 0200 512 [firmware payload omitted]
ffff88007d955c00 3371089365 C Co:1:003:0 0 512 >
ffff88007d955c00 3371089416 S Co:1:003:0 s 40 ab 0a00 5399 0200 512 [firmware payload omitted]
ffff88007d955c00 3371096826 C Co:1:003:0 0 512 >
ffff88007d955c00 3371096851 S Co:1:003:0 s 40 ab 2000 5399 0200 512 [firmware payload omitted]
ffff88007d955c00 3371102539 C Co:1:003:0 0 512 >
ffff88007d955c00 3371102595 S Co:1:003:0 s 40 ab 2200 5399 0200 512 [firmware payload omitted]
ffff88007d955c00 3371109378 C Co:1:003:0 0 512 >
ffff88007d955c00 3371109446 S Co:1:003:0 s 40 ab 2800 5399 0200 512 [firmware payload omitted]
ffff88007d955c00 3371114554 C Co:1:003:0 0 512 >
ffff88007d955c00 3371114576 S Co:1:003:0 s 40 ab 2a00 5399 0200 512 [firmware payload omitted]
ffff88007d955c00 3371120486 C Co:1:003:0 0 512 >
ffff88007d955c00 3371120603 S Co:1:003:0 s 40 ab 2c00 5399 0200 512 [firmware payload omitted]
ffff88007d955c00 3371127479 C Co:1:003:0 0 512 >
ffff88007d955c00 3371127515 S Co:1:003:0 s 40 ab 2e00 5399 0200 512 [firmware payload omitted]
ffff88007d955c00 3371132907 C Co:1:003:0 0 512 >
ffff88007d955c00 3371132929 S Co:1:003:0 s 40 ab 3000 5399 0200 512 [firmware payload omitted]
ffff88007d955c00 3371138194 C Co:1:003:0 0 512 >
ffff88007d955c00 3371138259 S Co:1:003:0 s 40 ab 3200 5399 0200 512 [firmware payload omitted]
ffff88007d955c00 3371143506 C Co:1:003:0 0 512 >
ffff88007d955c00 3371143529 S Co:1:003:0 s 40 ab 3400 5399 0200 512 [firmware payload omitted]
ffff88007d955c00 3371148885 C Co:1:003:0 0 512 >
ffff88007d955c00 3371148941 S Co:1:003:0 s 40 ab 3600 5399 0200 512 [firmware payload omitted]
ffff88007d955c00 3371154279 C Co:1:003:0 0 512 >
ffff88007d955c00 3371154335 S Co:1:003:0 s 40 ab 3800 5399 0200 512 [firmware payload omitted]
ffff88007d955c00 3371159544 C Co:1:003:0 0 512 >
ffff88007d955c00 3371159593 S Co:1:003:0 s 40 ab 3a00 5399 0200 512 [firmware payload omitted]
ffff88007d955c00 3371165001 C Co:1:003:0 0 512 >
ffff88007d955c00 3371165058 S Co:1:003:0 s 40 ab 3c00 5399 0200 512 [firmware payload omitted]
ffff88007d955c00 3371170608 C Co:1:003:0 0 512 >
ffff88007d955c00 3371170657 S Co:1:003:0 s 40 ac 3e00 5399 0200 512 [firmware payload omitted]
ffff88007d955c00 3371175970 C Co:1:003:0 0 512 >
ffff88007d17e980 3373032018 C Ii:1:001:1 0:2048 1 = 04
ffff88007d17e980 3373032040 S Ii:1:001:1 -115:2048 4 <
ffff88007d8c2080 3373032275 S Ci:1:001:0 s a3 00 0000 0002 0004 4 <
ffff88007d8c2080 3373032320 C Ci:1:001:0 0 4 = 00010100
ffff88007d8c2080 3373032322 S Co:1:001:0 s 23 01 0010 0002 0000 0
ffff88007d8c2080 3373032351 C Co:1:001:0 0 0
ffff88007d142a40 3373033376 S Ci:1:001:0 s a3 00 0000 0002 0004 4 <
ffff88007d142a40 3373033434 C Ci:1:001:0 0 4 = 00010000
ffff88007d142a40 3373059276 S Ci:1:001:0 s a3 00 0000 0002 0004 4 <
ffff88007d142a40 3373059310 C Ci:1:001:0 0 4 = 00010000
ffff88007d142a40 3373085271 S Ci:1:001:0 s a3 00 0000 0002 0004 4 <
ffff88007d142a40 3373085343 C Ci:1:001:0 0 4 = 00010000
ffff88007d142a40 3373111271 S Ci:1:001:0 s a3 00 0000 0002 0004 4 <
ffff88007d142a40 3373111306 C Ci:1:001:0 0 4 = 00010000
ffff88007d142a40 3373137260 S Ci:1:001:0 s a3 00 0000 0002 0004 4 <
ffff88007d142a40 3373137301 C Ci:1:001:0 0 4 = 00010000
ffff88007d17e980 3447981828 C Ii:1:001:1 0:2048 1 = 02
ffff88007d17e980 3447981838 S Ii:1:001:1 -115:2048 4 <
ffff88007d955600 3447981914 S Ci:1:001:0 s a3 00 0000 0001 0004 4 <
ffff88007d955600 3447981929 C Ci:1:001:0 0 4 = 00010100
ffff88007d955600 3447981930 S Co:1:001:0 s 23 01 0010 0001 0000 0
ffff88007d955600 3447981951 C Co:1:001:0 0 0
ffff88007d1259c0 3447982333 S Ci:1:001:0 s a3 00 0000 0001 0004 4 <
ffff88007d1259c0 3447982344 C Ci:1:001:0 0 4 = 00010000
ffff88007d1259c0 3448008243 S Ci:1:001:0 s a3 00 0000 0001 0004 4 <
ffff88007d1259c0 3448008273 C Ci:1:001:0 0 4 = 00010000
ffff88007d1259c0 3448034278 S Ci:1:001:0 s a3 00 0000 0001 0004 4 <
ffff88007d1259c0 3448034368 C Ci:1:001:0 0 4 = 00010000
ffff88007d1259c0 3448060375 S Ci:1:001:0 s a3 00 0000 0001 0004 4 <
ffff88007d1259c0 3448060405 C Ci:1:001:0 0 4 = 00010000
ffff88007d1259c0 3448086448 S Ci:1:001:0 s a3 00 0000 0001 0004 4 <
ffff88007d1259c0 3448086498 C Ci:1:001:0 0 4 = 00010000
ffff88007d17e980 3449712540 C Ii:1:001:1 0:2048 1 = 02
ffff88007d17e980 3449712545 S Ii:1:001:1 -115:2048 4 <
ffff88007d1259c0 3449712562 S Ci:1:001:0 s a3 00 0000 0001 0004 4 <
ffff88007d1259c0 3449712571 C Ci:1:001:0 0 4 = 01050100
ffff88007d1259c0 3449712573 S Co:1:001:0 s 23 01 0010 0001 0000 0
ffff88007d1259c0 3449712594 C Co:1:001:0 0 0
ffff88007d1259c0 3449712595 S Ci:1:001:0 s a3 00 0000 0001 0004 4 <
ffff88007d1259c0 3449712602 C Ci:1:001:0 0 4 = 01050000
ffff88007d1259c0 3449738337 S Ci:1:001:0 s a3 00 0000 0001 0004 4 <
ffff88007d1259c0 3449738449 C Ci:1:001:0 0 4 = 01050000
ffff88007d1259c0 3449764395 S Ci:1:001:0 s a3 00 0000 0001 0004 4 <
ffff88007d1259c0 3449764425 C Ci:1:001:0 0 4 = 01050000
ffff88007d1259c0 3449790343 S Ci:1:001:0 s a3 00 0000 0001 0004 4 <
ffff88007d1259c0 3449790373 C Ci:1:001:0 0 4 = 01050000
ffff88007d1259c0 3449816381 S Ci:1:001:0 s a3 00 0000 0001 0004 4 <
ffff88007d1259c0 3449816411 C Ci:1:001:0 0 4 = 01050000
ffff88007d1259c0 3449816420 S Co:1:001:0 s 23 03 0004 0001 0000 0
ffff88007d1259c0 3449816442 C Co:1:001:0 0 0
ffff88007d1259c0 3449867428 S Ci:1:001:0 s a3 00 0000 0001 0004 4 <
ffff88007d1259c0 3449867617 C Ci:1:001:0 0 4 = 03051000
ffff88007d1259c0 3449918315 S Co:1:001:0 s 23 01 0014 0001 0000 0
ffff88007d1259c0 3449918379 C Co:1:001:0 0 0
ffff88007d1259c0 3449918394 S Ci:1:000:0 s 80 06 0100 0000 0040 64 <
ffff88007d1259c0 3449919274 C Ci:1:000:0 0 18 = 12010002 00000040 060b0500 01001020 0001
ffff88007d1259c0 3449919657 S Co:1:001:0 s 23 03 0004 0001 0000 0
ffff88007d1259c0 3449919819 C Co:1:001:0 0 0
ffff88007d1259c0 3449970541 S Ci:1:001:0 s a3 00 0000 0001 0004 4 <
ffff88007d1259c0 3449971019 C Ci:1:001:0 0 4 = 03051000
ffff88007d1259c0 3450021339 S Co:1:001:0 s 23 01 0014 0001 0000 0
ffff88007d1259c0 3450021421 C Co:1:001:0 0 0
ffff88007d1259c0 3450021427 S Co:1:000:0 s 00 05 0004 0000 0000 0
ffff88007d1259c0 3450021679 C Co:1:000:0 0 0
ffff88007d1259c0 3450033224 S Ci:1:004:0 s 80 06 0100 0000 0012 18 <
ffff88007d1259c0 3450037192 C Ci:1:004:0 0 18 = 12010002 00000040 060b0500 01001020 0001
ffff88007d1259c0 3450037327 S Ci:1:004:0 s 80 06 0200 0000 0009 9 <
ffff88007d1259c0 3450039985 C Ci:1:004:0 0 9 = 09023000 02013080 fa
ffff88007d1259c0 3450040029 S Ci:1:004:0 s 80 06 0200 0000 0030 48 <
ffff88007d1259c0 3450040770 C Ci:1:004:0 0 48 = 09023000 02013080 fa090400 0002ffff ff200705 81020002 00070582 02000200
ffff88007d8c2080 3450040811 S Ci:1:004:0 s 80 06 0300 0000 00ff 255 <
ffff88007d8c2080 3450041419 C Ci:1:004:0 0 4 = 04030904
ffff88007d8c2080 3450041485 S Ci:1:004:0 s 80 06 0320 0409 00ff 255 <
ffff88007d8c2080 3450042342 C Ci:1:004:0 0 34 = 22034800 44005400 56002000 50005800 2d005700 33005500 33000000 00000000
ffff88007d8c2080 3450042397 S Ci:1:004:0 s 80 06 0310 0409 00ff 255 <
ffff88007d8c2080 3450048342 C Ci:1:004:0 0 22 = 16034900 53004400 42000000 00000000 00000000 0000
ffff88007d8c2140 3450051347 S Co:1:004:0 s 00 09 0001 0000 0000 0
ffff88007d8c2140 3450053720 C Co:1:004:0 0 0
ffff88007d8c2140 3450053786 S Ci:1:004:0 s 80 06 0330 0409 00ff 255 <
ffff88007d8c2140 3450056405 C Ci:1:004:0 0 22 = 16034400 54005600 20004300 4f004e00 46004900 4700
ffff88007d8c2200 3450056475 S Ci:1:004:0 s 80 06 0320 0409 00ff 255 <
ffff88007d8c2200 3450062346 C Ci:1:004:0 0 34 = 22034800 44005400 56002000 50005800 2d005700 33005500 33000000 00000000
ffff88007d8c28c0 3450062454 S Ci:1:004:0 s 80 06 0340 0409 00ff 255 <
ffff88007d8c28c0 3450063716 C Ci:1:004:0 0 32 = 20034800 44005400 56002000 49005200 32004800 49004400 00000000 00000000
