ffff88007d17e5c0 531028666 S Ci:1:004:0 s c0 17 0002 0000 0003 3 <
ffff88007d17e5c0 531029561 C Ci:1:004:0 0 3 = 011152
ffff88007d17e5c0 531030009 S Ci:1:004:0 s c0 08 4000 0000 0001 1 <
ffff88007d17e5c0 531032139 C Ci:1:004:0 0 1 = bf
ffff88007d17e5c0 531082406 S Ci:1:004:0 s c0 08 0800 0000 0001 1 <
ffff88007d17e5c0 531083809 C Ci:1:004:0 0 1 = b7
ffff88007d17e5c0 531134016 S Ci:1:004:0 s c0 08 1010 0000 0001 1 <
ffff88007d17e5c0 531140960 C Ci:1:004:0 0 1 = b7
ffff88007d17e5c0 531151272 S Ci:1:004:0 s c0 08 1000 0000 0001 1 <
ffff88007d17e5c0 531153297 C Ci:1:004:0 0 1 = a7
ffff88007d17e5c0 531163814 S Ci:1:004:0 s c0 08 1010 0000 0001 1 <
ffff88007d17e5c0 531168923 C Ci:1:004:0 0 1 = b7
ffff88007d17e5c0 531169010 S Ci:1:004:0 s c0 08 0404 0000 0001 1 <
ffff88007d17e5c0 531174074 C Ci:1:004:0 0 1 = b7
ffff88007d17e5c0 531184334 S Ci:1:004:0 s c0 08 0400 0000 0001 1 <
ffff88007d17e5c0 531186509 C Ci:1:004:0 0 1 = b3
ffff88007d17e5c0 531197033 S Ci:1:004:0 s c0 08 0404 0000 0001 1 <
ffff88007d17e5c0 531201905 C Ci:1:004:0 0 1 = b7
ffff88007d17e5c0 531212142 S Ci:1:004:0 s c0 02 00a8 0000 0002 2 <
ffff88007d17e5c0 531217835 C Ci:1:004:0 0 2 = 01ae
ffff88007d17e5c0 531228041 S Ci:1:004:0 s c0 02 b0a8 0000 0011 17 <
ffff88007d17e5c0 531236994 C Ci:1:004:0 0 17 [firmware or device-identity payload omitted]
ffff88007d17e5c0 531237068 S Ci:1:004:0 s c0 08 db07 0000 0001 1 <
ffff88007d17e5c0 531242926 C Ci:1:004:0 0 1 = 27
ffff88007d17e5c0 531242972 S Ci:1:004:0 s c0 08 4040 0000 0001 1 <
ffff88007d17e5c0 531243447 C Ci:1:004:0 0 1 = 67
ffff88007d17e5c0 531243484 S Ci:1:004:0 s c0 08 0400 0000 0001 1 <
ffff88007d17e5c0 531244055 C Ci:1:004:0 0 1 = 63
ffff88007d17e5c0 531254314 S Ci:1:004:0 s c0 05 1f41 00ff 0003 3 <
ffff88007d17e5c0 531255611 C Ci:1:004:0 0 3 = 011fff
ffff88007d17e5c0 531255642 S Ci:1:004:0 s c0 05 1f43 00ff 0003 3 <
ffff88007d17e5c0 531256244 C Ci:1:004:0 0 3 = 011fff
ffff88007d17e5c0 531256967 S Bi:1:004:1 -115 65536 <
ffff88007d17eb00 531256975 S Bi:1:004:1 -115 65536 <
ffff88007d955e40 531256981 S Bi:1:004:1 -115 65536 <
ffff88007d17e500 531256989 S Bi:1:004:1 -115 65536 <
ffff88007d8c2ec0 531257012 S Ci:1:004:0 s c0 06 0000 0000 0001 1 <
ffff88007d17e980 531257349 C Ii:1:001:1 0:2048 1 = 04
ffff88007d17e980 531257359 S Ii:1:001:1 -115:2048 4 <
ffff88007b08eec0 531257397 S Ci:1:001:0 s a3 00 0000 0002 0004 4 <
ffff88007b08eec0 531257411 C Ci:1:001:0 0 4 = 00010100
ffff88007b08eec0 531257413 S Co:1:001:0 s 23 01 0010 0002 0000 0
ffff88007b08eec0 531257441 C Co:1:001:0 0 0
ffff88007d9556c0 531258096 S Ci:1:001:0 s a3 00 0000 0002 0004 4 <
ffff88007d9556c0 531258110 C Ci:1:001:0 0 4 = 00010000
ffff88007d8c2ec0 531258973 C Ci:1:004:0 0 1 = 01
ffff88007d8c2ec0 531259001 S Ci:1:004:0 s c0 04 0040 0000 0002 2 <
ffff88007d8c2ec0 531263921 C Ci:1:004:0 0 2 = 0104
ffff88007d8c2ec0 531269490 S Ci:1:004:0 s c0 05 0c40 0000 0002 2 <
ffff88007d8c2ec0 531274737 C Ci:1:004:0 0 2 = 010c
ffff88007d8c2ec0 531274808 S Ci:1:004:0 s c0 07 0000 0000 0001 1 <
ffff88007d8c2ec0 531279996 C Ci:1:004:0 0 1 = 01
ffff88007d17e5c0 531281294 C Bi:1:004:1 -2 0
ffff88007d17eb00 531281672 C Bi:1:004:1 -2 0
ffff88007d955e40 531281894 C Bi:1:004:1 -2 0
ffff88007d17e500 531282102 C Bi:1:004:1 -2 0
ffff88007d9556c0 531282939 S Ci:1:001:0 s a3 00 0000 0002 0004 4 <
ffff88007d9556c0 531282958 C Ci:1:001:0 0 4 = 00010000
ffff88007d8c2ec0 531308941 S Ci:1:001:0 s a3 00 0000 0002 0004 4 <
ffff88007d8c2ec0 531308962 C Ci:1:001:0 0 4 = 00010000
ffff88007d17e800 531334949 S Ci:1:001:0 s a3 00 0000 0002 0004 4 <
ffff88007d17e800 531335000 C Ci:1:001:0 0 4 = 00010000
ffff88007d17e800 531360996 S Ci:1:001:0 s a3 00 0000 0002 0004 4 <
ffff88007d17e800 531361051 C Ci:1:001:0 0 4 = 00010000
ffff88007d17e980 533258188 C Ii:1:001:1 0:2048 1 = 04
ffff88007d17e980 533258196 S Ii:1:001:1 -115:2048 4 <
ffff88007d17e800 533258247 S Ci:1:001:0 s a3 00 0000 0002 0004 4 <
ffff88007d17e800 533258262 C Ci:1:001:0 0 4 = 01050100
ffff88007d17e800 533258264 S Co:1:001:0 s 23 01 0010 0002 0000 0
ffff88007d17e800 533258285 C Co:1:001:0 0 0
ffff88007d17e800 533258287 S Ci:1:001:0 s a3 00 0000 0002 0004 4 <
ffff88007d17e800 533258294 C Ci:1:001:0 0 4 = 01050000
ffff88007d17e800 533284058 S Ci:1:001:0 s a3 00 0000 0002 0004 4 <
ffff88007d17e800 533284077 C Ci:1:001:0 0 4 = 01050000
ffff88007d17e800 533309945 S Ci:1:001:0 s a3 00 0000 0002 0004 4 <
ffff88007d17e800 533309997 C Ci:1:001:0 0 4 = 01050000
ffff88007d17e800 533336077 S Ci:1:001:0 s a3 00 0000 0002 0004 4 <
ffff88007d17e800 533336320 C Ci:1:001:0 0 4 = 01050000
ffff88007d17e800 533362085 S Ci:1:001:0 s a3 00 0000 0002 0004 4 <
ffff88007d17e800 533362240 C Ci:1:001:0 0 4 = 01050000
ffff88007d17e800 533362263 S Co:1:001:0 s 23 03 0004 0002 0000 0
ffff88007d17e800 533362301 C Co:1:001:0 0 0
ffff88007d17e800 533413207 S Ci:1:001:0 s a3 00 0000 0002 0004 4 <
ffff88007d17e800 533555559 C Ci:1:001:0 0 4 = 03051000
ffff88007d17e800 533606008 S Co:1:001:0 s 23 01 0014 0002 0000 0
ffff88007d17e800 533606074 C Co:1:001:0 0 0
ffff88007d17e800 533606084 S Ci:1:000:0 s 80 06 0100 0000 0040 64 <
ffff88007d17e800 533606798 C Ci:1:000:0 0 18 = 12010002 00000040 38171152 01001020 0001
ffff88007d17e800 533606846 S Co:1:001:0 s 23 03 0004 0002 0000 0
ffff88007d17e800 533606874 C Co:1:001:0 0 0
ffff88007d17e800 533657114 S Ci:1:001:0 s a3 00 0000 0002 0004 4 <
ffff88007d17e800 533657223 C Ci:1:001:0 0 4 = 03051000
ffff88007d17e800 533708120 S Co:1:001:0 s 23 01 0014 0002 0000 0
ffff88007d17e800 533708208 C Co:1:001:0 0 0
ffff88007d17e800 533708210 S Co:1:000:0 s 00 05 0007 0000 0000 0
ffff88007d17e800 533708392 C Co:1:000:0 0 0
ffff88007d17e800 533720005 S Ci:1:007:0 s 80 06 0100 0000 0012 18 <
ffff88007d17e800 533723676 C Ci:1:007:0 0 18 = 12010002 00000040 38171152 01001020 0001
ffff88007d17e800 533723727 S Ci:1:007:0 s 80 06 0200 0000 0009 9 <
ffff88007d17e800 533729013 C Ci:1:007:0 0 9 = 09021900 01013080 f9
ffff88007d17e800 533729204 S Ci:1:007:0 s 80 06 0200 0000 0019 25 <
ffff88007d17e800 533730746 C Ci:1:007:0 0 25 = 09021900 01013080 f9090400 0001ffff ff400705 01020002 00
ffff88007d17e800 533730839 S Ci:1:007:0 s 80 06 0300 0000 00ff 255 <
ffff88007d17e800 533736109 C Ci:1:007:0 0 4 = 04030904
ffff88007d17e800 533736173 S Ci:1:007:0 s 80 06 0320 0409 00ff 255 <
ffff88007d17e800 533737232 C Ci:1:007:0 0 16 = 10034100 55005300 42004400 54005600
ffff88007d17e800 533737296 S Ci:1:007:0 s 80 06 0310 0409 00ff 255 <
ffff88007d17e800 533737918 C Ci:1:007:0 0 14 = 0e034100 53004900 43004500 4e00
ffff88007d17e200 533740300 S Co:1:007:0 s 00 09 0001 0000 0000 0
ffff88007d17e200 533743431 C Co:1:007:0 0 0
ffff88007d17e200 533743457 S Ci:1:007:0 s 80 06 0330 0409 00ff 255 <
ffff88007d17e200 533744291 C Ci:1:007:0 0 20 = 14034c00 6f006100 64006500 72002000 43003100
ffff88007d17e440 533744350 S Ci:1:007:0 s 80 06 0340 0409 00ff 255 <
ffff88007d17e440 533745173 C Ci:1:007:0 0 20 = 14034c00 6f006100 64006500 72002000 49003000
ffff88007d17e440 533745248 S Co:1:007:0 s 40 ab 0000 5399 0200 512 [firmware or device-identity payload omitted]
ffff88007d17e440 533750248 C Co:1:007:0 0 512 >
ffff88007d17e440 533750304 S Co:1:007:0 s 40 ab 0200 5399 0200 512 [firmware or device-identity payload omitted]
ffff88007d17e440 533755395 C Co:1:007:0 0 512 >
ffff88007d17e440 533755450 S Co:1:007:0 s 40 ab 0400 5399 0200 512 [firmware or device-identity payload omitted]
ffff88007d17e440 533760687 C Co:1:007:0 0 512 >
ffff88007d17e440 533760760 S Co:1:007:0 s 40 ab 0600 5399 0200 512 [firmware or device-identity payload omitted]
ffff88007d17e440 533765818 C Co:1:007:0 0 512 >
ffff88007d17e440 533765875 S Co:1:007:0 s 40 ab 0800 5399 0200 512 [firmware or device-identity payload omitted]
ffff88007d17e440 533770955 C Co:1:007:0 0 512 >
ffff88007d17e440 533770980 S Co:1:007:0 s 40 ab 0a00 5399 0200 512 [firmware or device-identity payload omitted]
ffff88007d17e440 533776413 C Co:1:007:0 0 512 >
ffff88007d17e440 533776465 S Co:1:007:0 s 40 ab 2000 5399 0200 512 [firmware or device-identity payload omitted]
ffff88007d17e440 533781730 C Co:1:007:0 0 512 >
ffff88007d17e440 533781813 S Co:1:007:0 s 40 ab 2200 5399 0200 512 [firmware or device-identity payload omitted]
ffff88007d17e440 533786869 C Co:1:007:0 0 512 >
ffff88007d17e440 533786922 S Co:1:007:0 s 40 ab 2800 5399 0200 512 [firmware or device-identity payload omitted]
ffff88007d17e440 533792254 C Co:1:007:0 0 512 >
ffff88007d17e440 533792299 S Co:1:007:0 s 40 ab 2a00 5399 0200 512 [firmware or device-identity payload omitted]
ffff88007d17e440 533797325 C Co:1:007:0 0 512 >
ffff88007d17e440 533797460 S Co:1:007:0 s 40 ab 2c00 5399 0200 512 [firmware or device-identity payload omitted]
ffff88007d17e440 533802483 C Co:1:007:0 0 512 >
ffff88007d17e440 533802572 S Co:1:007:0 s 40 ab 2e00 5399 0200 512 [firmware or device-identity payload omitted]
ffff88007d17e440 533807568 C Co:1:007:0 0 512 >
ffff88007d17e440 533807597 S Co:1:007:0 s 40 ab 3000 5399 0200 512 [firmware or device-identity payload omitted]
ffff88007d17e440 533813279 C Co:1:007:0 0 512 >
ffff88007d17e440 533813424 S Co:1:007:0 s 40 ab 3200 5399 0200 512 [firmware or device-identity payload omitted]
ffff88007d17e440 533820334 C Co:1:007:0 0 512 >
ffff88007d17e440 533820374 S Co:1:007:0 s 40 ab 3400 5399 0200 512 [firmware or device-identity payload omitted]
ffff88007d17e440 533827404 C Co:1:007:0 0 512 >
ffff88007d17e440 533827459 S Co:1:007:0 s 40 ab 3600 5399 0200 512 [firmware or device-identity payload omitted]
ffff88007d17e440 533832535 C Co:1:007:0 0 512 >
ffff88007d17e440 533832575 S Co:1:007:0 s 40 ab 3800 5399 0200 512 [firmware or device-identity payload omitted]
ffff88007d17e440 533837700 C Co:1:007:0 0 512 >
ffff88007d17e440 533837764 S Co:1:007:0 s 40 ab 3a00 5399 0200 512 [firmware or device-identity payload omitted]
ffff88007d17e440 533842979 C Co:1:007:0 0 512 >
ffff88007d17e440 533843008 S Co:1:007:0 s 40 ab 3c00 5399 0200 512 [firmware or device-identity payload omitted]
ffff88007d17e440 533848553 C Co:1:007:0 0 512 >
ffff88007d17e440 533848624 S Co:1:007:0 s 40 ac 3e00 5399 0200 512 [firmware or device-identity payload omitted]
ffff88007d17e440 533853569 C Co:1:007:0 0 512 >
ffff88007d17e980 535257515 C Ii:1:001:1 0:2048 1 = 04
ffff88007d17e980 535257525 S Ii:1:001:1 -115:2048 4 <
ffff88007d17e680 535257579 S Ci:1:001:0 s a3 00 0000 0002 0004 4 <
ffff88007d17e680 535257596 C Ci:1:001:0 0 4 = 00010100
ffff88007d17e680 535257598 S Co:1:001:0 s 23 01 0010 0002 0000 0
ffff88007d17e680 535257619 C Co:1:001:0 0 0
ffff88007d17e800 535257809 S Ci:1:001:0 s a3 00 0000 0002 0004 4 <
ffff88007d17e800 535257820 C Ci:1:001:0 0 4 = 00010000
ffff88007d17e800 535282948 S Ci:1:001:0 s a3 00 0000 0002 0004 4 <
ffff88007d17e800 535282982 C Ci:1:001:0 0 4 = 00010000
ffff88007d17e800 535309086 S Ci:1:001:0 s a3 00 0000 0002 0004 4 <
ffff88007d17e800 535309122 C Ci:1:001:0 0 4 = 00010000
ffff88007d17e800 535335091 S Ci:1:001:0 s a3 00 0000 0002 0004 4 <
ffff88007d17e800 535335157 C Ci:1:001:0 0 4 = 00010000
ffff88007d17e800 535361006 S Ci:1:001:0 s a3 00 0000 0002 0004 4 <
ffff88007d17e800 535361042 C Ci:1:001:0 0 4 = 00010000
ffff88007d17e980 537258536 C Ii:1:001:1 0:2048 1 = 04
ffff88007d17e980 537258546 S Ii:1:001:1 -115:2048 4 <
ffff88007d17e800 537258618 S Ci:1:001:0 s a3 00 0000 0002 0004 4 <
ffff88007d17e800 537258653 C Ci:1:001:0 0 4 = 01050100
ffff88007d17e800 537258655 S Co:1:001:0 s 23 01 0010 0002 0000 0
ffff88007d17e800 537258675 C Co:1:001:0 0 0
ffff88007d17e800 537258677 S Ci:1:001:0 s a3 00 0000 0002 0004 4 <
ffff88007d17e800 537258684 C Ci:1:001:0 0 4 = 01050000
ffff88007d17e800 537284064 S Ci:1:001:0 s a3 00 0000 0002 0004 4 <
ffff88007d17e800 537284081 C Ci:1:001:0 0 4 = 01050000
ffff88007d17e800 537310014 S Ci:1:001:0 s a3 00 0000 0002 0004 4 <
ffff88007d17e800 537310047 C Ci:1:001:0 0 4 = 01050000
ffff88007d17e800 537335985 S Ci:1:001:0 s a3 00 0000 0002 0004 4 <
ffff88007d17e800 537336042 C Ci:1:001:0 0 4 = 01050000
ffff88007d17e800 537362149 S Ci:1:001:0 s a3 00 0000 0002 0004 4 <
ffff88007d17e800 537362283 C Ci:1:001:0 0 4 = 01050000
ffff88007d17e800 537362299 S Co:1:001:0 s 23 03 0004 0002 0000 0
ffff88007d17e800 537362327 C Co:1:001:0 0 0
ffff88007d17e800 537412975 S Ci:1:001:0 s a3 00 0000 0002 0004 4 <
ffff88007d17e800 537561545 C Ci:1:001:0 0 4 = 03051000
ffff88007d17e800 537612146 S Co:1:001:0 s 23 01 0014 0002 0000 0
ffff88007d17e800 537612207 C Co:1:001:0 0 0
ffff88007d17e800 537612217 S Ci:1:000:0 s 80 06 0100 0000 0040 64 <
ffff88007d17e800 537612912 C Ci:1:000:0 0 18 = 12010002 00000040 060b0500 01001020 0001
ffff88007d17e800 537612970 S Co:1:001:0 s 23 03 0004 0002 0000 0
ffff88007d17e800 537613000 C Co:1:001:0 0 0
ffff88007d17e800 537664276 S Ci:1:001:0 s a3 00 0000 0002 0004 4 <
ffff88007d17e800 537664614 C Ci:1:001:0 0 4 = 03051000
ffff88007d17e800 537715063 S Co:1:001:0 s 23 01 0014 0002 0000 0
ffff88007d17e800 537715227 C Co:1:001:0 0 0
ffff88007d17e800 537715237 S Co:1:000:0 s 00 05 0008 0000 0000 0
ffff88007d17e800 537715668 C Co:1:000:0 0 0
ffff88007d17e800 537726977 S Ci:1:008:0 s 80 06 0100 0000 0012 18 <
ffff88007d17e800 537731516 C Ci:1:008:0 0 18 = 12010002 00000040 060b0500 01001020 0001
ffff88007d17e800 537731555 S Ci:1:008:0 s 80 06 0200 0000 0009 9 <
ffff88007d17e800 537734345 C Ci:1:008:0 0 9 = 09023000 02013080 fa
ffff88007d17e800 537734433 S Ci:1:008:0 s 80 06 0200 0000 0030 48 <
ffff88007d17e800 537737282 C Ci:1:008:0 0 48 = 09023000 02013080 fa090400 0002ffff ff200705 81020002 00070582 02000200
ffff88007d8c2980 537737315 S Ci:1:008:0 s 80 06 0300 0000 00ff 255 <
ffff88007d8c2980 537738181 C Ci:1:008:0 0 4 = 04030904
ffff88007d8c2980 537738218 S Ci:1:008:0 s 80 06 0320 0409 00ff 255 <
ffff88007d8c2980 537744057 C Ci:1:008:0 0 34 = 22034800 44005400 56002000 50005800 2d005700 33005500 33000000 00000000
ffff88007d8c2980 537744079 S Ci:1:008:0 s 80 06 0310 0409 00ff 255 <
ffff88007d8c2980 537745445 C Ci:1:008:0 0 22 = 16034900 53004400 42000000 00000000 00000000 0000
ffff88007d17e200 537745563 S Co:1:008:0 s 00 09 0001 0000 0000 0
ffff88007d17e200 537751132 C Co:1:008:0 0 0
ffff88007d17e200 537751271 S Ci:1:008:0 s 80 06 0330 0409 00ff 255 <
ffff88007d17e200 537751933 C Ci:1:008:0 0 22 = 16034400 54005600 20004300 4f004e00 46004900 4700
ffff88007d17e440 537751994 S Ci:1:008:0 s 80 06 0320 0409 00ff 255 <
ffff88007d17e440 537752635 C Ci:1:008:0 0 34 = 22034800 44005400 56002000 50005800 2d005700 33005500 33000000 00000000
ffff88007d8c2d40 537752771 S Ci:1:008:0 s 80 06 0340 0409 00ff 255 <
ffff88007d8c2d40 537753421 C Ci:1:008:0 0 32 = 20034800 44005400 56002000 49005200 32004800 49004400 00000000 00000000
ffff88007d955c00 567710911 S Ci:1:004:0 s c0 07 0000 0000 0001 1 <
ffff88007d955c00 567711438 C Ci:1:004:0 0 1 = 01
ffff88007d955c00 567711551 S Ci:1:004:0 s c0 07 0001 0000 0001 1 <
ffff88007d955c00 567717035 C Ci:1:004:0 0 1 = 01
ffff88007d955c00 567717203 S Ci:1:004:0 s c0 08 dfdf 0000 0001 1 <
ffff88007d955c00 567717876 C Ci:1:004:0 0 1 = ff
ffff88007d955c00 567717968 S Ci:1:004:0 s c0 08 0000 0000 0001 1 <
ffff88007d955c00 567718587 C Ci:1:004:0 0 1 = ff
ffff88007d955c00 567718669 S Ci:1:004:0 s c0 11 0000 0000 0001 1 <
ffff88007d955c00 567719282 C Ci:1:004:0 0 1 = 02
ffff88007d955c00 567719486 S Ci:1:004:0 s 80 08 0000 0000 0001 1 <
ffff88007d955c00 567725083 C Ci:1:004:0 0 1 = 01
